Participante,Texto,Sentimiento,Palabras,Dia,Mes,Anio
HUGO LOPEZ-GATELL RAMIREZ,"Y el mecanismo está integrado por la Dirección General de Epidemiología, quien lo coordina, a cargo del doctor Alomía; Cofepris, que tiene su unidad de farmacovigilancia; el Centro Nacional para la Salud de la Infancia y la Adolescencia, por ser responsable del Programa Nacional de Vacunación; y también tenemos una vinculación que ha sido muy productiva con nuestro Grupo Técnico Asesor de Vacunas, el GTAV; y también con la Comisión Coordinadora de los Institutos Nacionales de Salud donde el doctor Gustavo Reyes Terán, el titular, no ayudó a integrar un panel de médicas y médicos especialistas que dictaminan cada uno de los casos que son de consideración, que son más graves.",0.0,111,26,05,2021
HUGO LOPEZ-GATELL RAMIREZ,"Y esto se hace también con la participación estatal. A cada entidad federativa se le comunican aquellos eventos que fueron analizados, desde luego, el informe proviene de las entidades federativas en forma primaria, y conjuntamente con las entidades federativas se van teniendo sesiones de dictaminación.",0.0,45,26,05,2021
HUGO LOPEZ-GATELL RAMIREZ,HUGO LÓPEZ-GATELL RAMÍREZ: La industria farmacéutica estaría desde luego en posibilidades -si tiene datos- de compartirlos y los debe compartir con la autoridad. Todas las autorizaciones de uso de emergencia están especificadas para tener también la responsabilidad de las compañías farmacéuticas de hacer farmacovigilancia y compartir la información de farmacovigilancia.,0.0,50,26,05,2021
HUGO LOPEZ-GATELL RAMIREZ,"Entonces, efectivamente, en el Centro Nacional de Farmacovigilancia de Cofepris se incorpora esa información y se analiza conjuntamente con la que recaba el Gobierno de México.",0.0,26,26,05,2021
HUGO LOPEZ-GATELL RAMIREZ,HUGO LÓPEZ-GATELL RAMÍREZ: Muchas gracias.,0.0,5,26,05,2021
HUGO LOPEZ-GATELL RAMIREZ,"Nos da tiempo para una última pregunta, Miguel, por favor, Miguel Ricaud, adelante.",0.0,13,26,05,2021
HUGO LOPEZ-GATELL RAMIREZ,"HUGO LÓPEZ-GATELL RAMÍREZ: Muy bien. Pues aquí terminamos. Le agradecemos mucho al doctor Juan Carlos Martínez Heine, secretario de Salud del estado de Oaxaca; al gobernador Alejandro Murat Hinojosa también, por el trabajo que han hecho por detener la epidemia en el estado de Oaxaca, por la buenacoordinación, efectivamente, es una de las situaciones de mayor satisfacción que tenemos, esta buena coordinación. Y gracias por venir aquí, Juan Carlos, te agradecemos mucho compartir la experiencia.",0.0,75,26,05,2021
HUGO LOPEZ-GATELL RAMIREZ,"Muchas gracias. Seguimos, nos vemos mañana aquí. Gracias.",0.0,8,26,05,2021
HUGO LOPEZ-GATELL RAMIREZ,---,0.0,1,26,05,2021
