Participante,Texto,Sentimiento,Palabras,Dia,Mes,Anio
RUY LOPEZ RIDAURA,"En efecto, digo, además se está haciendo el esfuerzo para su incorporación temprana y el IMSS está haciendo un gran esfuerzo, hizo un llamado también para incrementar su número de plazas y poder incorporar a un grupo importante de personal de salud en el IMSS que tiene contratos todavía eventuales, pero durante mucho tiempo que se han ido incorporando, y también se dio la oportunidad de incorporar residentes en este grupo de trabajo para empezar en su trayectoria ya como profesionales con base, y este es un proceso que va a tomar tiempo.",0.0,93,28,02,2021
RUY LOPEZ RIDAURA,"Pero con mucho gusto específicamente el número y el cómo se realizó, pues le pediremos también al maestro Zoé Robledo que lo pueda comentar posiblemente en el Pulso de la Salud.",0.0,31,28,02,2021
RUY LOPEZ RIDAURA,Gracias.,0.0,1,28,02,2021
RUY LOPEZ RIDAURA,"RUY LÓPEZ RIDAURA: Sí, gracias. No, desde el punto de vista de la Secretaría de Salud seguimos con la recomendación de solamente en el caso de las entidades en color verde puedan ir abriendo en pleno las actividades educativas; pero, como también yo mismo comenté la última vez que estuve en esta conferencia vespertina, estamos en una mesa de trabajo activa para ver la oportunidad de poder tener protocolos que se puedan seguir con mayor exactitud en las escuelas y buscar la opción de tener una apertura aún más temprana de lo que definimos en un inicio, que sigue siendo vigente, que es: desde la Secretaría de Salud la recomendación es que se inicie cuando las entidades entren en el semáforo verde, pero esto puede cambiar, estamos en discusión con los grupos técnicos y por lo tanto… Pero no para empezando el 1º de marzo y ya será también tarea de la Secretaría de Educación Pública el poder trasmitir esto a todo el sector, tanto en el ámbito privado como en el ámbito público.",0.0,174,28,02,2021
RUY LOPEZ RIDAURA,"RUY LÓPEZ RIDAURA: Muchísimas gracias. Son importantes y sí le pediría si nos las hacen llegar para poderlo conversar. Creo que esto es una estrategia que también, como se ha dicho también desde un inicio antes de la pandemia, pero uno de los ejes importantes en la transformación, en el sector salud es la necesidad de cubrir esta gran brecha de personal de salud que tenemos de más de 200 mil.",0.0,71,28,02,2021
RUY LOPEZ RIDAURA,"Y tanto el Insabi está haciendo un esfuerzo muy importante como también todas las instituciones federales, incluido el IMSS, y por eso este esfuerzo reciente del IMSS creo que se enmarca en esta gran tarea, en esta gran necesidad, en esta gran urgencia.",0.0,43,28,02,2021
RUY LOPEZ RIDAURA,"Y con mucho gusto podemos comunicarla, las preguntas específicas para que se informe ya sea en el Pulso de la Salud o también podemos invitar a algún colega del IMSS a que en la vespertina pueda presentarlo.",0.0,37,28,02,2021
RUY LOPEZ RIDAURA,Gracias.,0.0,1,28,02,2021
RUY LOPEZ RIDAURA,"RUY LÓPEZ RIDAURA: Muchas gracias, buen inicio de semana. Gracias, Gaby.",0.0,11,28,02,2021
RUY LOPEZ RIDAURA,---,0.0,1,28,02,2021
