Participante,Texto,Sentimiento,Palabras,Dia,Mes,Anio
KARLA BERDICHEVSKY FELDMAN," Muchas gracias, doctor López-Gatell.",0.0,4,3,08,2020
KARLA BERDICHEVSKY FELDMAN,"Como mencionaba, hoy se conmemora el Día Internacional de la Planificación Familiar y quisiéramos comenzar con proyectar un video que nos hizo favor de producir la maestra Gabriela Rodríguez, ella es la secretaria general del Consejo Nacional de Población, el Conapo, con quien trabajamos muy estrechamente sobre estos temas para calcular las proyecciones del impacto que ha tenido la epidemia de COVID en nuestro país.",0.0,65,3,08,2020
KARLA BERDICHEVSKY FELDMAN,"Si nos puede proyectar el primer video, por favor.",0.0,9,3,08,2020
KARLA BERDICHEVSKY FELDMAN," Entonces, en respuesta a estas proyecciones que presenta muy acertadamente el Consejo Nacional de Población y a quienes agradecemos por trabajar tan estrechamente con la Secretaría de Salud con estas proyecciones, estamos desde la Secretaría de Salud promoviendo muy intensamente que estos retos ante la reconversión de hospitales por COVID-19 no representen un obstáculo para acceder a todos los servicios de salud sexual y reproductiva, que son esenciales, incluido el que estamos conversando el día de hoy sobre la planificación familiar o la anticoncepción, y para ello reiterar que estos servicios continúan durante la emergencia sanitaria y toda mujer decide si quiere o no tener hijos y cuándo.",0.0,108,3,08,2020
KARLA BERDICHEVSKY FELDMAN,"Entonces, nos preguntamos, ¿cuándo es un buen momento para decidir sobre el cuerpo, sobre la vida sexual y reproductiva?",0.0,19,3,08,2020
KARLA BERDICHEVSKY FELDMAN,"Realmente esta pregunta se responde en todas las etapas de la vida a partir de la adolescencia. Todos los adolescentes tienen derecho a acceder a esta información, pero también a acceder a los servicios públicos que están disponibles en todo nuestro país.",0.0,42,3,08,2020
KARLA BERDICHEVSKY FELDMAN,"Es importante considerar que también es un buen momento el espacio después del embarazo y el momento después de un aborto, son muy oportunos para tomar estas decisiones, incluso toda mujer que se embaraza ya debe estar pensando cómo se va a proteger una vez concluya el evento obstétrico.",0.0,49,3,08,2020
KARLA BERDICHEVSKY FELDMAN,"Además, sabemos que algunos de estos métodos tienen efectos secundarios en algunas mujeres y siempre es un momento para pensar si el método anticonceptivo es el que conviene, es el que elige la mujer, porque se puede acceder a la diversidad de métodos que tenemos disponibles y si uno cambia sus planes reproductivos también puede cambiar u optar por un método distinto.",0.0,62,3,08,2020
KARLA BERDICHEVSKY FELDMAN,"Tenemos a nivel nacional una gran variedad, nos honra decir que tenemos uno de los sistemas de salud que provee una de las mayores diversidades de métodos anticonceptivos que están disponibles a nivel nacional y de forma gratuita, hay métodos que son temporales, hay métodos que ofrecen protección de una forma prolongada de tres a 10 años.",0.0,57,3,08,2020
KARLA BERDICHEVSKY FELDMAN,"Y aquí tenemos una diversidad de lo que ofrecemos, que van desde los dispositivos intrauterinos, las inyecciones, los implantes subdérmicos, los métodos definitivos que son quirúrgicos, la vasectomía y la oclusión tubaria bilateral, también los métodos orales, las pastillas anticonceptivas, los parches y la anticoncepción de emergencia; además, están disponibles en todo nuestro país los condones, el condón masculino y el condón femenino, que no debemos olvidar, además de ofrecer una protección anticonceptiva ofrecen protección contra enfermedades, infecciones de transmisión sexual como puede ser el VIH.",0.0,86,3,08,2020
KARLA BERDICHEVSKY FELDMAN,"Esas 15 claves de métodos anticonceptivos están disponibles en todo el país e incluyen la anticoncepción de emergencia, la recomendamos, porque mucha gente no sabe que está disponible dentro de esta gama de métodos anticonceptivos y se puede utilizar si fallo uno de los métodos o si no se utilizó un método anticonceptivo en la relación sexual.",0.0,57,3,08,2020
KARLA BERDICHEVSKY FELDMAN,"Todas las mujeres tienen derecho a prevenir un embarazo no deseado por medio de la anticoncepción de emergencia y simplemente tienen que llegar a solicitarlo, se debe otorgar de forma gratuita como el resto de los métodos.",0.0,37,3,08,2020
KARLA BERDICHEVSKY FELDMAN,"Y es importante reiterar que este es un método importante ante una violación sexual, cuando seguramente la mujer no tiene la intención de un embarazo, y entonces hay una temporalidad para acceder a la protección a través de la anticoncepción de emergencia, que son las primeras 120 horas.",0.0,48,3,08,2020
KARLA BERDICHEVSKY FELDMAN,"Además, es importante es recordar que si una mujer queda embarazada por una violación sexual, no tuvo oportunidad de acceder a la anticoncepción de emergencia, en todo nuestro país los códigos penales de cada una de las 32 entidades federativas amparan el derecho al acceso a un aborto seguro en caso de una violación, esta es una causal que está vigente en toda la legislación del país y además hay posibilidad de acceder a aborto seguro por otras causales en la Ciudad de México y en el estado de Oaxaca, y se puede acceder a una interrupción del embarazo de forma voluntaria.",0.0,102,3,08,2020
KARLA BERDICHEVSKY FELDMAN,"Es importante recordar lo que nos mencionaba la maestra Rodríguez en cuanto a los servicios para adolescentes. Los anticonceptivos están igualmente disponibles para la población adolescente, esto está amparado en la normativa, en la Norma 047, y todo adolescente debe recibir servicios de salud sexual y reproductiva adecuado para su edad.",0.0,51,3,08,2020
KARLA BERDICHEVSKY FELDMAN,"Esto es universal en todos los servicios de salud e igualmente no solamente son los servicios que deben recibir los adolescentes, sino la información para ejercer su sexualidad de manera libre y autónoma que les permita garantizar maternidades y paternidades elegidas y deseadas, pero, como mencionábamos sobre la disponibilidad de los condones, también protegerse de infecciones de transmisión sexual, incluido el VIH.",0.0,62,3,08,2020
KARLA BERDICHEVSKY FELDMAN,"Para ello, todas las unidades de nuestro país les dan la bienvenida a las y los adolescentes para acceder a estos servicios; sin embargo, también existen unos servicios que están dedicados a las y los adolescentes, son los servicios amigables, están ubicados en las 32 entidades federativas de nuestro país, dependientes de la Secretaría de Salud hay más de dos mil 700 servicios y tenemos un directorio de los servicios, está disponible en la página del Centro Nacional de Equidad de Género y Salud Reproductiva donde encontrarán la ubicación para poder acceder a los mismos.",0.0,95,3,08,2020
KARLA BERDICHEVSKY FELDMAN,"Queremos agradecer a los servicios de San Marcos, Aguascalientes, porque nos compartieron el siguiente video. Por favor, lo pueden proyectar.",0.0,20,3,08,2020
KARLA BERDICHEVSKY FELDMAN, Este es un ejemplo de cómo trabajamos con adolescentes de todo nuestro país.,0.0,13,3,08,2020
KARLA BERDICHEVSKY FELDMAN,"Ellos son voluntarios, trabajan en red con los servicios amigables y normalmente hacen actividades de promoción de estos servicios amigables, ayudan a vincular a las y los adolescentes a los servicios y a facilitar el acceso a la información y ahora con las medidas de confinamiento también están muy activos a través de las redes sociales, este es un ejemplo de lo que ocurre en Aguascalientes, pero realmente estas redes a nivel nacional están vinculadas con todos los servicios. Invitamos a todas y a todos a buscarlos también en las redes sociales.",0.0,92,3,08,2020
KARLA BERDICHEVSKY FELDMAN,"Y, finalmente, invitar a todas y a todos quienes nos están escuchando, hoy a la prensa para que pueda difundir este mensaje. Tenemos una línea sin costo, aquí la pueden ver es 800 624 64 64, se puede acceder de todo el país y aquí podemos encontrar sobre todo información sobre los diferentes métodos anticonceptivos que están disponibles, pero también se ofrece una gama amplia para responder a preguntas sobre salud sexual o reproductiva, incluso los servicios de aborto seguro que tenemos en el país.",0.0,85,3,08,2020
KARLA BERDICHEVSKY FELDMAN,Y nuevamente recordarles la página del Centro Nacional de Equidad de Género y Salud Reproductiva donde tenemos desplegada fichas informativas sobre los diferentes métodos anticonceptivos que están disponibles en todo nuestro país.,0.0,32,3,08,2020
KARLA BERDICHEVSKY FELDMAN,Muchas gracias.,0.0,2,3,08,2020
