Participante,Texto,Sentimiento,Palabras,Dia,Mes,Anio
HUGO LOPEZ-GATELL RAMIREZ," Muchas gracias, doctor Alomía.",0.0,4,1,05,2020
HUGO LOPEZ-GATELL RAMIREZ,"Voy a introducir el segundo tema, que es continuidad de lo que esta mañana conversábamos en la presentación de la conferencia matutina del presidente.",0.0,24,1,05,2020
HUGO LOPEZ-GATELL RAMIREZ,"En la mañana lo que decíamos, quiero retomar sobre su atención, es una muy buena noticia de la que hemos estado hablando por semanas, pero es este asunto de que las epidemias o esta epidemia en particular pasa con otro tipo de epidemias semejantes, no se distribuyen en el territorio de una manera uniforme, esto quiere decir que no tenemos al mismo tiempo la misma intensidad de propagación de COVID o del virus causante de COVID, SARS-CoV-2 en el territorio nacional.",0.0,81,1,05,2020
HUGO LOPEZ-GATELL RAMIREZ,"Lo que tenemos es zonas, particularmente las zonas urbanas, las metrópolis donde existe mayor intensidad de transmisión y zonas menos pobladas, hay menor intensidad de transmisión.",0.0,26,1,05,2020
HUGO LOPEZ-GATELL RAMIREZ,"Como le hemos dado seguimiento a lo largo de varias semanas, incluso con un mapa municipal, y lo acaba de hacer el doctor Alomía con este informe diario, hay cinco áreas del país o cinco zonas del país en donde existe alta transmisión y en el resto del país existe un mixto de zonas donde hay muy poca transmisión, porque son zonas un poco pobladas y en la mayoría de ellas se mantiene una transmisión muy leve en términos del número de casos diarios, o bien zonas en donde siendo urbes muy grandes, siendo ciudades grandes, metrópolis, todavía no entra en una fase de alta transmisión.",0.0,106,1,05,2020
HUGO LOPEZ-GATELL RAMIREZ,"Y aquí destaco el caso de Guadalajara y su zona metropolitana y el caso de Monterrey y su zona metropolitana. Estas dos ciudades a lo largo de los últimos 15 días se han mantenido con una transmisión muy, muy baja y muy probablemente esto es consecuencia de que los primeros casos en estas dos metrópolis están cerca de 24 o 26 días después del primer caso, nosotros tuvimos el punto con Guadalajara, en la Ciudad de México tuvimos el primer caso el 28 de febrero, Guadalajara tuvo su primer caso el 22 de marzo.",0.0,94,1,05,2020
HUGO LOPEZ-GATELL RAMIREZ,"Entonces, en el momento en que ya se instauraron las medidas de la Jornada Nacional de Sana Distancia, la suspensión de las escuelas empezó el 23, de hecho, el gobierno de Jalisco había anticipado desde el 17 la suspensión de actividades, inmediatamente después de que el 14, el sábado 14, el Consejo Nacional Educativo, que coordina y preside el secretario de Educación, Esteban Moctezuma Barragán.",0.0,65,1,05,2020
HUGO LOPEZ-GATELL RAMIREZ,"En esa sesión determinó este Consejo Nacional Educativo la suspensión de las actividades escolares, pero en su momento se decidió que aquellos estados que pudieran entrar en suspensión inmediata así lo hicieran -fue el caso de Jalisco- aquellos que necesitaran un tiempo de adaptación se tomaran una semana de adaptación y se suspendieran hasta el 23.",0.0,56,1,05,2020
HUGO LOPEZ-GATELL RAMIREZ,"Pero el caso es que tuvo un efecto neto muy positivo de inhibir o interrumpir, o mantener en este momento sin alta transmisión.",0.0,23,1,05,2020
HUGO LOPEZ-GATELL RAMIREZ,"Habiendo dicho esto, lo que ahorita queremos comentarles -porque deriva en lo que comentará la jefa de Gobierno y el director del IMSS- es que, para las cinco zonas, las ciudades en donde hay alta trasmisión, hemos rearticulado los mecanismos de coordinación del sector salud, tanto de las instituciones nacionales como de las instituciones locales.",0.0,55,1,05,2020
HUGO LOPEZ-GATELL RAMIREZ,"En este caso hablaré, ellos comentarán específicamente del modelo en la Ciudad de México, pero yo me limitaré a presentar estas cinco zonas para que todos las tengan claras y sepamos en qué estado van de la epidemia. Y en todos los casos el diagrama lo que muestra: cada ciudad tiene su diagrama y es producto de estos ejercicios de modelación matemática que ha hecho un grupo académico muy talentoso del Centro de Investigación en Matemáticas y del Instituto de Matemáticas de la UNAM coordinados por el Conacyt.",0.0,88,1,05,2020
HUGO LOPEZ-GATELL RAMIREZ,"En este diagrama vemos entonces… Recuerden cómo se lee esta manera de presentar las fechas con un punto decimal, 17.03 o 31.03 aquí quiere decir 31 de marzo, 28.04 quiere decir 28 de abril y es el tiempo.",0.0,38,1,05,2020
HUGO LOPEZ-GATELL RAMIREZ,"Y aquí lo que vemos es el número de casos esperados, proyectados, la predicción del número de casos y en la línea roja es donde con una probabilidad del 50 por ciento se van a presentar ese número de casos en cada una de las fechas.",0.0,46,1,05,2020
HUGO LOPEZ-GATELL RAMIREZ,"Y lo que vemos es que en el caso de Cancún, esto es Cancún, la predicción indica que se estará en un punto máximo justamente en estas fechas, de manera puntual es ayer, el 30 de abril.",0.0,37,1,05,2020
HUGO LOPEZ-GATELL RAMIREZ,"Esta tarde conversé con la secretaria de Salud del estado de Quintana Roo, la doctora Alejandra Aguirre Crespo, una profesional muy destacada de la salud pública. Me comenta que todavía no se manifiesta en los datos observados este punto de inflexión, este punto de disminución, pero han notado ya una menor afluencia o una estabilización por lo menos de la afluencia de pacientes, pero estamos muy cerca en que empiecen a bajar y Cancún estaría ya próximo a salir de la epidemia.",0.0,82,1,05,2020
HUGO LOPEZ-GATELL RAMIREZ,"Ahora, quiero dejar una cosa muy en claro, porque esto aplica para las cinco ciudades que vamos a comentar.",0.0,19,1,05,2020
HUGO LOPEZ-GATELL RAMIREZ,"Lo que vamos a ver es que algunas cuatro de ellas están en el punto medio y esto quiere decir que ya se ve luz al final del túnel, por usar una expresión ilustrativa, ya de esperanza, de que empieza a cambiar la tendencia de la epidemia, ya no están en este ascenso continuo en el número diario de casos; pero eso de ninguna manera quiere decir que se pueden relajar o suspender anticipadamente las medidas de la Jornada Nacional de San Distancia.",0.0,83,1,05,2020
HUGO LOPEZ-GATELL RAMIREZ,"La interrupción temporal de los trabajos no esenciales, la interrupción de las actividades escolares y la limitación de reuniones en el espacio público, de ninguna manera, porque ¿qué pasaría si se suspenden anticipadamente las intervenciones?, esto regresa hacia arriba, hay un rebrote y no queremos que haya un rebrote. Por eso decimos siempre que presentamos estas predicciones, estas predicciones son válidas si y solo si se mantienen las medidas de la Jornada de Sana Distancia que se resumen en quédate en casa.",0.0,82,1,05,2020
HUGO LOPEZ-GATELL RAMIREZ,"Y lo que estamos haciendo en el abordaje con esta reorganización, hoy varios de nosotras y nosotros hablamos con funcionarios de estas localidades o de estos estados, incluyendo el señor presidente que habló con los gobernadores de los cuatro estados restantes y obviamente con la jefa de Gobierno, quien estuvo aquí esta mañana.",0.0,53,1,05,2020
HUGO LOPEZ-GATELL RAMIREZ,"Lo que estamos viendo es que la disponibilidad existente de camas, esto es centrándonos en el elemento de mayor preocupación, que es la terapia intensiva, los pacientes en estado crítico, todavía tiene la capacidad de cubrir la demanda, pero además hay una serie de acciones que se han hecho en las semanas recientes que lograron mantener la capacidad de respuesta.",0.0,60,1,05,2020
HUGO LOPEZ-GATELL RAMIREZ,"El Instituto de Salud para el Bienestar envió casi 500 recursos humanos, personal del equipo médico, médicos y enfermeras, y además se buscaron transferir pacientes a hospitales privados para ampliar el espacio en camas de hospitales públicos.",0.0,37,1,05,2020
HUGO LOPEZ-GATELL RAMIREZ,"Esto todavía no entra en vigor, pero esto es siguiendo el modelo que se hizo con el convenio con el sector privado.",0.0,22,1,05,2020
HUGO LOPEZ-GATELL RAMIREZ,"Entonces, aquí Quintana Roo, esto lo habló el presidente hoy con el gobernador Carlos Joaquín, por quien también expreso mi respeto por su enorme dedicación a este tema, y se planteó que ellos pueden tener hospitales privados, porque ahí hay hospitales privados, que se adhieran al convenio.",0.0,47,1,05,2020
HUGO LOPEZ-GATELL RAMIREZ,"Pero lo nuevo, que no entraré en detalle, porque ahorita lo comentará el director del IMSS, es que el Instituto Mexicano del Seguro Social puede además ofrecer, en esta nueva modalidad la cobertura de servicios para la atención COVID en personas no aseguradas.",0.0,43,1,05,2020
HUGO LOPEZ-GATELL RAMIREZ,"Baja California, e Baja California, como lo comentamos también, existen dos ciudades que en cierta manera forman manera forman parte de una misma región de trasmisión, una misma región epidemiológica, aunque son dos ciudades completamente separadas, pero que tienen una gran conectividad, la más afectada, de inicio, fue Tijuana, pero también ha tenido repercusiones sobre lo ocurre en Mexicali.",0.0,59,1,05,2020
HUGO LOPEZ-GATELL RAMIREZ,"En ambos casos estamos cerca de la parte de declive, no está la etiqueta, pero si no recuerdo mal, está es Tijuana y está justo ya en la parte cercana a lo intermedio en más o menos al mismo tiempo que la Ciudad de México, el 6 al 8 de mayo, y ya empezaría a estar en la zona de declive, en la disminución de casos.",0.0,66,1,05,2020
HUGO LOPEZ-GATELL RAMIREZ,"Y esta, si no tengo mal la memoria, es Mexicali, que también estaría ya experimentando cerca de los primeros días de mayo, en los próximos tres a cuatro días, ya esta zona un poquito más amplia de estabilización y posterior reducción.",0.0,41,1,05,2020
HUGO LOPEZ-GATELL RAMIREZ,"Pero lo mismo, ni en Tijuana ni en Mexicali se deben suspender las medidas de la Jornada de Sana Distancia, porque habría un altísimo riesgo de rebrote, aquí mayor que el de Cancún por el tamaño poblacional, por la interconectividad con Mexicali y por la densidad poblacional de varios de los asentamientos urbanos en Tijuana particularmente.",0.0,56,1,05,2020
HUGO LOPEZ-GATELL RAMIREZ,¿Qué se ha hecho?,0.0,4,1,05,2020
HUGO LOPEZ-GATELL RAMIREZ,El gobierno del estado adquirió 70 ventiladores que pone a disposición del IMSS y del Issste con lo cual se podría incorporar lo que ahora comentará el maestro Robledo. También mi reconocimiento y respeto al gobernador Bonilla por la dedicación a todo este asunto. El Instituto de Salud para el Bienestar envió 284 miembros del equipo de salud.,0.0,58,1,05,2020
HUGO LOPEZ-GATELL RAMIREZ,"Culiacán, Sinaloa. En Culiacán, Sinaloa, ojo, lo que estoy presentando no son casos nuevos en general, se me olvidó especificar eso, en todos los casos son la ocupación de las terapias intensivas, la ocupación de terapias intensivas y lo que muestra la curva es en cada día cuántas personas estarían en la terapia intensiva. No son casos nuevos que ingresan a la terapia intensiva.",0.0,64,1,05,2020
HUGO LOPEZ-GATELL RAMIREZ,"En Culiacán también hay buenas noticias, porque incluso desde hace tres días ya pasaron esta zona del pico y es posible que empiecen a notar una estabilización como la que relaté de Cancún y una posterior reducción de los casos hospitalizados en la terapia intensiva.",0.0,45,1,05,2020
HUGO LOPEZ-GATELL RAMIREZ,"También mi respeto al gobernador Quirino Ordaz y a su secretario de Salud, el doctor Efrén Encinas.",0.0,17,1,05,2020
HUGO LOPEZ-GATELL RAMIREZ,¿Qué se ha hecho?,0.0,4,1,05,2020
HUGO LOPEZ-GATELL RAMIREZ,"Todavía la disponibilidad existente cubre la demanda, es decir, no están saturados, el Instituto de Salud para el Bienestar envió 641 miembros del personal, todos estos son los de la convocatoria Médicos del Bienestar, médicos y médicas, enfermeros y enfermeras y otro personal de salud; y además la Secretaría de la Defensa, en el contexto del Plan DN-III-E activará un hospital en Culiacán que en aproximadamente 10 días podrá atender personas adicionales y requieren 50 ventiladores cuya compra ya fue autorizada por parte del Insabi y llegaran en tiempo apropiado para la apertura.",0.0,93,1,05,2020
HUGO LOPEZ-GATELL RAMIREZ,"Se solucionó un problema concreto que había de oxígeno en el Hospital Civil, pues un asunto ingenieril que fue resuelto y se trasferirán pacientes también en el mismo sentido, anidados en el convenio que se firmó a nivel nacional.",0.0,39,1,05,2020
HUGO LOPEZ-GATELL RAMIREZ,"Villahermosa, Tabasco. Villahermosa todavía está en el punto de estabilidad, ya no está teniendo un incremento de casos, pero todavía no hay una señal clara de que esté en descenso.",0.0,30,1,05,2020
HUGO LOPEZ-GATELL RAMIREZ,"De acuerdo con la predicción, también estarían, ya aquí se empalman las etiquetas, una disculpa por ello, pero aquí lo que dice es 1º de mayo, entonces hoy estarían verificando esta fecha y es posible que en los próximos pocos días empiecen a notar una reducción en el número de casos nuevos.",0.0,52,1,05,2020
HUGO LOPEZ-GATELL RAMIREZ,"Pero ojo con la aclaración, les recuerdo, esto es ocupación de terapia intensiva, entonces, obviamente se reduciría el ingreso, el número de personas que ingresan a terapia, pero en la medida en que las personas con COVID grave permanecen en terapia intensiva por varios días, en promedio 10 días, todavía duraría la ocupación por un tiempo.",0.0,56,1,05,2020
HUGO LOPEZ-GATELL RAMIREZ,¿Qué se ha hecho?,0.0,4,1,05,2020
HUGO LOPEZ-GATELL RAMIREZ,"La demanda máxima supera en este caso la disponibilidad en 18 por ciento, una solicitud adicional de 60 monitores. Ya se enviaron algunos y también ventiladores y tres ambulancias. Esto lo está manejando el Insabi, quien ya envió 841 miembros del personal de salud. Nuestro agradecimiento al personal que se incorporó a la convocatoria de médicas y médicos del bienestar y por supuesto al maestro Juan Ferrer y al doctor Alejandro Svarch.",0.0,72,1,05,2020
HUGO LOPEZ-GATELL RAMIREZ,"Se van a reconvertir tres hospitales, Tabasco fue uno de los estados que más tempranamente tenía un diseño de reconversión. Aquí el gobernador Adán también ha estado muy al pendiente de esto y la secretaria Silvia Roldán, quien es una experta en salud pública, desde varias semanas atrás había planteado estos diseños justo para que entraran en operación en el momento apropiado.",0.0,62,1,05,2020
HUGO LOPEZ-GATELL RAMIREZ,El IMSS está apoyando con 17 ventiladores y los va a incorporar ahora que existe este nuevo planteamiento que hoy se comentará.,0.0,22,1,05,2020
HUGO LOPEZ-GATELL RAMIREZ,"Finalmente, el Valle de México. Esto ya lo comentamos con bastante más detalle esta mañana, recordarán que se ven los casos observados y los casos observados y que en este momento estamos todavía en camino con la predicción del 6 de mayo como el punto cumbre, siempre esto es una banda, no es exactamente un día a una hora y es entre el 6 y el 10 de mayo, pero ahí estaría.",0.0,72,1,05,2020
HUGO LOPEZ-GATELL RAMIREZ,"Y reitero para la Ciudad de México igual que lo hice para cada una de las ciudades, pero siendo esta la de mayor transmisión, de ninguna manera sería recomendable que se relajaran las medidas de seguridad sanitaria, la Jornada Nacional de Sana Distancia por el altísimo riesgo de un rebrote. Esto la propia jefa de Gobierno lo ha dicho enfáticamente, creo que muchas veces hasta más enfáticamente que yo. Gracias, jefa.",0.0,71,1,05,2020
HUGO LOPEZ-GATELL RAMIREZ,¿Y qué se ha hecho?,0.0,5,1,05,2020
HUGO LOPEZ-GATELL RAMIREZ,"Esta ya no me detengo, porque esto es lo que se va a explicar hoy y es precisamente -si quieren ya terminamos con esta- es lo que ahorita la jefa de Gobierno y el maestro Zoé Robledo explicarán sobre este nuevo abordaje de coordinación que nos permite mayor efectividad.",0.0,49,1,05,2020
HUGO LOPEZ-GATELL RAMIREZ,"Jefa, por favor.",0.0,3,1,05,2020
HUGO LOPEZ-GATELL RAMIREZ, Muchas gracias jefa de Gobierno.,0.0,5,1,05,2020
HUGO LOPEZ-GATELL RAMIREZ,Señor director.,0.0,2,1,05,2020
HUGO LOPEZ-GATELL RAMIREZ," Muchas gracias, maestro Zoé Robledo.",0.0,5,1,05,2020
HUGO LOPEZ-GATELL RAMIREZ,"Aquí, nada más, para que no se confunda la audiencia, esto que explicó la jefa de Gobierno de la Ciudad de México y el maestro Zoé Robledo de momento aplica a la Ciudad de México, cierto, incluido el llamado a Locatel, que obviamente es un servicio del gobierno de la Ciudad de México.",0.0,53,1,05,2020
HUGO LOPEZ-GATELL RAMIREZ,Nos da tiempo de dos preguntas. Usted y la compañera que nunca había participado.,0.0,14,1,05,2020
HUGO LOPEZ-GATELL RAMIREZ, Muchas gracias.,0.0,2,1,05,2020
HUGO LOPEZ-GATELL RAMIREZ,"Sobre lo segundo, lo que puedo decir es: de donativos, son bienvenidos, todo donativo altruista y sin otra motivación más que la generosidad es muy bienvenido; tenemos distintos mecanismos, las propias instituciones tienen sus propios mecanismos.",0.0,36,1,05,2020
HUGO LOPEZ-GATELL RAMIREZ,"La Secretaría de Salud es la encargada del patrimonio de la beneficencia pública, esta es una institución muy antigua, que es una institución… es parte de la Secretaría de Salud, está sectorizada el patrimonio de la beneficencia pública, y es el mecanismo que nos ha ayudado también a centralizar las cosas.",0.0,51,1,05,2020
HUGO LOPEZ-GATELL RAMIREZ,"Vamos a poner, no tengo en este momento el teléfono, pero vamos a poner a disposición un teléfono de acceso, pero, por lo pronto, puede ser el del IMSS también, por favor.",0.0,32,1,05,2020
HUGO LOPEZ-GATELL RAMIREZ," Gracias, maestro Robledo.",0.0,3,1,05,2020
HUGO LOPEZ-GATELL RAMIREZ,"La última pregunta, por favor.",0.0,5,1,05,2020
HUGO LOPEZ-GATELL RAMIREZ, Gracias.,0.0,1,1,05,2020
HUGO LOPEZ-GATELL RAMIREZ,"Nos dejan dos minutos para responderle. Escuché esta a la que se refiere la doctora Magdalena Madero Rovalo, quien es la jefa del departamento de Nefrología del Instituto de Cardiología, es una profesional muy competente, muy preparada, es investigadora nacional y la respeto muchísimo.",0.0,44,1,05,2020
HUGO LOPEZ-GATELL RAMIREZ,"Lo que ella relata es precisamente este fenómeno que estamos resolviendo con la redistribución. Efectivamente, como lo dijimos esta mañana, los tres Institutos Nacionales de Salud que fueron designados hospitales COVID, Nutrición, el INER y Cardiología se saturaron en la medida en que su prestigio, pero además su importancia, llevó a que una gran cantidad de personas en la ciudad que necesitaban atención para COVID acudieran a ellos.",0.0,68,1,05,2020
HUGO LOPEZ-GATELL RAMIREZ,"Entonces, efectivamente, llegaron a un punto crítico de saturación, mientras que tenemos otros espacios disponibles y que son igualmente buenos, también.",0.0,21,1,05,2020
HUGO LOPEZ-GATELL RAMIREZ,Y lo que estamos haciendo precisamente con esta iniciativa que relatamos en la mañana y ahorita es lograr esta redistribución.,0.0,20,1,05,2020
HUGO LOPEZ-GATELL RAMIREZ, Muchas gracias.,0.0,2,1,05,2020
HUGO LOPEZ-GATELL RAMIREZ,"Pues son las 20:01 horas. Muchas gracias, jefa de Gobierno, director, doctor Alomía, muchas gracias a ustedes. Muy buenas noches y nos vemos mañana.",0.0,24,1,05,2020
HUGO LOPEZ-GATELL RAMIREZ,---,0.0,1,1,05,2020
HUGO LOPEZ-GATELL RAMIREZ,VE 943.,0.0,2,1,05,2020
