Participante,Texto,Sentimiento,Palabras,Dia,Mes,Anio
HUGO LOPEZ-GATELL RAMIREZ," Muchas gracias, doctor José Luis Alomía, director general de Epidemiología, (falla de transmisión) a todas las personas que nos escuchan (inaudible) sobre COVID-19.",0.0,23,24,03,2021
HUGO LOPEZ-GATELL RAMIREZ,"También gracias a las compañeras, a todas y todos los que están en la sala (inaudible) Le agradezco también al (inaudible) que nos apoya en esta transmisión siempre desde allá y también cuando (inaudible)",0.0,34,24,03,2021
HUGO LOPEZ-GATELL RAMIREZ,"Hoy tenemos mucho que comentar, vamos a dar el informe técnico sobre vacunación (inaudible) porque la visita la visita que hemos hecho al estado de Campeche ha sido muy productiva en varios de los aspectos que estamos trabajando, tanto en la vacunación, el programa de vacunación SARS-CoV-2 para prevenir el COVID-19, como la conversación con la Secretaría de Educación Pública, encabezada por (inaudible) Delfina Gómez Álvarez y su equipo de trabajo, quienes tuvieron la gentileza de invitarnos para el Consejo Educativo Nacional, justamente como ya comentaba el doctor Alomía, para interactuar con las y los secretarios de Salud… Perdón, de Educación del país, de las entidades federativas, también las personas directoras de los subsistemas educativos y fue una experiencia realmente exitosa.",0.0,121,24,03,2021
HUGO LOPEZ-GATELL RAMIREZ,"¿Cuál fue el propósito?, ¿cuál fue (falla de audio)?",0.0,9,24,03,2021
HUGO LOPEZ-GATELL RAMIREZ,"Conversar sobre el COVID-19, la epidemia. La realidad es que tenemos ya seis semanas consecutivas de reducción de la epidemia, la oportunidad de expandir la vacunación a las personas trabajadoras de la educación con una visión de ampliar o acercarnos al momento de abrir las escuelas.",0.0,46,24,03,2021
HUGO LOPEZ-GATELL RAMIREZ,"Hubo consideraciones muy importantes, muy positivas, que nos llevaron a una de las perspectivas de lo que ya comentaba esta misma mañana el presidente en la conferencia matutina sobre este balance entre oportunidad de establecer la normalidad en servicios fundamentales, como la educación que ayudan a garantizar derechos como la educación, pero también la prudencia, la prudencia de hacerlo de una forma bien programada, ordenada, cuidadosa y con base en la evidencia, que en unos momentos lo comentaremos.",0.0,78,24,03,2021
HUGO LOPEZ-GATELL RAMIREZ,"Pasamos en la primera diapositiva el informe médico. Hoy se aplicaron 105 mil 291 mil dosis, vacunas, contra el virus SARS-CoV-2 para prevenir COVID hasta las 16:00 horas, hasta las 4:00 la tarde, momento en que se hizo el corte de información para preparar la conferencia.",0.0,46,24,03,2021
HUGO LOPEZ-GATELL RAMIREZ,"Pero como ocurre en varias otras ocasiones, les recuerdo que este corte de información generalmente está considerando un número menor a las vacunas que realmente se ponen.",0.0,27,24,03,2021
HUGO LOPEZ-GATELL RAMIREZ,Y pueden ustedes apreciar cómo se ha ido actualizando día con día la gráfica que en este momento ven en sus pantallas que muestra que estamos vacunando en un promedio de 210 mil vacunas por día.,0.0,36,24,03,2021
HUGO LOPEZ-GATELL RAMIREZ,"Aquí quiero aprovechar para hacer un comentario y anticiparme a lo que ya vemos como una pequeña ola de infodemia, es decir, este esfuerzo de confundir, manipular la información para desvirtuar (falla de audio) esfuerzo que se está haciendo. Se está indicando la idea falsa de que tenemos millones de dosis de vacunas almacenadas en los ultracongeladores o en los refrigeradores y que no la estamos aprovechando obviamente.",0.0,68,24,03,2021
HUGO LOPEZ-GATELL RAMIREZ,"Notamos esta tendencia en algunos medios de comunicación, también las redes sociales y queremos alentar a la población que no se deje confundir, es falso que estemos acumulando vacunas.",0.0,29,24,03,2021
HUGO LOPEZ-GATELL RAMIREZ,"Lo que está ocurriendo, y vamos a desglosarlo en los próximos pocos días con un detalle sobre dónde están en este momento las vacunas, es el proceso de modificación de la dinámica, de la mecánica de administración de las vacunas que hemos explicado ya varias veces, la acabamos de explicar en la conferencia matutina del martes en el Pulso de la Salud.",0.0,62,24,03,2021
HUGO LOPEZ-GATELL RAMIREZ,"Lo resumo, hemos estado cubriendo zonas rurales que son poblados dispersos donde obviamente la velocidad de aplicación de las vacunas está importantemente determinada por el tiempo de desplazamiento de las personas a las unidades de vacunación o bien de las brigadas Correcaminos hacia las poblaciones. Esto lleva más tiempo porque obviamente son poblaciones dispersas.",0.0,54,24,03,2021
HUGO LOPEZ-GATELL RAMIREZ,"Además, hemos tenido un abastecimiento menor en términos del número de vacunas que pueden aplicarse para cubrir a un municipio completo o incluso a una ciudad completa, y por eso deliberadamente, conscientemente quisimos avanzar en la vacunación en las zonas de menor tamaño, de poblaciones de menor tamaño.",0.0,48,24,03,2021
HUGO LOPEZ-GATELL RAMIREZ,"Estamos a punto de tener la posibilidad, y esto ocurrirá ya en parte durante esta semana e indudablemente durante las siguientes semanas, de tener grandes cantidades de vacunas que llegan a México. Lo vemos con los embarques de Sinovac, con la reciente liberación de casi un millón de dosis de CanSino, con la próxima llegada de vacunas de AstraZeneca que amablemente fueron trasferidas por el gobierno de Estados Unidos y con esto vamos a tener la capacidad de entrar a las ciudades ya en grandes cantidades a aplicar la vacuna.",0.0,90,24,03,2021
HUGO LOPEZ-GATELL RAMIREZ,"Entonces, por favor, difunda, alerte a la población de esta falsedad de que estamos acumulando vacunas en los refrigeradores. Esto es falso y desde luego es una intención de demeritar la estrategia de vacunación.",0.0,34,24,03,2021
HUGO LOPEZ-GATELL RAMIREZ,"En la siguiente diapositiva lo que vemos es el número acumulado hasta hoy 24 de marzo, tenemos seis millones 119 mil 298 dosis aplicadas, y de una proporción importante son primeras dosis, sobre todo en la población adulta mayor, y otras son ya segundas dosis, sobre todo en las personas trabajadores de la salud.",0.0,54,24,03,2021
HUGO LOPEZ-GATELL RAMIREZ,Esto representa en este momento -en la siguiente diapositiva lo podemos ver- el 63 por ciento de los embarques que hasta el momento hemos recibido.,0.0,25,24,03,2021
HUGO LOPEZ-GATELL RAMIREZ,"Y esta diferencia es lo que ya comentaba hace un momento, esta diferencia entre los nueve millones 758 mil 845 dosis recibidas y los seis millones casi 120 mil aplicadas es justamente los embarques que han llegado más recientemente que han llegado en cantidades millonarias literalmente hablando.",0.0,47,24,03,2021
HUGO LOPEZ-GATELL RAMIREZ,"En la siguiente diapositiva, como ya es costumbre, vemos el desglose, vean ustedes cómo hemos seguido avanzando en identificar y vacunar al personal de salud, sobre todo de primera y segunda línea, estamos en espera de que fluya la información por parte de las secretarias y secretarios de Salud de las entidades federativas sobre los censos validados en donde tengamos la certeza de quién está en la primera y segunda línea de COVID, del riesgo de exposición a COVID.",0.0,79,24,03,2021
HUGO LOPEZ-GATELL RAMIREZ,"En el segundo componente vemos lo que ocurre aquí en el hermoso estado de Campeche. Se han vacunado ya a 22 mil 290 personas trabajadoras de educación, no solamente maestras y maestros, sino otros trabajadoras y trabajadores que trabajan en el ámbito educativo y que están en la exposición con la población.",0.0,52,24,03,2021
HUGO LOPEZ-GATELL RAMIREZ,"En esta visita podemos constatar un magnífico trabajo de organización, de ejecución, de supervisión y de participación ciudadana por parte de las unidades Correcaminos, de las Brigadas Correcaminos. Comentaremos de esto en unos minutos, tanto yo como doctor López Ridaura.",0.0,40,24,03,2021
HUGO LOPEZ-GATELL RAMIREZ,"Finalmente, el componente de personas adultas mayores, que representa a la fase 1 del plan de vacunación. Recordar que el objetivo de vacunar a personas adultas mayores fundamentalmente va a contribuir a reducir la mortalidad.",0.0,35,24,03,2021
HUGO LOPEZ-GATELL RAMIREZ,Cuando logremos vacunar a 20 por ciento de las y los mexicanos habiendo empezado por las edades más avanzadas estaremos logrando reducir 80 por ciento de la mortalidad por COVID-19 en México.,0.0,32,24,03,2021
HUGO LOPEZ-GATELL RAMIREZ,"Cuatro millones 476 mil 556 primeras dosis y casi 150 mil segundas dosis, que representan el tres por ciento de las personas adultas mayores.",0.0,24,24,03,2021
HUGO LOPEZ-GATELL RAMIREZ,"Cuando lleguen los momentos, de acuerdo al calendario recomendado de vacunación en segundas dosis para cada uno de los tipos de vacuna, se estarán vacunando ya en mayores cantidades adultos mayores con las segundas dosis, pero por el momento son las primeras dosis.",0.0,43,24,03,2021
HUGO LOPEZ-GATELL RAMIREZ,"En la siguiente filmina podemos ver los eventos supuestamente asociados a vacunación e inmunización. Seguimos notando este patrón de gran estabilidad y además de escasos eventos que ha estado ocurriendo, mayormente se trata de reacciones esperables, reacciones menores, a lo mejor dolor en el sitio de inyección, nausea, sensación del dolor, debilidad, mareo, este tipo de reacciones que sabemos que ocurren cuando una persona está sujeta a vacunación, el estrés, el calor, la propia reacción inmune que puede darse a veces en los siguientes días.",0.0,85,24,03,2021
HUGO LOPEZ-GATELL RAMIREZ,"Las reacciones leves pueden ocurrir el primer día y podría ser que en los días posteriores aparezca, por ejemplo, fiebre como parte de la respuesta inmune.",0.0,26,24,03,2021
HUGO LOPEZ-GATELL RAMIREZ,"Menos del uno por ciento de los casos son casos de consideración, son casos que ameriten alguna atención médica más avanzada, esto también ha sido muy estable, y lo que vemos es que algunas personas han requerido hospitalización por periodos muy cortos.",0.0,42,24,03,2021
HUGO LOPEZ-GATELL RAMIREZ,"Hoy también tuvimos buenas noticias con el arribo del segundo segmento del embarque de Pfizer-BioNTech que nos llega todas las semanas. Ayer martes tuvimos un primer embarque de varias centenas de miles de dosis que hoy se complementan con estas 170 mil 625, para un total que rebasa las 600 mil dosis.",0.0,52,24,03,2021
HUGO LOPEZ-GATELL RAMIREZ,Y esto lo que nos permite -concretamente (falla de transmisión) 487 mil 500 ayer martes y hoy estas 170 mil 625- Esto lo que permite es mantener un ritmo de abastecimiento de la vacuna Pfizer que nos ayuda a (falla de transmisión) de la manera más eficiente en la distribución de la vacuna.,0.0,53,24,03,2021
HUGO LOPEZ-GATELL RAMIREZ,"En los otros casos el abastecimiento no tiene esta regularidad semanal, pero, como ya comentábamos con los casos de las vacunas Sinovac y CanSino, el hecho de que lleguen en grandes cantidades nos ayuda a tener desplazamientos territoriales más importantes y desde luego coberturas más rápidas.",0.0,46,24,03,2021
HUGO LOPEZ-GATELL RAMIREZ,"También sabemos, hemos tenido conversación con colegas de Rusia, el Fondo Ruso de Inversión Directa del gobierno de Rusia, que nos indica que ya está preparando el nuevo abastecimiento programado, de acuerdo al convenio con el contrato, de la vacuna Sputnik V.",0.0,42,24,03,2021
HUGO LOPEZ-GATELL RAMIREZ,"En la siguiente imagen lo que vemos es lo que reportamos también de todas las noches también de estos nueve millones 758 mil 845 dosis de vacunas que se distribuyan como aparece en la pantalla. Mayormente las de Pfizer, que son las primeras que llegaron; enseguida AstraZeneca, del embarque comprado al Instituto Serológico de la India; las tres millones de vacuna Sinovac, las 400 mil dosis de Sputnik V y el elemento más reciente, CanSino, con 940 mil 470, que se estarán aplicando, las más recientes, ya esta semana y la próxima.",0.0,92,24,03,2021
HUGO LOPEZ-GATELL RAMIREZ,"En la siguiente recordamos a toda la población, le recordamos a ustedes, le recordamos a ti, esperar tu turno, muy importante. Todavía hemos detectado en algunos casos, nos ocurrió aquí en la península de Yucatán el fin de semana próximo pasado que algunas personas, sobre todo de zonas urbanas, de desplazaron hacia incluso otras entidades federativas. De Mérida vinieron aquí a Campeche personas en diversas camionetas, personas que venían mayormente de zonas urbanas y venían buscando su vacuna.",0.0,78,24,03,2021
HUGO LOPEZ-GATELL RAMIREZ,"Por favor, espere, por favor, esperen, recuerden que la programación de la vacuna es hasta que toque vacuna a todas y todos las personas que están en México. Va a haber vacuna para todas y todos, entonces no hay necesidad de anticiparse. Por favor, que se respete la distribución territorial.",0.0,50,24,03,2021
HUGO LOPEZ-GATELL RAMIREZ,"A veces ocurre, y es particularmente preocupante para nosotros, para el Gobierno de México, que personas de ciertos sectores adinerados de las zonas urbanas se desplazan hacia las zonas rurales buscando la vacuna. Esto complica mucho el panorama, además de que es obviamente una situación irregular que está abusando de la confianza de las personas de la localidad donde se está vacunando.",0.0,62,24,03,2021
HUGO LOPEZ-GATELL RAMIREZ,"Por favor respeten, por favor mantengan la actitud de solidaridad que la mayoría del pueblo de México ha mantenido durante todos estos meses.",0.0,23,24,03,2021
HUGO LOPEZ-GATELL RAMIREZ,"En la siguiente diapositiva, el tema reciente, la semana mayor, el periodo de asueto, que también para algunas personas es considerado la Semana Santa. Esto implica dos semanas prácticamente de asueto en la mayoría de los empleos.",0.0,37,24,03,2021
HUGO LOPEZ-GATELL RAMIREZ,"Es importante recordar que el riesgo de una tercera ola es vigente, vigente en México, vigente en la mayoría de los países, sobre todo en los países del mundo. En este momento en la región del Europa hay una tercera, para algunos países cuarta ola, esto quiere decir una reemergencia, un rebrote que viven esos países.",0.0,56,24,03,2021
HUGO LOPEZ-GATELL RAMIREZ,"O bien, en la zona sur de nuestro planeta, en el hemisferio sur, particularmente en nuestro caso, en el continente americano, en los países latinoamericanos tenemos una reemergencia en varios de estos países.",0.0,33,24,03,2021
HUGO LOPEZ-GATELL RAMIREZ,"Es por eso que estamos atentos, estamos alertas de que esto pudiera (falla de transmisión) la región de Norteamérica. En este momento ni Canadá ni Estados Unidos ni México tienen una remergencia, lo que tienen es una tendencia a la reducción.",0.0,41,24,03,2021
HUGO LOPEZ-GATELL RAMIREZ,"Por cierto, esto hoy mismo la directora general de la Organización Panamericana de la Salud reconoció los esfuerzos de los gobiernos de estos tres países, que han logrado que exista esta tendencia de reducción, pero no nos confiemos.",0.0,38,24,03,2021
HUGO LOPEZ-GATELL RAMIREZ,"Y el periodo de asueto puede implicar riesgos de transmisión si es que las personas se congregan. Por eso ayer presentamos un decálogo, una serie de 10 recomendaciones de carácter general para que las personas las tomen en cuenta en los siguientes días.",0.0,43,24,03,2021
HUGO LOPEZ-GATELL RAMIREZ,"Entonces, por favor, contamos contigo para tener unas vacaciones seguras, por favor, no seas arrastrado por una tercera ola.",0.0,19,24,03,2021
HUGO LOPEZ-GATELL RAMIREZ,"En la siguiente diapositiva vamos a hablar de un tema (falla de transmisión) pero que no queremos dejar y es la enfermedad de tuberculosis. Esto porque lo recordamos hoy porque es 24 de marzo y como todos los 24 de marzo recordamos o conmemoramos la existencia de esta enfermedad infecciosa causada por una bacteria, una microbacteria, que sigue causando en el mundo entero importantes daños e importante mortalidad.",0.0,68,24,03,2021
HUGO LOPEZ-GATELL RAMIREZ,"En México, en el mundo, sigue presente la tuberculosis. Algunas personas a veces piensan que la tuberculosis es una enfermedad del pasado, algunos piensan incluso de la edad media. No es el caso, la tuberculosis es una enfermedad contemporánea, sigue afectando a grupos importantes de población.",0.0,46,24,03,2021
HUGO LOPEZ-GATELL RAMIREZ,"Entonces, es importante recordar que si una persona -veamos esta imagen- si una persona tiene tos persistente, sobre todo tos con flemas, puede ser tuberculosis. No quiere decir que necesariamente lo sea. En la siguiente diapositiva recordamos sobre esto, si pasan, por favor, la siguiente imagen.",0.0,46,24,03,2021
HUGO LOPEZ-GATELL RAMIREZ,"Y de particular interés es el binomio del virus de la inmunodefiencia humana con la tuberculosis. Se conoce desde hace décadas, un par décadas, que las personas que viven con VIH, con el virus de la inmunodefiencia humana, han tenido un deterioro importante de su sistema inmune tienen un riesgo muy aumentado de tener tuberculosis.",0.0,55,24,03,2021
HUGO LOPEZ-GATELL RAMIREZ,"Pero también las personas que padecen tuberculosis podría ser que no sepan que tienen infección por VIH, entonces por esto, el Centro Nacional para Prevención del VIH a cargo de la doctora Alethse de la Torre, nos recuerda que, si vives con VIH, hazte la prueba de tuberculosis; si vives o tienes tuberculosis, hazte la prueba de VIH. Es importante este abordaje ilustrado de las dos enfermedades. Y recordamos que tanto el diagnóstico como el tratamiento son gratuitos en México para todas las personas.",0.0,84,24,03,2021
HUGO LOPEZ-GATELL RAMIREZ,"Termino conversando un poco la descripción general de lo que hemos visto aquí en Campeche antes de abrir a preguntas y respuestas en este momento que tenemos todavía varios minutos, son las 19:22.",0.0,33,24,03,2021
HUGO LOPEZ-GATELL RAMIREZ,La misión en Campeche tenía dos propósitos fundamentales:,0.0,8,24,03,2021
HUGO LOPEZ-GATELL RAMIREZ,"El primero era el acompañar a la secretaria de Educación, Delfina Gómez Álvarez, y su equipo de subsecretarios y directores generales para participar en el Consejo Educativo Nacional que se celebró aquí en Campeche con la hospitalidad del doctor Ricardo Koh Cambranis, secretario de Salud del estado.",0.0,47,24,03,2021
HUGO LOPEZ-GATELL RAMIREZ,"Y también conversar con las autoridades tanto de salud como de educación de Campeche, con el propio gobernador Carlos Miguel Aysa, sobre la perspectiva de que Campeche pudiera abrir las escuelas siendo el primer estado que lo haga.",0.0,38,24,03,2021
HUGO LOPEZ-GATELL RAMIREZ,"La conversación, como ya decía, fue muy productiva en todos y cada uno de los ámbitos. Vimos un trabajo magnífico del gobierno del estado de Campeche, de planeación, de programación, de reflexión sobre los riesgos y también sobre los beneficios de esto.",0.0,42,24,03,2021
HUGO LOPEZ-GATELL RAMIREZ,"Recordamos a toda la población que nos escucha que el manejo de un fenómeno complejo como esta epidemia para todos los países del mundo implica el balance de dos objetivos: el proteger la salud y la vida por medio de las intervenciones que nos llevan a restringir la movilidad en el espacio público, la sana distancia, el cierre temporal de establecimientos públicos para evitar que se congreguen las personas, que se contagien.",0.0,72,24,03,2021
HUGO LOPEZ-GATELL RAMIREZ,"Pero eso tiene consecuencias sobre la economía, sobre las economías populares, sobre la actividad social, incluyendo aquella importante que está ligada a los derechos o la educación, o la propia salud que se ve también afectada por estas restricciones de la movilidad.",0.0,42,24,03,2021
HUGO LOPEZ-GATELL RAMIREZ,"El punto de balance de estos dos objetivos continuamente tiene que restablecerse, reanalizarse, calibrarse, y este es el caso ante la oportunidad de abrir las escuelas cuando se tenga un progreso en continuar el control epidémico.",0.0,36,24,03,2021
HUGO LOPEZ-GATELL RAMIREZ,"Campeche es un estado, como lo hemos dicho muchas veces, que tiene la particularidad que durante prácticamente seis meses, medio año, se ha mantenido en semáforo verde y la transmisión del virus SARS-CoV-2 es mínima y entonces es por esto, más otras consideraciones sobre la demografía, sobre la manera en que está geográficamente organizado el estado, que permite la posibilidad de abrir.",0.0,62,24,03,2021
HUGO LOPEZ-GATELL RAMIREZ,"Pero no queremos correr riesgos, no los quiere correr el gobierno del gobernador Carlos Miguel Aysa, no lo quiere correr el Gobierno de México. Y por eso trabajamos de manera coordinada y llegamos a la conclusión que es necesario abrir, definitivamente necesitamos abrir las escuelas, pero lo vamos a hacer en una forma gradual, escalonada y basado en la evidencia de un buen control que (falla de transmisión).",0.0,68,24,03,2021
HUGO LOPEZ-GATELL RAMIREZ,"El presidente, ya decíamos, esta mañana en la conferencia matutina comentaba sobre esta perspectiva de consenso para lograr minimizar los riesgos, pero ya empezar a normalizar la vida pública, sobre todo en la educación.",0.0,34,24,03,2021
HUGO LOPEZ-GATELL RAMIREZ,"Esta también fue la perspectiva del Consejo Educativo Nacional. Todas las secretarias y secretarios de salud que participaron en él -estaban todas las entidades federativas-, no todo mundo hizo uso de la palabra, pero quienes lo hicieron tenían esta misma (falla de transmisión), sí abrir, pero de una manera ordenada, de una manera programada y gradual. Ese fue el primer elemento.",0.0,61,24,03,2021
HUGO LOPEZ-GATELL RAMIREZ,"El segundo elemento, que fue el objetivo también de esta visita, fue visitar y supervisar el operativo Correcaminos de vacunación contra COVID. Visitamos varios, más de seis centros de vacunación, puestos de vacunación de todas las instituciones de la Secretaría de Salud, el hospital, el Centro Oncológico del estado, también en el Issste, en una unidad de medicina familiar; en el IMSS, en otra unidad de medicina familiar; también en la región naval militar en la que nos encontramos en este momento donde hay un puesto de vacunación, y en la zona militar donde hay otro muy grande puesto de vacunación.",0.0,101,24,03,2021
HUGO LOPEZ-GATELL RAMIREZ,"Constatamos un trabajo extraordinariamente bien coordinado. Aquí quiero felicitar a la teniente médica De Hoyos, quien es la representante del operativo Correcaminos en el estado; también a Katia Meave, quien es la delegada federal de los programas de bienestar, y desde luego al secretario de Salud, José Luis González Pinzón, que han sabido organizarse las tres entidades y todos los equipos de trabajo.",0.0,63,24,03,2021
HUGO LOPEZ-GATELL RAMIREZ,"Vimos orden, vimos pulcritud, vimos claridad, vimos transparencia y las y los servidores de la nación participantes de todos los programas de bienestar constatamos que juegan un papel fundamental en la operación de los puestos de vacunación. Sin ellas y ellos no se podría dar tal grado de eficiencia en la aplicación de la vacuna.",0.0,55,24,03,2021
HUGO LOPEZ-GATELL RAMIREZ,"La experiencia, por tanto, nos demuestra la necesidad de estos operativos más complejos de lo que estamos habituados, el programa ordinario, el programa de vacunación universal. También nos demuestra la participación ciudadana y también la posibilidad de expandir la vacunación a territorios muy diversos, zonas rurales dispersas, en esta ocasión no tuvimos la oportunidad de visitar, pero también en las zonas urbanas complejas donde hay asentamientos humanos más extensos.",0.0,69,24,03,2021
HUGO LOPEZ-GATELL RAMIREZ,"Entonces, esta es la síntesis de lo que vivimos.",0.0,9,24,03,2021
HUGO LOPEZ-GATELL RAMIREZ,"Agradecemos, por cierto, también a la Secretaría de Marina su hospitalidad, estamos en este momento e la región naval militar, que tiene un papel muy importante en el resguardo (inaudible) Correcaminos, lo mismo que la Secretaría de la Defensa Nacional y nuestras heroicas Fuerzas Armadas de mar, tierra y aire, han jugado un papel sumamente importante en este operativo y lo agradecemos una vez más.",0.0,65,24,03,2021
HUGO LOPEZ-GATELL RAMIREZ,"Vamos a abrir a preguntas y comentarios, le pedimos al doctor Alomía si lo coordina, y tanto el doctor López Ridaura (falla de transmisión) como el doctor Alomía o yo contestaremos.",0.0,31,24,03,2021
HUGO LOPEZ-GATELL RAMIREZ,"Por favor, doctor Alomía.",0.0,4,24,03,2021
HUGO LOPEZ-GATELL RAMIREZ," Muchas gracias, doctor.",0.0,3,24,03,2021
HUGO LOPEZ-GATELL RAMIREZ,Doctor Alomía.,0.0,2,24,03,2021
HUGO LOPEZ-GATELL RAMIREZ," Gracias, Liliana Noble. Un gusto saludarla. Con mucho gusto.",0.0,9,24,03,2021
HUGO LOPEZ-GATELL RAMIREZ,"Sobre la apertura de escuelas, el Consejo Educativo Nacional, que preside la secretaria de Educación, y como decía, tuvo un muy jugoso, muy enriquecedor intercambio de puntos de vista técnicos.",0.0,30,24,03,2021
HUGO LOPEZ-GATELL RAMIREZ,"Por cierto, felicito a las y los secretarios de Educación Pública del país por el nivel tan elevado que tienen en sus conceptos, en su responsabilidad, en su ejercicio de su responsabilidad y en la oportunidad y calidad de sus propuestas técnicas, también las que atañen al campo de la salud y la protección de las personas.",0.0,57,24,03,2021
HUGO LOPEZ-GATELL RAMIREZ,"Lo que ocurrió llevó a una decisión general de seguir trabajando con el estado de Campeche, con el gobierno de Campeche en un plan que elaboró el propio gobierno de Campeche y que nos fue presentado ayer en una reunión de trabajo ayer por la noche.",0.0,46,24,03,2021
