Participante,Texto,Sentimiento,Palabras,Dia,Mes,Anio
HUGO LOPEZ-GATELL RAMIREZ,"El plan considera etapas muy bien definidas, se han identificado ya incluso poblados cuyas escuelas podrían empezar a abrir en una primera fase, seguidas de fases posteriores, las condiciones que se necesitan para que estas escuelas abran. Y estas condiciones surgen de un documento que elaboramos conjuntamente la Secretaría de Educación Pública, la Secretaría de Salud, desde hace más de un año. Esto es importante que la población lo tenga presente.",0.0,71,24,03,2021
HUGO LOPEZ-GATELL RAMIREZ,"El 14 de marzo de 2020 cuando se tomó la decisión por parte del Consejo Educativo Nacional de cerrar las escuelas, temporalmente las escuelas, ese mismo día ya teníamos listo un documento técnico que en su momento fue elaborado principalmente por los subsecretarios y el secretario de Educación Pública, y en el contribuyó posteriormente la Secretaría de Salud, pero ya desde el año pasado, es decir, teníamos la llave de salida, las condiciones técnicas en las que se pueden abrir las escuelas.",0.0,82,24,03,2021
HUGO LOPEZ-GATELL RAMIREZ,Ese documento sigue siendo vigente con algunos pequeños ajustes derivados del aprendizaje que se ha tenido de la epidemia y es con base en ese documento que está trabajando el gobierno de Campeche para este este regreso gradual y ordenado.,0.0,40,24,03,2021
HUGO LOPEZ-GATELL RAMIREZ,"Una etapa importante en la que estarán participando varias entidades federativas es el establecimiento de sus Centros de Aprendizaje Comunitarios, que son formas de utilizar los recintos escolares para enfrentar posibles rezagos que se presentaran en la educación pública debido a esta modalidad específica que hemos estado operando con las clases virtuales y mayormente fuera de las aulas.",0.0,58,24,03,2021
HUGO LOPEZ-GATELL RAMIREZ,"Entonces, varias entidades federativas expresaron interés, deseo y algunas ya están trabajando en eso, en las Comunidades de Aprendizaje Comunitario.",0.0,20,24,03,2021
HUGO LOPEZ-GATELL RAMIREZ,"Sobre fechas específicas de otras entidades federativas diferentes a Campeche, en general el Consejo Educativo nos pidió una opinión técnica, la dimos, y es la siguiente: tratar de no abrir inmediatamente después de la Semana Santa, porque la Semana Santa implica la posibilidad de que las personas se desplacen territorialmente hacia otras regiones, pudieran (falla de transmisión) que regresan a su sitio de residencia pudieran contagiar.",0.0,66,24,03,2021
HUGO LOPEZ-GATELL RAMIREZ,"Si se abren las escuelas inmediatamente después de la Semana Santa es altamente probable que habría reactivación de la epidemia, entonces hay que diferirlo por lo menos un par de semanas, es dos periodos de incubación el virus.",0.0,38,24,03,2021
HUGO LOPEZ-GATELL RAMIREZ,"Y conforme el semáforo de riesgo COVID vaya pasando a verde, entonces las entidades estarán activando ya sus preparaciones, sus protocolos de preparación al respecto.",0.0,25,24,03,2021
HUGO LOPEZ-GATELL RAMIREZ,"Entonces, se tiene toda la mecánica, pero las fechas específicas dependen de la realidad epidémica, no queremos forzar con una decisión administrativa la apertura, ésta depende de la realidad de las entidades.",0.0,32,24,03,2021
HUGO LOPEZ-GATELL RAMIREZ,"Sobre la segunda pregunta, sabemos que hoy algunos medios de comunicación generaron una importante información sobre el tema de la vacuna Sputnik V o la presunta vacuna Sputnik V que presuntamente fue o se le intentaba llevar a otro país en una forma ilegal, presuntamente ilegal.",0.0,46,24,03,2021
HUGO LOPEZ-GATELL RAMIREZ,Lo que podemos comentar es que en la parte de investigación de este fenómeno hay presuntas responsabilidades o presuntas responsabilidades legales que están a cargo de la Fiscalía General de la República por tratarse de un posible delito en múltiples dimensiones de la ley.,0.0,44,24,03,2021
HUGO LOPEZ-GATELL RAMIREZ,"Entonces no vamos a hablar del proceso, porque esto está en un proceso de investigación.",0.0,15,24,03,2021
HUGO LOPEZ-GATELL RAMIREZ,"Lo que sí podemos es comentar sobre las preocupaciones de salud de aquellas personas que, si fuera cierta esta noticia y se constatara la evidencia de que fueron, recibieron el producto, podrían tener la preocupación de que les falta su segunda dosis.",0.0,42,24,03,2021
HUGO LOPEZ-GATELL RAMIREZ,"El producto se está investigando en términos técnicos, composición química, el producto está resguardado por la Fiscalía General de la República y conforme se hagan los estudios se podrá saber qué contiene ese producto, si se trata de sustancia activa protectora contra el COVID-19, si es una vacuna real o si no lo es, y sobre eso tomaremos las decisiones de las recomendaciones que haremos públicas y dirigidas a las personas que pudieran estar en esa circunstancia.",0.0,77,24,03,2021
HUGO LOPEZ-GATELL RAMIREZ,"Cierro sobre esto recordando a la población que en ningún caso los frasquitos, los viales de este producto que fue incautado son de la compra del gobierno mexicano al Fondo Ruso de Inversión Directa, es decir, no se trata de una vacuna que haya sido comprada por México.",0.0,48,24,03,2021
HUGO LOPEZ-GATELL RAMIREZ,"México, le llegaron sus 400 mil dosis de estos primeros embarques y las utilizó en lo que se esperaba con el resguardo de nuestras heroicas Fuerzas Armadas. Nunca de se fugó, nunca salió de los ultracongeladores del Gobierno de México el producto, todo lo que se incautó es una presunta falsificación del producto.",0.0,53,24,03,2021
HUGO LOPEZ-GATELL RAMIREZ,Gracias.,0.0,1,24,03,2021
HUGO LOPEZ-GATELL RAMIREZ," Gracias, doctor.",0.0,2,24,03,2021
HUGO LOPEZ-GATELL RAMIREZ," Adelante, doctor Alomía.",0.0,3,24,03,2021
HUGO LOPEZ-GATELL RAMIREZ, Solamente un par de frases.,0.0,5,24,03,2021
HUGO LOPEZ-GATELL RAMIREZ,"La epidemia sigue, pero afortunadamente en México llevamos seis semanas con reducción de la epidemia, este patrón ha sido muy consistente; sin embargo, no debemos confiarnos, en todo momento como lo hemos dicho siempre. Mientras exista circulación del virus SARS-CoV-2, mientras exista la epidemia activa de COVID-19 en cualquier parte del mundo todas las naciones estamos en la posibilidad de que haya un cambio y empecemos a obtener una siguiente ola, no queremos una tercera ola, hay que mantener las medidas de prevención, de sana distancia, en el lavado de manos, el uso de cubrebocas, la sana distancia, y las 10 recomendaciones del decálogo para la semana mayor.",0.0,108,24,03,2021
HUGO LOPEZ-GATELL RAMIREZ,"Mientras, seguiremos con la vacunación, llevamos más de seis millones 100 mil dosis y seguiremos próximamente de una manera mucho más acelerada con la vacuna que vaya llegando, que tenemos a las 10 mil brigadas Correcaminos en la posibilidad de ponerla de manera inmediata.",0.0,44,24,03,2021
HUGO LOPEZ-GATELL RAMIREZ,"Muchas gracias, nos vemos mañana.",0.0,5,24,03,2021
