Participante,Texto,Sentimiento,Palabras,Dia,Mes,Anio
HUGO LOPEZ-GATELL RAMIREZ,"HUGO LÓPEZ-GATELL RAMÍREZ, SUBSECRETARIO DE PREVENCIÓN Y PROMOCIÓN DE LA SALUD: Muchas gracias, doctor Ricardo Cortés, director general de Promoción de la Salud de la Secretaría de Salud. Muy buenas tardes tengan todas y todos ustedes allá en el Salón Tesorería o en sus casas o donde quiera que nos estén escuchando.",0.0,52,11,03,2021
HUGO LOPEZ-GATELL RAMIREZ,"Hablemos de vacunación, el Plan Nacional de Vacunación contra el virus SARS-CoV-2 para Prevenir la COVID-19 en México. Recordar que este plan fue cuidadosamente diseñado con la asistencia de un grupo muy competente de personas expertas en distintos campos del conocimiento, tanto de la salud como de otras disciplinas relacionados, y fue presentado públicamente en una conferencia matutina el 8 de diciembre de 2020.",0.0,64,11,03,2021
HUGO LOPEZ-GATELL RAMIREZ,"Desde entonces dejamos muy claro que este plan tiene grandes similitudes con los planes nacionales de varias naciones europeas, o el de Estados Unidos, el de Canadá, por mencionar algunos, y básicamente se orienta el propósito fundamental de reducir la mortalidad relacionada con COVID; para lograrlo se requiere vacunar prioritariamente a las personas adultas mayores de 60 años que son quienes tienen el mayor riesgo de complicarse y eventualmente también de perder la vida si es que presentan COVID grave.",0.0,80,11,03,2021
HUGO LOPEZ-GATELL RAMIREZ,"Hemos identificado con el trabajo de este grupo de personas expertas que, si empezamos a vacunar a personas adultas mayores, desde la más añosa hasta llegar a las personas de 60 años, cuando hayamos cubierto el 20 por ciento de la población mexicana habremos logrado reducir 80 por ciento de la mortalidad.",0.0,52,11,03,2021
HUGO LOPEZ-GATELL RAMIREZ,"Es un objetivo sumamente importante, en la medida en que es previsible que hasta que las naciones logren una cobertura de vacunación cercana a tres cuartas partes de su población es cuando se va a lograr la reducción de la transmisión del virus SARS-CoV-2.",0.0,44,11,03,2021
HUGO LOPEZ-GATELL RAMIREZ,"En tanto eso ocurre, es muy importante reducir la mortalidad, reducir también la hospitalización por COVID o las formas graves de la enfermedad.",0.0,23,11,03,2021
HUGO LOPEZ-GATELL RAMIREZ,"Estamos vacunando desde el 24 de diciembre, fuimos el primer paísen América Latina que inició con la vacunación, estuvimos dentro de los primeros 10 países del mundo en lograrlo y el 24 de diciembre del año pasado iniciamos, no hemos parado y nos mantenemos en una fase de expansión de esta vacunación, vacunando particularmente en esta etapa a las personas adultas mayores y también simultáneamente, aunque ese fue el objetivo inicial, a las personas que trabajan para la salud, a las personas trabajadoras del campo clínico.",0.0,86,11,03,2021
HUGO LOPEZ-GATELL RAMIREZ,"Hoy, en el corte más reciente, que fue el de las 16:00 horas de hoy jueves 11 de marzo tenemos que logramos vacunar 208 mil 330 personas.",0.0,27,11,03,2021
HUGO LOPEZ-GATELL RAMIREZ,"Y como hemos recordado ya en otras ocasiones y se muestra por los números que esta mañana presentó nuestro secretario, el doctor Jorge Alcocer, en donde ayer habíamos logrado 360 mil vacunas, siendo que en la tarde yo mismo presenté 270 mil.",0.0,42,11,03,2021
HUGO LOPEZ-GATELL RAMIREZ,"Entonces, hemos estado presentando la información que está disponible hasta las 4:00 de la tarde para preparar la conferencia de prensa de todas las tardes a las 19 horas, pero recordar que las unidades de vacunación permanecen abiertas y hacemos un segundo corte de información a las 22:00 horas que está disponible a veces en las mañanas cuando se presenta en la conferencia matutina del presidente.",0.0,66,11,03,2021
HUGO LOPEZ-GATELL RAMIREZ,"Entonces, ayer logramos cifra récord de vacunación en un día, 360 mil 600 dosis de vacunas y hoy muy posiblemente logremos otra cifra récord porque a las 4:00 de la tarde habíamos vacunado 208 mil 330 personas, más los datos que se van a ir presentando a lo largo de las siguientes horas.",0.0,53,11,03,2021
HUGO LOPEZ-GATELL RAMIREZ,La siguiente por favor. Esto nos lleva en la cifra acumulativa a la cifra récord de vacunación. Menciono esto de la cifra récord porque recordarán que algunos diarios de circulación nacional estaban obsesionados con la cifra récord de casos acumulados y de muy lamentables defunciones.,0.0,45,11,03,2021
HUGO LOPEZ-GATELL RAMIREZ,"Entonces, suponemos que ahora van a estar interesados en presentarla cifra récord de vacunación. Veremos, como ocurría con los casos contabilizados en forma acumulativa desde que inició la epidemia, que también las vacunas se van acumulando, entonces seguramente pondrán: ‘Cifras récord de vacunación’ y hoy podrían poner casi tres millones 780 mil, concretamente tres millones 779 mil 969.",0.0,58,11,03,2021
HUGO LOPEZ-GATELL RAMIREZ,"Aquí vemos un desglose. Esta es una nueva diapositiva que estamos presentando para que vean comparativamente la cantidad de vacunas que han llegado al país desde el 23 de diciembre de 2020 y las que ya se han puesto. Hemos recibido casi cinco millones 500 mil y se han puesto estas casi tres mil 780 mil, lo que representa el 70 por ciento de la dotación de vacunas ya se ha utilizado.",0.0,72,11,03,2021
HUGO LOPEZ-GATELL RAMIREZ,"Y aquí, tomando en cuenta la pregunta que muy amablemente hizo ayer Otilia Carbajal del diario La Razón, la cifra de diferencia, estas casi dos millones de vacunas, dos millones 300 mil, son aquellas vacunas que en tránsito, que ya han sido puestas a disposición en los nodos de vacunación… perdón, en los nodos de ultracongelación primarios y que están listas para ser desplazadas a las unidades de vacunación, al tiempo que se convoca a la población para ser vacunada.",0.0,80,11,03,2021
HUGO LOPEZ-GATELL RAMIREZ,"Y como decíamos ayer, es un tránsito continuo de las vacunas. La aspiración es a poderlas poner en la mayor cantidad posible en las siguientes pocas semanas.",0.0,27,11,03,2021
HUGO LOPEZ-GATELL RAMIREZ,"Estamos llegando ya a estas cifras de 350 mil o más dosis por día, ojalá que lleguemos a una meta de 500 mil por día, medió millón, medio millón de vacunas por día. Si logramos hacerlo esto nos llevaría a que estaríamos terminando de vacuna a toda la población adulta en México a mitad de este año.",0.0,57,11,03,2021
HUGO LOPEZ-GATELL RAMIREZ,¿De qué depende que lo logremos?,0.0,6,11,03,2021
HUGO LOPEZ-GATELL RAMIREZ,"Fundamentalmente de la fabricación de las vacunas y su envío a México. Una vez que llegan a México tenemos plena capacidad dentro del programa de vacunación, el programa Correcaminos, la estrategia Correcaminos para ponerlas de manera muy expedita.",0.0,38,11,03,2021
HUGO LOPEZ-GATELL RAMIREZ,"En fechas próximas vamos a estar recibiendo embarques de mayor tamaño, embarques de un millón de dosis este mismo sábado y el próximo martes de las vacunas de Sinovac, Coronavac y también las vacunas de Pfizer que llegan todos los martes en una dotación cercana a 600 mil dosis.",0.0,49,11,03,2021
HUGO LOPEZ-GATELL RAMIREZ,"Cuando tengamos esto también tendremos la oportunidad de pasar ya a grandes ciudades, ciudades capitales en las entidades federativas y estaremos cubriendo de manera mucho más acelerada a la población adulta mayor, como decía esta misma mañana el presidente, esperamos que al finalizar el mes de abril o las primeras pocas semanas de mayo estaremos ya logrando vacunar a todas las personas adultas mayores, con lo que habremos concluido la etapa 1 del plan y nos pasaremos a la etapa 2 con el siguiente bloque de edad, personas entre 50 y 59 años.",0.0,93,11,03,2021
HUGO LOPEZ-GATELL RAMIREZ,"La siguiente por favor. Aquí, desglosamos, como todos los días, los distintos conjuntos para ir dejando en claro esta noción de grupos simultáneos de la población que son identificados por sus características de riesgo, como es el caso de las personas adultas mayores, o bien, por su ocupación, que también representa una condición ya sea de riesgo o de oportunidad.",0.0,60,11,03,2021
HUGO LOPEZ-GATELL RAMIREZ,¿En qué sentido?,0.0,3,11,03,2021
HUGO LOPEZ-GATELL RAMIREZ,"Las personas que trabajan en las unidades clínicas, en personal clínico, médicas y médicos, enfermeras, enfermeros, camilleros, afanadoras, recepcionistas, laboratoristas, 11 categorías laborales del personal de salud, se les ha vacunado prioritariamente, fueron la prioridad número 1 para protegerles porque tienen un mayor riesgo de exposición al virus SARS-CoV-2",0.0,49,11,03,2021
HUGO LOPEZ-GATELL RAMIREZ,"Y de ellas, ya se ha logrado vacunas a 816 mil 709 personas con una dosis más 590 mil 160 con dos dosis y esto es 72 por ciento de las personas que trabajan en el mundo clínico, ya han sido vacunadas con las dos dosis.",0.0,46,11,03,2021
HUGO LOPEZ-GATELL RAMIREZ,"Tenemos también al personal educativo, hemos destacado que por el momento sólo se ha vacunado al personal educativo en el estado de Campeche, estado que lleva muchas semanas, prácticamente ya cinco meses en el semáforo verde, un pequeño intervalo en donde perdió esta condición y pasó a semáforo amarillo, pero regresó rápidamente a semáforo verde, lo que habla de un control epidémico muy estable, muy consistente. Y siempre que lo decimos con mucho gusto felicitamos al gobierno de Campeche, al gobernador Aysa y a todo su equipo, al secretario José Luis González y a todo el equipo de salud y del gobierno de Campeche.",0.0,104,11,03,2021
HUGO LOPEZ-GATELL RAMIREZ,"Esto lo que permitió es que se presentara un escenario de oportunidad en términos del manejo de la epidemia, más allá de la protección de la salud y es la reincorporación de actividades sociales que son estratégicas, como la educación, la educación pública, que es uno de los derechos fundamentales de las sociedades y también queremos que muy pronto ya se reactive esta capacidad social de tener los servicios educativos en funcionamiento.",0.0,72,11,03,2021
HUGO LOPEZ-GATELL RAMIREZ,"Y para esto, la vacuna puede ser un elemento auxiliar de gran valor para disminuir el riesgo de transmisión y de contagios en el ámbito educativo, por supuesto también para prevenir la enfermedad en las personas que trabajan en el campo educativo, particularmente las y los mentores.",0.0,47,11,03,2021
HUGO LOPEZ-GATELL RAMIREZ,"Entonces, en Campeche vacunamos ya 17 mil 429 personas del personal educativo en dos dosis y estaremos considerando en fechas próximas otros estados que están próximos a pasar a semáforo verde y que cuando lo hagan serían candidatos para seguir el mismo curso de acción y también ya estar vacunando al personal educativo.",0.0,53,11,03,2021
HUGO LOPEZ-GATELL RAMIREZ,"Parte de este personal educativo, no perdamos de vista, son personas adultas mayores y también quedan cubiertas por su condición de edad en los grupos de alta prioridad del plan de vacunación.",0.0,32,11,03,2021
HUGO LOPEZ-GATELL RAMIREZ,"Hoy comentábamos, aquí aprovecho para platicarles, que hoy tuvimos una de las sesiones periódicas que tenemos a veces cada 15 días, a veces cada semana, con las personas titulares de los poderes ejecutivos estatales: la gobernadora Pavlovich, gobernadora de Sonora y presidenta de la Conferencia Nacional de Gobernadores, Conago; la jefa de Gobierno de la Ciudad de México, nuestra querida doctora Claudia Sheinbaum; y los 31 mandatarios estatales o sus grupos de trabajo, sus secretarias, sus secretarios de Salud y otros funcionarios locales.",0.0,83,11,03,2021
HUGO LOPEZ-GATELL RAMIREZ,"Platicamos, como siempre, en un ambiente muy amigable, muy productivo, muy constructivo y uno de los temas que precisamente la gobernadora Pavlovich resaltaba es la oportunidad de ya empezar a considerar vacunación al personal educativo en las entidades federativas que pasen al semáforo verde.",0.0,44,11,03,2021
HUGO LOPEZ-GATELL RAMIREZ,"Sonora podría ser la siguiente, esto lo veremos mañana cuando se presente el semáforo, pero estaremos seguramente en posibilidad de una o dos entidades federativas ya empezar a incorporar a su personal educativo con este propósito.",0.0,36,11,03,2021
HUGO LOPEZ-GATELL RAMIREZ,"Y las personas adultas mayores, finalmente en esta diapositiva, tenemos dos millones 338 mil 208 que han sido ya vacunadas hasta el momento, sólo de primera dosis, y estarán próximas ya a tener su segunda dosis.",0.0,36,11,03,2021
HUGO LOPEZ-GATELL RAMIREZ,"Recordar que ayer llegaron 200 mil, anteayer, 200 mil segundas dosis de la vacuna Sputnik V para ser aplicadas en las personas que recibieron la primera dosis de esta misma vacuna.",0.0,31,11,03,2021
HUGO LOPEZ-GATELL RAMIREZ,"Como todos los días, hablamos de los eventos supuestamente asociados a vacunación e inmunización y estas son las condiciones de salud, en su mayoría transitorias, de corta duración las reacciones orgánicas que presentan las personas que pueden ser vacunadas. Son menos de 0.3 por ciento las personas que presentan estos eventos o que las han presentado en México hasta el momento con estas casi tres millones 780 mil dosis de vacunas aplicadas y han sido solamente 11 mil 539 eventos.",0.0,80,11,03,2021
HUGO LOPEZ-GATELL RAMIREZ,"Afortunadamente en su gran mayoría han sido eventos de poca gravedad, más del 99 por ciento, 99.4 por ciento son eventos de poca gravedad que duran unos pocos minutos, horas, en algunos casos un par de días, como la fiebre, y se quitan espontáneamente.",0.0,44,11,03,2021
HUGO LOPEZ-GATELL RAMIREZ,"Algunos sí han sido de consideración y los enumeramos ahí, son los que se han ido agregando, a veces en forma de necesidad de hospitalización y en su mayoría han sido ya dados de alta sin mayor consecuencia y sin daño orgánico permanente.",0.0,43,11,03,2021
HUGO LOPEZ-GATELL RAMIREZ,"Hoy queremos comentar uno de los eventos que está bajo estudio y es un muy lamentable evento fatal que se presentó en una señora, una ciudadana de 75 años de edad, residente de Metepec, Hidalgo, Hidalgo, no Estado de México, sino Metepec, Hidalgo y que fue vacunada ayer, día 10, casi al medio día a las 11:30 de la mañana. Esta persona permaneció en observación por cerca de 40 minutos, que es el tiempo que normalmente damos, unos 30, 40 minutos de observación y muy desafortunadamente al momento ya de egresar de la unidad de vacunación, ponerse de pie, presentó un evento súbito, de muerte súbita.",0.0,106,11,03,2021
HUGO LOPEZ-GATELL RAMIREZ,"Y lamentamos mucho, en primer lugar, queremos decirlo, lamentamos la muerte de esta persona. Le mandamos las condolencias a la familia y lamentamos que el evento haya ocurrido.",0.0,28,11,03,2021
HUGO LOPEZ-GATELL RAMIREZ,En términos de salud pública es de extraordinaria importancia esclarecer cuáles pueden ser las causas de este evento y por eso se estudia con el rigor metodológico de la vigilancia de los Esavis.,0.0,33,11,03,2021
HUGO LOPEZ-GATELL RAMIREZ,"Existe un comité médico de dictaminación que ha sido establecido desde el inicio de la vacunación, participan en él personas de alta especialidad médica, principalmente pertenecientes a los Institutos Nacionales de Salud, el doctor Gustavo Reyes Terán, coordinador de los institutos, coordina también este comité científico médico de dictaminación.",0.0,49,11,03,2021
HUGO LOPEZ-GATELL RAMIREZ,"Para el caso que hoy nos ocupa, el que estoy comentando, hoy se realizó una autopsia, la necropsia que puede ayudar a identificar algunas pistas, algunas señales de evidencia para esclarecer la posible causa de muerte de esta persona, hoy se realizó la necropsia, participó personal local de Servicio Médico Forense, también de los servicios de patología, de los Servicios Estatales de Salud de Hidalgo y fueron asistidos por tres patólogos de alta capacidad, de alto prestigio adscritos al Instituto Nacional de Enfermedades Respiratorias, al Instituto Nacional de Cardiología y al Instituto Nacional de Neurología, fueron estos tres funcionarios federales encomendados precisamente por la importancia de este estudio anatomopatológico.",0.0,109,11,03,2021
HUGO LOPEZ-GATELL RAMIREZ,"El estudio se realizó en horas de la tarde, concluyó ya primera fase. Por el momento no existe ningún hallazgo evidente de cuál podría ser la causa directa de muerte, tampoco hay evidencia que sugiera que la vacuna pudiera haber participado en la causa de muerte de esta persona y lo que sí se encontró como un dato preliminar evidente en el estudio de la necropsia fue una enfermedad cardiaca crónica, una afección de la válvula mitral, que es una condición de salud que en décadas pasadas estaba muy asociada con una enfermedad que se llama fiebre reumática, que afectaba a personas jóvenes, pero se presentaban los daños en forma tardía con algunas afecciones en la anatomía cardiaca y en la funcionalidad de electroconducción cardiaca.",0.0,125,11,03,2021
HUGO LOPEZ-GATELL RAMIREZ,"Es un hallazgo por el momento, no es un dictamen y se continuará el martes, los tejidos que serán estudiados han sido puestos en las condiciones apropiadas, esto lleva algunos días para su completa fijación y que se proceda al estudio histopatológico, es decir, el estudio microscópico de diversos tejidos que fueron documentados.",0.0,53,11,03,2021
HUGO LOPEZ-GATELL RAMIREZ,"Nos interesa mucho que se conozca esta información, desde luego por lamentable que esta es para la persona que perdió la vida, para su familia, para sus conocidos, pero es importante que se conozca para que no se aniden teorías conspirativas o teorías de intriga o distorsión de la información que pueden llevar a dañar gravemente la credibilidad de una intervención tan importante en la salud pública como son las vacunas.",0.0,71,11,03,2021
HUGO LOPEZ-GATELL RAMIREZ,"Estos fenómenos no son exclusivos de México, estos fenómenos se estudian rigurosamente y hasta el momento no se ha determinado ninguno de los fenómenos de consideración en México, en el mundo, una asociación causal entre vacuna y estos eventos.",0.0,39,11,03,2021
HUGO LOPEZ-GATELL RAMIREZ,"Aprovecho para comentar otra cosa que también fue de interés público mundial. En Dinamarca, el gobierno decidió temporalmente suspender la vacunación con la vacuna de AstraZeneca. Esta es otra situación, cierro ya lo que comenté sobre el caso mexicano, que fue con la vacuna Coronavac-Sinovac, ahora me paso a la condición de Dinamarca en donde su gobierno decidió temporalmente suspender el uso de la vacunación de AstraZeneca en virtud de que se identificaron en los últimos pocos días tres casos de enfermedad trombótica, es decir, de coagulación de la circulación sanguínea, que fueron tres casos también en condición fatal y esto requirió un estudio especial también de los Esavis por parte del gobierno danés.",0.0,114,11,03,2021
HUGO LOPEZ-GATELL RAMIREZ,"La Agencia Europea de Medicamentos, la EMA por sus siglas en inglés, ha determinado ya, a lo largo del día de hoy que no existe evidencia de relación causal entre la vacuna AstraZeneca y fenómenos trombóticos, pero desde luego es facultad del gobierno de Dinamarca continuar los estudios que considere procedentes hasta tener completa satisfacción o tranquilidad de esta hipótesis que descartara la relación entre vacuna y condiciones trombóticas, es decir, de coagulación.",0.0,73,11,03,2021
HUGO LOPEZ-GATELL RAMIREZ,"Son los eventos que vale la pena tener presentes y el resumen de todo lo que acabo de comentar es que hasta el momento en el mundo entero, incluido México, no existe evidencia alguna que vincule a las vacunas contra COVID, contra el virus SARS COV-2 con afecciones orgánicas graves, que pudieran poner en riesgo la vida o que pudieran causar la pérdida de la vida.",0.0,66,11,03,2021
HUGO LOPEZ-GATELL RAMIREZ,Se sigue considerando que se trata de vacunas seguras y desde luego vacunas eficaces y se continuará utilizando estas vacunas y se considerará también con extremado cuidado el estudio de los Esavislos eventos supuestamente asociados a vacunación e inmunización.,0.0,39,11,03,2021
HUGO LOPEZ-GATELL RAMIREZ,"Me pasan la siguiente y penúltima diapositiva. Es para recordar la importancia de respetar su turno. Espera tu turno, por favor. Sabemos que todo mundo quisiera tener ya la vacuna, es una aspiración absolutamente legítima, relevante, respetable, pero es importante mantenernos organizados, coordinados como sociedad para que a cada quien le toque el momento más pertinente de acuerdo a sus condiciones de riesgo y de acuerdo al plan general de reducir la mortalidad por COVID 19 en México. Así que, por favor, espera tu turno y estaremos logrando tener vacunas para todas, para todos, a lo largo de las próximas pocas semanas y meses.",0.0,104,11,03,2021
HUGO LOPEZ-GATELL RAMIREZ,"La siguiente por favor. Finalmente, un recordatorio. Se están usando en México cuatro tipos de vacuna, cuatro modelos, cuatro marcas de vacuna: la de Pfizer- BioNTech, de la que han llegado tres millones 222 mil 375 unidades; la de AstraZeneca, que ha llegado a través del Instituto Serológico de la India, una muy prestigiosa compañía farmacéutica que es productora de vacunas para más de 120 países del mundo y también para el sistema Naciones Unidas; la de Sinovac-Coronavac, de la cual llegado un millón y próximamente esperamos la llegada de un millón adicional el sábado y dos millones la próxima semana; y la vacuna Sputnik V, de la cual ya llegaron las primeras dosis completas, primera dosis 200 mil, segunda dosis 200 mil, no son intercambiables y ahora tocará el uso del uso de la segunda dosis de Sputnik V.",0.0,140,11,03,2021
HUGO LOPEZ-GATELL RAMIREZ,Esto es todo por ahora de información. Desde luego abiertos a preguntas y comentarios. Le pido al doctor Ricardo Cortés si es tan amable de conducir la sesión de preguntas.,0.0,30,11,03,2021
RICARDO CORTES ALCALA,"RICARDO CORTÉS ALCALÁ: Muchísimas gracias, doctor López-Gatell, con todo gusto. Sin antes recordar a todas las personas que el informe técnico diario completo está disponible, así como las grabaciones de estas conferencias de prensa en donde damos toda la información, disponibles en coronavirus.gob.mx.",0.0,43,11,03,2021
RICARDO CORTES ALCALA,"Entonces, ahora vamos a pasar a la ronda de preguntas y será Juan, Liliana, Arturo…",0.0,15,11,03,2021
PREGUNTA,INTERVENCIÓN: Otilia.,0.0,2,11,03,2021
RICARDO CORTES ALCALA,"RICARDO CORTÉS ALCALÁ: Otilia, Otilia.",0.0,5,11,03,2021
PREGUNTA," Gracias, doctor. Buenas tardes, buenas noches, perdón. Juan Hernández, del periódico Basta de Grupo Cantón.",0.0,15,11,03,2021
PREGUNTA,"Son dos preguntas. La primera, bueno, precisamente derivado de esta investigación que están haciendo precisamente de este evento, bueno, que lo quieren atribuir a la vacunación, el hecho de manejar este tipo de información de manera alarmista, ¿cuál serían, primero, las consecuencias que estaría trayendo precisamente a estos esquemas de vacunación?",0.0,51,11,03,2021
PREGUNTA,"Y, bueno, va también esta pregunta relacionada ahorita a reacciones. Hoy en la tarde el diputado Sergio Mayer, de la Cámara de Diputados, valga la redundancia, escribe en su tuit que va a citar a declarar al subsecretario Hugo López-Gatell por el manejo de la pandemia, y vaya, pues bueno sabemos que estamos hablando de época electoral, pero vaya, este tipo de situaciones ¿cómo abonan precisamente al trabajo que está haciendo el gobierno federal precisamente en la vacunación?",0.0,78,11,03,2021
PREGUNTA,"Gracias. Me gustaría conocer su opinión de ambos, si se puede.",0.0,11,11,03,2021
RICARDO CORTES ALCALA,"RICARDO CORTÉS ALCALÁ: Muchísimas gracias, Juan. Creo que quisiera empezar diciendo el mensaje que queremos que se quede en todas las casas y todas las personas que nos ven: las vacunas que estamos aplicando en México y que se están aplicando en todo el mundo son seguras y son eficaces, eso quiere decir que nos van a proteger contra la enfermedad, con mucho mayor énfasis contra la enfermedad grave y que la aplicación de la vacuna es segura; que, como pudimos observar y el doctor López-Gatell acaba de presentar, la cantidad de eventos que supuestamente se puedan atribuir a esta vacunación son mínimos.",0.0,103,11,03,2021
RICARDO CORTES ALCALA,Esa sería mi intervención y le cedo la palaba al doctor López-Gatell.,0.0,12,11,03,2021
HUGO LOPEZ-GATELL RAMIREZ,"HUGO LÓPEZ-GATELL RAMÍREZ: Gracias, doctor Cortés.",0.0,6,11,03,2021
HUGO LOPEZ-GATELL RAMIREZ,"Nada que agregar. Coincido completamente con la declaración que acaba de hacer el doctor Ricardo Cortés, en representación de la Secretaría de Salud, ese es el mensaje: en México y en el mundo las vacunas contra el COVID 19 son vacunas seguras y eficaces, y es una responsabilidad de las autoridades sanitarias de cada país, y cuando existen autoridades regionales, verificar que las vacunas están en buenas condiciones para su uso previamente a que sean liberadas y que sean utilizadas, y también realizar la vigilancia la farmacovigilancia con respecto a su uso para estar detectando cualquier mínima señal de alguna afectación a la salud.",0.0,104,11,03,2021
HUGO LOPEZ-GATELL RAMIREZ,"Este término técnico, eventos supuestamente asociados a vacunación e inmunización, Esavi, es un término que significa precisamente eso, la condición de sospecha que se tiene cuando una persona recibe una vacuna y tiene una reacción de su organismo, cualquiera que esta sea, por mínima que sea: dolor de cabeza, dolor en sitio de inyección, fiebre, mareo, nausea, vómito.",0.0,58,11,03,2021
