Participante,Texto,Sentimiento,Palabras,Dia,Mes,Anio
ALEJANDRA FRAUSTO GUERRERO," Muchísimas gracias, querido subsecretario Hugo López-Gatell. Es un gusto estar con ustedes esta tarde. Gracias.",0.0,15,29,10,2020
ALEJANDRA FRAUSTO GUERRERO,"Aprovechamos este espacio siempre para reconocer a todo el personal de salud que lleva meses cuidando, recuperando y tratando a tantas personas en los hospitales y en estas camas que se mencionan. Gracias a ustedes por seguir comunicando cada día.",0.0,40,29,10,2020
ALEJANDRA FRAUSTO GUERRERO,"En este espacio de los jueves normalmente se habla de cultura alimentaria, de ciertos elementos de la cultura que se han ido abandonando y que han causado comorbilidades en la salud. Ahora, vamos a tocar un tema que tiene que ver también con la cultura, con una cultura muy profunda, no existe una manifestación cultural tan basta y profunda en nuestras culturas como la conmemoración y la celebración del Día de Muertos.",0.0,72,29,10,2020
ALEJANDRA FRAUSTO GUERRERO,"Esto no es exclusivo de una región, esto sucede exactamente en todo el país y somos una cultura privilegiada por tener esta posibilidad de diálogo desde la vida y de celebración de la muerte desde la vida.",0.0,37,29,10,2020
ALEJANDRA FRAUSTO GUERRERO,"Celebración de encuentro, celebración de un momento que tiene una parte mística, que tiene una parte sin duda dolorosa, que tiene una parte de duelo, pero que a través de los elementos que la cultura nos ofrece ha habido a lo largo de nuestra historia como país enormes manifestaciones de esta costumbre que tenemos en México, reconocida por supuesto en el mundo, pero lo más importante es que está viva en México.",0.0,72,29,10,2020
ALEJANDRA FRAUSTO GUERRERO,"Y este año es un año muy singular, este año esta celebración que tiene un carácter íntimo, familiar, pero también comunitario, debe de ceder el espacio comunitario en esta ocasión.",0.0,30,29,10,2020
ALEJANDRA FRAUSTO GUERRERO,Y por eso se han organizado distintas actividades que voy a mencionar de manera breve.,0.0,15,29,10,2020
ALEJANDRA FRAUSTO GUERRERO,"En primer lugar, el presidente de la República ha instruido, tanto al Instituto Nacional de los Pueblos Indígenas como a la Secretaría de Cultura, al Instituto Nacional de Antropología e Historia, a hacer un homenaje a las personas que han perdido la vida por la pandemia concentrando una ofrenda que se podrá vivir y recorrer virtualmente, esta ofrenda se colocará en el Patio de Honor de Palacio Nacional.",0.0,68,29,10,2020
ALEJANDRA FRAUSTO GUERRERO,"No tenemos memoria de que se haya realizado una ofrenda de muertos en este Palacio y lo más importante, como les decía, es que es una tradición viva en todo el país.",0.0,32,29,10,2020
ALEJANDRA FRAUSTO GUERRERO,"Estarán 20 pueblos, el totonaco, el náhuatl, hñahñu, chontal, yaqui, tarahumara, tepehuano, rarámuri, tehuano del sur, chichimeca, jonaz, huasteco, purépecha, amuzgo, ñuu savi, zapoteco, mazateco, mixe, tojolabal, tseltal y maya.",0.0,30,29,10,2020
ALEJANDRA FRAUSTO GUERRERO,"Entonces, vamos a poder reconocer estas culturas de las que somos parte a través de los 20 pueblos que provienen de cuatro rumbos diferentes.",0.0,24,29,10,2020
ALEJANDRA FRAUSTO GUERRERO,"La invitación es a hacer las ofrendas en casa, a esta tradición tan profunda que tenemos como país revivirla.",0.0,19,29,10,2020
ALEJANDRA FRAUSTO GUERRERO,"Los distintos elementos que conforman una ofrenda tienen que ver con, también, muchos productores que en este momento están pasando un momento difícil. Los productores de flor de Xochimilco, por ejemplo, aquellos que hacen pan de muerto, que hacen ceras en los distintos estados, pues son estas personas que normalmente acuden a las celebraciones comunitarias y también tiene oportunidad de vender.",0.0,61,29,10,2020
ALEJANDRA FRAUSTO GUERRERO,"La invitación es a que cada familia pueda ir a comprar estos elementos para su ofrenda con todas las precauciones, con todos los protocolos sanitarios y montar su propia ofrenda. En un altar de muertos, por ejemplo, en Yucatán, la comida tradicional es el hanal pixan, es un tipo de tamal; existe el mole de venas en Tlaxcala, las ofrendas en las zonas de la costa o de calor, o el Istmo de Tehuantepec siempre cuentan con frutos.",0.0,78,29,10,2020
ALEJANDRA FRAUSTO GUERRERO,"Pero hay elementos que permanecen como un hilo conductor en todas ellas, la flor de cempasúchil, que ustedes conocen muy bien, que esta flor de 20 pétalos. Es el 20 es el número perfecto, es el número donde se cierra la vida, y en donde no queda ninguna cuenta por saldar, por eso esta flor y el aroma tan singular del cempasúchil atrae a quienes se han adelantado.",0.0,68,29,10,2020
ALEJANDRA FRAUSTO GUERRERO,"Los arcos de flores que se hacen distintas culturas en la purépecha, en la zapoteca, son las puertas y los portales por los que los muertos pueden reconocer el camino para venir a vivir esta tradición.",0.0,36,29,10,2020
ALEJANDRA FRAUSTO GUERRERO,"Hay una flor, por ejemplo, en Michoacán que le llaman ahí ‘flor de muerto’, que es una orquídea que solamente florece en esta época. Es una orquídea morada, y en la parte central se ve como una calaverita, y solamente florea en la época de Día de Muertos.",0.0,48,29,10,2020
ALEJANDRA FRAUSTO GUERRERO,"Nuestras culturas son tan ricas, tan vivas, tan prodigiosas, que tenemos una manera de conmemorar este momento tan duro que estamos viviendo con un homenaje de lo más vivo que tenemos, que son justamente estas culturas.",0.0,36,29,10,2020
ALEJANDRA FRAUSTO GUERRERO,"Entonces, a través de la dirección de Comunicación Social y Vocería de Presidencia de la República con todo el sistema de medios públicos, en coordinación Cepropie, los compañeros que pasan aquí las cámaras todo el tiempo, se hará un registro muy puntual de todos estos altares y se podrán disfrutar desde los medios públicos, desde los canales de transmisión del gobierno de la República, desde la página Contigo en la distancia.",0.0,71,29,10,2020
ALEJANDRA FRAUSTO GUERRERO,"Los horarios puntuales los dará a conocer Presidencia en las próximas horas, seguramente el día de mañana.",0.0,17,29,10,2020
ALEJANDRA FRAUSTO GUERRERO,"Vamos a tener oportunidad de compartir con ustedes también Un Canto a la Memoria, un concierto de Lila Downs que se grabó sin público en el Auditorio Nacional para conmemorar la memoria de quienes nos ha dejado.",0.0,37,29,10,2020
ALEJANDRA FRAUSTO GUERRERO,Este concierto se transmitirá en el Canal 22 y en Contigo en la distancia el 1º de noviembre a las nueve de la noche y se repetirá el 2 de noviembre.,0.0,31,29,10,2020
ALEJANDRA FRAUSTO GUERRERO,"Este concierto quedará también ya permanente en la página de Contigo en la distancia y será entrada libre, cupo ilimitado.",0.0,20,29,10,2020
ALEJANDRA FRAUSTO GUERRERO,"Tenemos también actividades de cine, como Cine Mictlán, por ejemplo, el Centro Cultural Tijuana dedica su ofrenda a Carlos Monsiváis a 10 años de su muerte; existirá por primera vez de manera virtual el Festival de las Calacas, que es un festival dedicado a los niños, esta es su vigésima edición y lo podrán encontrar también en contigoenladistancia.",0.0,58,29,10,2020
ALEJANDRA FRAUSTO GUERRERO,"Y, por supuesto, el Instituto Nacional de Antropología e Historia hace una visita guiada de manera virtual a la exposición de Xolos. El xoloitzcuintle, como ustedes saben, es nuestro compañero de viaje al inframundo, al Mictlán, es el compañero que nos guía a partir de la muerte.",0.0,47,29,10,2020
ALEJANDRA FRAUSTO GUERRERO,"Y esta exposición tendrá una visita, también virtual, es una exposición muy bella donde se muestra, por ejemplo, la época virreinal de la pintura, donde desapareció el xoloitzcuintle de la pintura y donde solamente se manifestaban los perros que no venían justamente de nuestra cultura. Es muy interesante esta exposición.",0.0,50,29,10,2020
ALEJANDRA FRAUSTO GUERRERO,"En el Museo del Carmen también se hace un homenaje al maestro Manuel Felguérez, que falleció también este año, grandes artistas no han dejado este año y vamos a conmemorarlos.",0.0,30,29,10,2020
ALEJANDRA FRAUSTO GUERRERO,"El día de hoy un gran pintor, Arturo Rivera, y mandamos nuestras condolencias a la familia, perdió la vida, no por COVID, pero lo estamos despidiendo.",0.0,26,29,10,2020
ALEJANDRA FRAUSTO GUERRERO,"Distintos concursos y actividades se están desarrollando para que desde sus casas puedan sentir ese tránsito que normalmente tenemos en las plazas con las ofrendas, en los panteones.",0.0,28,29,10,2020
ALEJANDRA FRAUSTO GUERRERO,"Y la invitación es, a toda consciencia, que hagamos esta fiesta íntima. Será un gran momento para la reflexión sobre lo que nos ha pasado como humanidad.",0.0,27,29,10,2020
ALEJANDRA FRAUSTO GUERRERO,"Tenemos esta extraordinaria herramienta cultural que es la celebración de muertos en México. Esto nos lleva a la conciencia profunda de lo que nos puede cimbrar como país y como país siempre salimos adelante. La cultura, como dice nuestro presidente, siempre nos ha salvado, esta no será la excepción, somos un pueblo muy consciente, muy solidario, muy generoso, y pues estos tiempos invitamos a esa responsabilidad, a cuidarnos, a hacer nuestros altares en casa y a cuidar la vida, a cuidar la vida nuestra y a cuidar la vida de los demás.",0.0,92,29,10,2020
ALEJANDRA FRAUSTO GUERRERO,"Y pues hablando de pueblos originarios, tenemos el honor de contar dentro nuestro equipo con Mardonio Carballo, querido Mardonio, director general de Culturas Populares, en voz propia, en lengua propia, nos podrá dar un ejemplo de esta cultura.",0.0,38,29,10,2020
ALEJANDRA FRAUSTO GUERRERO,Muchas gracias.,0.0,2,29,10,2020
HUGO LOPEZ-GATELL RAMIREZ," Por favor, estimado Mardonio.",0.0,4,29,10,2020
MARDONIO CARBALLO MANUEL, (Habla en lengua indígena),0.0,4,29,10,2020
HUGO LOPEZ-GATELL RAMIREZ," Muchas gracias, estimado Mardonio; muchas gracias, secretaria.",0.0,7,29,10,2020
HUGO LOPEZ-GATELL RAMIREZ,"Este día y estos días próximos, como ya se ha comentado y lo comentaremos también mañana, tienen este significado muy importante, muy especial, que obviamente cobra una relevancia adicional cuando hemos perdido a más de 90 mil personas mexicanas, posiblemente otras tantas que están ahora sin una identificación sobre causa de defunción, pero que están en el proceso de dictaminación.",0.0,60,29,10,2020
HUGO LOPEZ-GATELL RAMIREZ,"Antes de entrar a la sesión de preguntas y respuestas, quisiera recordar a todas, todos aquí y allá en casa, que en esta conferencia de prensa que tiene un carácter científico, técnico donde explicamos lo que se está haciendo para responder a la epidemia y donde compartimos información al público para orientar las medidas de precaución, muchas veces usamos estadísticas, usamos números, hablamos de números de eventos acumulados, personas que han enfermado, personas que han sido hospitalizadas, personas que lamentablemente pierden la vida.",0.0,83,29,10,2020
HUGO LOPEZ-GATELL RAMIREZ,"Pero como lo hemos dicho en otras ocasiones, como lo ha dicho el presidente también repetidamente, nunca perdamos la vista la dimensión humana de este fenómeno que afecta a toda la humanidad. Esta es una situación extraordinaria, no se había presentado en más de 100 años que una enfermedad epidémica, una enfermedad infecciosa, tuviera un impacto tan grande en tan poco tiempo.",0.0,62,29,10,2020
HUGO LOPEZ-GATELL RAMIREZ,"Entonces, detrás de cada número está un ser humano y está un ser humano que deja un vacío en su familia, en su comunidad, y en la sociedad en su conjunto. Tristemente otras personas también, independientemente de la epidemia, han ido perdiendo seres queridos, nuestra propia amiga y secretaria querida Alejandra, que acaba de perder a su padre hace menos un mes, y siempre hay que tocar con el corazón, con el afecto y con absoluto respeto esta situación que viven las personas en México.",0.0,85,29,10,2020
HUGO LOPEZ-GATELL RAMIREZ,"Vamos a abrir, por favor, a preguntas y comentarios. Empezamos con Liliana Noble, de Pulso Saludable, después usted, después Fernanda, después Arturo.",0.0,22,29,10,2020
PREGUNTA," Buenas noches. Liliana Noble, de Pulso Saludable.",0.0,7,29,10,2020
PREGUNTA,"Secretaria, quisiera saber si entendí. El presidente en la conferencia de prensa anunció el tema de la ofrenda, pero no sé si entendí mal, él dijo que podía entrar a Palacio Nacional o podía venir quien quisiera.",0.0,37,29,10,2020
PREGUNTA,"Entonces, ¿no va a ser así?, ¿solamente va a ser un tema virtual? Y si estas calaveras que se ponían, los cráneos que se ponían en Reforma no los transformaría en una presentación virtual, a lo mejor valdría la pena considerarlo y no guardarlos en una bodega, como se dice que están.",0.0,52,29,10,2020
PREGUNTA,"Y doctor Gatell, tuve la oportunidad de estudiar en esta universidad muy famoso en Boston y ahí uno de los maestros nos decía al ABC más o menos para seguir identificar nosotros los periodistas cuando un estudio era valioso y no irnos nada más por la fuente o incluso por el título que se quería perseguir, el objetivo.",0.0,58,29,10,2020
PREGUNTA,"Y he revisado muchos estudios en donde hablan de que los pacientes que tuvieron COVID, sobre todo esos intubados, ahora pueden resultar con daño serio o cognitivo, incluso algunos estudios hablan de que pueden ser COVID causa de desarrollar en el futuro esclerosis múltiple, Alzheimer, Parkinson.",0.0,46,29,10,2020
PREGUNTA,"No sé si esta información sea muy prematura, porque hay mucha gente que tiene esta enfermedad o hay otros que viven en sus casas y tienen familiares y pudiera estar pensando a lo mejor alguien que salió de la intubación que más adelante va a poder desarrollar o puede estar vulnerable a desarrollar esto. ¿Ahí cuál sería la recomendación?, ¿cómo tomar en base…? Yo entiendo que son estudios serios, se han publicado algunos en Lancet, pero se me hace como que es todavía muy temprano para asegurar cosas tan serias.",0.0,90,29,10,2020
PREGUNTA,Gracias.,0.0,1,29,10,2020
ALEJANDRA FRAUSTO GUERRERO," Gracias, Liliana. Efectivamente, la ofrenda, por decisión del presidente, será grabada y será transmitida y se podrá conocer de manera virtual.",0.0,21,29,10,2020
ALEJANDRA FRAUSTO GUERRERO,"A él lo acompañarán los integrantes de los 20 pueblos que vendrán a montar los altares solamente y se podrá ver a través de los medios públicos, a través de esta organización, justamente al acabar esta conferencia tenemos una reunión para ultimar detalles de este tema.",0.0,46,29,10,2020
ALEJANDRA FRAUSTO GUERRERO,"En cuanto a la exposición que refieres, Liliana, de Mexicráneos, está organizada por la Ciudad de México. Podría yo con todo gusto hacerles el comentario que atinadamente señalas.",0.0,28,29,10,2020
ALEJANDRA FRAUSTO GUERRERO,"Y justamente se retiraron de Reforma por la aglomeración. Sabemos que ha pasado mucho tiempo, que la gente tiene ganas de reunirse, de salir a la calle, no tenemos que dar motivo para reunir a masas de gente que puede resultar riesgoso en el momento de epidemia mundial que estamos viviendo.",0.0,51,29,10,2020
ALEJANDRA FRAUSTO GUERRERO,"No queremos ser, el sector cultural nunca, un sector que provoque un recontagio, somos muy responsables en los protocolos y en las indicaciones que las autoridades de salud y de la propia Ciudad de México nos dan o en los estados en donde se realizan actividades culturales.",0.0,47,29,10,2020
ALEJANDRA FRAUSTO GUERRERO,"La vocación cultural es reunir gente, es convocar y por eso hemos sido absolutamente responsables y cautos en de qué manera podemos conservar un pacto que hicimos por no parar la cultura, porque sin la cultura qué hubiera sido de nosotros en esta pandemia sin literatura, sin música, sin cine, sin las distintas manifestaciones artísticas, pero no podemos poner nunca en riesgo la vida.",0.0,64,29,10,2020
ALEJANDRA FRAUSTO GUERRERO,Somos un sector muy consciente también y estamos para colaborar en ello y hago el comentario de la virtualidad de esa exposición.,0.0,22,29,10,2020
ALEJANDRA FRAUSTO GUERRERO,Gracias.,0.0,1,29,10,2020
HUGO LOPEZ-GATELL RAMIREZ, Muchas gracias.,0.0,2,29,10,2020
HUGO LOPEZ-GATELL RAMIREZ,"Antes de abordar la otra pregunta quisiera aquí complementar lo que ha dicho la secretaria Frausto. Efectivamente, desde marzo, la primera semana de marzo, la secretaria Alejandra Frausto fue una de las primeras que nos contactó a la Secretaría de Salud de manera muy proactiva ofreciendo ayuda para integrar los protocolos de seguridad sanitaria en los recursos culturales y también protocolos específicos para el cuidado de la comunidad artística y cultural nuestro país, también convocó la participación de las personas creadoras a que ayudaran a hacer mensajes de difusión.",0.0,89,29,10,2020
HUGO LOPEZ-GATELL RAMIREZ,"Quisiera aprovechar para agradecerles a todas y todos ellos, todos los miembros de la comunidad artística y cultural de México que han estado muy activos y activas ayudando a difundir mensajes de prevención, de promoción de la salud.",0.0,38,29,10,2020
HUGO LOPEZ-GATELL RAMIREZ,"Muchas gracias, secretaria; muchas gracias a la comunidad.",0.0,8,29,10,2020
HUGO LOPEZ-GATELL RAMIREZ,"Respecto a lo que pregunta Liliana, sí considero que es temprano, consideramos, lo hemos analizado que es temprano todavía llegar a conclusiones con muy pocos estudios respecto al potencial de COVID-19 como enfermedad o el virus SARS-CoV-2 como agente infeccioso de causar daños permanentes en sistema nervioso central.",0.0,48,29,10,2020
HUGO LOPEZ-GATELL RAMIREZ,"El sistema nervioso central está constituido del encéfalo, el cerebro, el cerebelo, la médula espinal y hay un número de enfermedades importantes de origen infeccioso o posinfeccioso que es una consecuencia posterior al daño directo por los agentes infecciosos que afectan a esta sistema o a este segmento del sistema nervioso, pero no se conoce todavía con certidumbre evidencia consistente a lo largo de múltiples estudios que esclarezcan la frecuencia con lo que esto ocurre, la probabilidad de que esto se presente, los criterios de asociación causal, es decir, que se pueda reconocer que es COVID-19 la causa de estos daños o alguna otra causa.",0.0,105,29,10,2020
HUGO LOPEZ-GATELL RAMIREZ,Generalmente la construcción de la evidencia científica requiere un esfuerzo de múltiples perspectivas en donde se integra evidencia en distintos ámbitos del conocimiento.,0.0,23,29,10,2020
HUGO LOPEZ-GATELL RAMIREZ,"En el caso de las ciencias de salud, puede ser desde explicaciones sobre la biología subcelular, celular, tisular, orgánica de los daños, la presentación clínica y los mecanismos de lo que llamamos médicamente fisiopatología, es decir, los mecanismos de daño en el funcionamiento del organismo, hasta la evidencia que proviene de la ciencia básica de la salud pública, la epidemiología, tanto clínica como poblacional.",0.0,64,29,10,2020
HUGO LOPEZ-GATELL RAMIREZ,"Entonces, aunque efectivamente se han publicado en revistas científicas de alto prestigio, como es Lancet, algunos estudios que sugieren asociación entre daños al cerebro y por lo tanto a las funciones mentales relacionados con COVID-19, no debemos concluir todavía que haya una relación causal, donde COVID o el virus que causa COVID sea el agente de daño, ni tampoco necesariamente que esto sea algo que consistentemente va a ocurrir en las personas enfermas. Entonces, hay que tener todavía cautela al respecto.",0.0,81,29,10,2020
HUGO LOPEZ-GATELL RAMIREZ,Gracias.,0.0,1,29,10,2020
PREGUNTA," Buenas noches a todos. Doctor López-Gatell, soy Gerardo Suárez, reportero en Heraldo de México.",0.0,14,29,10,2020
PREGUNTA,Quiero preguntarle si… Mejor dicho ¿cómo van las proyecciones o modelos matemáticos que a lo largo de la pandemia les han servido de guía para saber qué comportamiento se puede esperar?,0.0,31,29,10,2020
PREGUNTA,"Y lo pregunto a propósito del repunte que ha habido en algunos estados, entonces, ¿qué se ve a nivel nacional para los próximos meses a partir de estos modelos?",0.0,29,29,10,2020
PREGUNTA,Gracias.,0.0,1,29,10,2020
HUGO LOPEZ-GATELL RAMIREZ," Cómo no, con mucho gusto. Los ejercicios de modelación matemática que hemos utilizado desde el inicio de la epidemia nos han permitido reconocer las trayectorias, es decir, el cambio respecto al tiempo en la ocurrencia de la epidemia, principalmente con los tres indicadores fundamentales, que son la cantidad de personas que se registran enfermas por día, la cantidad de personas que serán hospitalizadas por día y la cantidad de personas que desafortunadamente perderán la vida por el COVID-19.",0.0,78,29,10,2020
HUGO LOPEZ-GATELL RAMIREZ,"El propósito de estos modelos matemáticos de predicción o proyección es múltiple, pero en términos generales es reconocer cuál podría ser la duración y los momentos de máxima intensidad epidémica y los que son de menor intensidad epidémica.",0.0,38,29,10,2020
HUGO LOPEZ-GATELL RAMIREZ,"Aprovecho para agradecer aquí a la doctora María Elena Álvarez-Buylla, directora general del Conacyt, y al propio Conacyt, también a la comunidad académica de las instituciones públicas de educación e investigación, como la Universidad Nacional Autónoma de México, especialmente el Instituto de Matemáticas y al Centro de Investigación en Matemáticas, Cimat, un centro público de investigación.",0.0,56,29,10,2020
HUGO LOPEZ-GATELL RAMIREZ,"Ahora, estos modelos al inicio tenían una mayor utilidad para poder reconocer los momentos de máxima intensidad epidémica cuando todavía estaba un solo modelo de abordaje de la mitigación comunitaria.",0.0,30,29,10,2020
HUGO LOPEZ-GATELL RAMIREZ,"Recordar que mitigación quiere decir reducción, cuando decimos mitigación de una epidemia es reducir la intensidad epidémica, es decir, menos casos, menos contagios, menos transmisión.",0.0,25,29,10,2020
HUGO LOPEZ-GATELL RAMIREZ,"Y teníamos un solo modelo que se instauró formalmente a partir del 23 de marzo y duró hasta el 30 de mayo, empezó de manera preliminar con el Sistema Educativo Nacional el 14 de marzo, cuando teníamos tan sólo 12 casos, justo ese sábado platiqué con la secretaria Frausto al respecto de lo que estamos diciendo de los protocolos y era de gran utilidad para predecir o proyectar la ocurrencia epidémica en el país y en las entidades federativas en un momento donde teníamos un solo abordaje.",0.0,87,29,10,2020
HUGO LOPEZ-GATELL RAMIREZ,"Posteriormente, a partir del 1º de junio, entramos al proceso de la Nueva Normalidad en donde en vez de tener una sola serie de intervenciones empezamos a tener múltiples ritmos de ocurrencia de esas intervenciones a través del semáforo COVID.",0.0,40,29,10,2020
HUGO LOPEZ-GATELL RAMIREZ,"Recordar lo que hemos dicho múltiples veces, cada autoridad sanitaria estatal, es decir, las personas mandatarias de las entidades federativas ha decidido en lo que le corresponde como una atribución legal administrar o establecer las medidas administrativas para el confinamiento o el desconfinamiento, guiadas siempre por el semáforo de riesgo COVID, que es un solo semáforo con una sola metodología nacional.",0.0,61,29,10,2020
HUGO LOPEZ-GATELL RAMIREZ,Y esto ha resultado en que las predicciones o proyecciones han ido cambiando de manera muy importante porque entidades federativas que tienen un apego más estricto a las medidas de confinamiento han tenido una realidad que es más cercana a las predicciones.,0.0,42,29,10,2020
HUGO LOPEZ-GATELL RAMIREZ,"Pero en varias entidades federativas nos hemos encontrado la circunstancia de que las medidas ya no son tan estrictas aumenta la movilidad de las personas en el espacio público y consecuentemente la curva epidémica resultante, la curva de la realidad, empieza a diferir de lo predicho, y hay dos maneras generales en las que difiere: una es que se prolonga la epidemia y la otra es que cambia la trayectoria, en vez de reducirse, de acuerdo a una predicción empieza a aumentar, esto ha pasado en las 32 entidades en distinta magnitud.",0.0,92,29,10,2020
HUGO LOPEZ-GATELL RAMIREZ,"Y esto nos ha llevado a que, aunque conservamos los ejercicios de predicción, de proyección semanalmente ya no tienen un significado tan inmediato para considerar los escenarios de lo que va a ocurrir.",0.0,33,29,10,2020
HUGO LOPEZ-GATELL RAMIREZ,"Y en cambio, estamos evaluando de manera más dinámica lo que ocurre en los periodos de 10 días en los estados, precisamente a través de la metodología del semáforo.",0.0,29,29,10,2020
HUGO LOPEZ-GATELL RAMIREZ,"Esto en términos técnicos de la epidemiología y la inteligencia epidemiológica se distingue en dos perspectivas: una que se llama predicción de mediano y largo plazo y otra que se llama predicción inmediata. Hay unos términos en inglés para describirlo es fore casting predicción a largo plazo y otra que se llama now casting, predicción de ahorita.",0.0,57,29,10,2020
HUGO LOPEZ-GATELL RAMIREZ,"Usamos un intervalo de 10 días y es precisamente lo que se usa para estimar los parámetros del semáforo, estas compañeras y compañeros de los institutos de matemáticas que he mencionado son quienes realizan esta predicción.",0.0,36,29,10,2020
HUGO LOPEZ-GATELL RAMIREZ,"Ahora en términos generales y de interés público y le agradezco la pregunta, todo mundo legítimamente se pregunta: ‘Y bueno ¿qué va a pasar?, ¿cuándo se va a acabar la epidemia en México, en el mundo, en mi comunidad, en mi estado?’",0.0,42,29,10,2020
