Participante,Texto,Sentimiento,Palabras,Dia,Mes,Anio
GUILLERMO SANTIAGO RODRIGUEZ," Hola, buenas tardes a todas y a todos. Un gusto en poder saludarles.",0.0,13,4,09,2020
GUILLERMO SANTIAGO RODRIGUEZ,Vamos a empezar con un video que justamente plantearía el tema de hoy.,0.0,13,4,09,2020
PREGUNTA," Las Fábricas de Economía Solidaria son espacios para propiciar ecosistemas favorables para la creación, desarrollo y consolidación de emprendimientos, cooperativas y herramientas que permitan a las y los jóvenes construir trayectorias de trabajo innovadoras, sostenibles, que fomenten el trabajo digno y solidario.",0.0,42,4,09,2020
PREGUNTA,"Este año, 16 entidades fueron beneficiadas con este modelo, diseñado en colaboración con el Instituto Nacional de Economía Social y puesta en marcha en coinversión con las instancias estatales de juventud.",0.0,31,4,09,2020
PREGUNTA,"Se trabajará en vinculación con el Corredor Interoceánico del Istmo de Tehuantepec, organismo público encargado de impulsar el desarrollo en la región del istmo, con la participación de las comunidades, los pueblos y la sociedad.",0.0,35,4,09,2020
PREGUNTA,"El Corredor Interoceánico coordinada diversos componentes para lograr el bienestar de las personas de la región, conformada por 79 municipios, 46 en Oaxaca y 33 en Veracruz.",0.0,27,4,09,2020
PREGUNTA,Es así que Imjuve el Corredor Interoceánico del Istmo de Tehuantepec sumaremos esfuerzos para lograr el éxito en los programas prioritarios en los estados de Oaxaca y Veracruz.,0.0,28,4,09,2020
GUILLERMO SANTIAGO RODRIGUEZ," Bien, como es sabido por todos y todas, la contingencia ha traído un problema económico para toda la población, pero que ha afectado con especial intensidad en las personas jóvenes.",0.0,30,4,09,2020
GUILLERMO SANTIAGO RODRIGUEZ,"Por ello, el Instituto Mexicano de la Juventud y el Instituto Nacional de Economía Social lanzamos el componente Fábricas de Economía Solidaria.",0.0,22,4,09,2020
GUILLERMO SANTIAGO RODRIGUEZ,¿Con qué finalidad?,0.0,3,4,09,2020
GUILLERMO SANTIAGO RODRIGUEZ,"Con la finalidad de poder dar acompañamiento a las y los jóvenes crecer, contar con herramientas que les permitan generar bienestar para ellos y para sus familias. Justo el principal objetivo de este componente es buscar el bienestar de las personas jóvenes en México.",0.0,44,4,09,2020
GUILLERMO SANTIAGO RODRIGUEZ,¿Qué son las Fábricas de Economía Solidaria?,0.0,7,4,09,2020
GUILLERMO SANTIAGO RODRIGUEZ,"Son espacios físicos en los que las personas jóvenes van a contar con el apoyo para la creación, el desarrollo y la consolidación de emprendimientos colectivos, buscamos que las y los jóvenes cuenten con este acompañamiento para buscar experiencias en innovación económica, basadas todas en los ámbitos de la economía social.",0.0,51,4,09,2020
GUILLERMO SANTIAGO RODRIGUEZ,"Tenemos la firme convicción que el corporativismo y la economía social es una de las principales herramientas con las que vamos a contar para ir ayudando y contribuyendo a cerrar la brecha de desigualdad que existe hoy en día en nuestro país y que, como sabemos, estructuralmente afecta a las y los jóvenes.",0.0,53,4,09,2020
GUILLERMO SANTIAGO RODRIGUEZ,"Justo esto es un programa que también en coinversión con las instancias estatales de juventud, que son grandes aliados en el ejercicio cotidiano de la política pública para las y los jóvenes de todo el país.",0.0,36,4,09,2020
GUILLERMO SANTIAGO RODRIGUEZ,"Tenemos la firme convicción que justo esta pandemia, como lo hemos mencionado, nos ha enseñado que es desde la colectividad como se encuentran las soluciones a los problemas actuales. En las Fábricas de Economía Solidaria se implementarán las siguientes estrategias.",0.0,40,4,09,2020
GUILLERMO SANTIAGO RODRIGUEZ,"Número uno, emprendimiento social, estará abocado especialmente a aquellos jóvenes, a aquellos grupos de jóvenes que desean emprender.",0.0,18,4,09,2020
GUILLERMO SANTIAGO RODRIGUEZ,"Número dos, el impulso a la seguridad alimentaria, se está plateando justo que a través de estos centros se pueda empezar el fomento de huertos urbanos desde las juventudes, no solamente los huertos en estos espacios, sino brindar las capacitaciones para que, a partir de ahí, en sus hogares, en los espacios en los que ellos puedan desarrollarlo, puedan continuarlo, sumándonos al plan de bienestar que hay a nivel nacional, para que pueda existir alimentación sana y digna.",0.0,78,4,09,2020
GUILLERMO SANTIAGO RODRIGUEZ,"Número tres, promoción de la cultura de la paz, estrategia que es sumamente importante para poder luchar para reconstruir el tejido social. Cabe mencionar que este programa está dirigido a todas las juventudes, pero principalmente a aquellas que históricamente habían sido vulneradas, aquellos y aquellas jóvenes que tienen pocos recursos o que han tenido pocas experiencias y acompañamientos como este.",0.0,60,4,09,2020
GUILLERMO SANTIAGO RODRIGUEZ,"Número cuatro, el fomento al trabajo digno.",0.0,7,4,09,2020
GUILLERMO SANTIAGO RODRIGUEZ,"Número cinco, como lo mencionaba, el acompañamiento solidario, capacitación técnica, salud emocional, seguimiento de proyectos, etcétera. Uno de los grandes problemas que hemos detectado cuando hay emprendimientos colectivos, sobre todo no es el inicio, sino el acompañamiento después. Por ello generamos estos espacios para brindar un acompañamiento constante y permanente a estas personas jóvenes.",0.0,54,4,09,2020
GUILLERMO SANTIAGO RODRIGUEZ,"Bien, en este momento vamos a vivirlo por fases, la primera fase cuenta con 16 estados de la República en donde vamos a empezar con una inversión del Instituto Mexicano de la Juventud de 120 mil pesos por cada fábrica más, hay que sumarle, cada estado va a determinar la cantidad de recursos que va a incluir para sus espacios.",0.0,60,4,09,2020
GUILLERMO SANTIAGO RODRIGUEZ,"En este momento los estados seleccionados, que fueron seleccionados en un comité de selección entre el Instituto Mexicano de la Juventud y el Instituto Nacional de Economía Social son los siguientes:",0.0,31,4,09,2020
GUILLERMO SANTIAGO RODRIGUEZ,"Está Tlaxcala, Zacatecas, Baja California Sur, Chiapas, Jalisco, Hidalgo, Guerrero, Nayarit, Michoacán, Campeche, Veracruz, Oaxaca, Quintana Roo y el Estado de México. Con esos estados son con los que nos quedamos a arrancar y en enero vamos a sacar la segunda fase para estar en todo el territorio nacional.",0.0,49,4,09,2020
GUILLERMO SANTIAGO RODRIGUEZ,"Bien, algo importante que mencionar también es que las Fábricas de Economía Solidaria se van a vincular con dos proyectos estratégicos del Gobierno de México, como en el video mencionaban, con el corredor interoceánico y también con el Tren Maya.",0.0,40,4,09,2020
GUILLERMO SANTIAGO RODRIGUEZ,"En el Corredor Interoceánico estaremos en Veracruz y en Oaxaca, y en el Tren Maya estaremos en Quintana Roo, en Chiapas y en Campeche. Esto también con la finalidad de ir contribuyendo y acompañando estos proyectos tan importantes y que van a impactar de manera significativa a estas regiones, que van a ser detonantes del desarrollo del bienestar, pero justo lo que queremos es acompañar este proceso con la participación de las y los jóvenes.",0.0,75,4,09,2020
GUILLERMO SANTIAGO RODRIGUEZ,"Con esto terminamos lo de Fábricas de Economía Solidaria, que justamente ya arrancamos, en un mes aproximadamente estaremos ya habilitando los espacios, dependiendo del semáforo de cada uno de los estados es como empezaríamos a aperturarlos ya para que sea presencial.",0.0,41,4,09,2020
GUILLERMO SANTIAGO RODRIGUEZ,"Y, como lo mencionaba, por otro lado continuamos con el programa Raicees, que es igual a un programa de acompañamiento técnico para jóvenes que deseen realizar emprendimiento social, este es de manera virtual, ya arrancamos el día 1º de septiembre, estamos con tres mil jóvenes de todo el territorio nacional, justo para brindar estas capacitaciones son dos meses y al finalizar esta capacitación también estaremos ayudándolos con la vinculación de otros programas u otras acciones que les permitan continuar con sus emprendimientos.",0.0,82,4,09,2020
GUILLERMO SANTIAGO RODRIGUEZ,"Y para terminar, quiero compartirles que es algo que hemos venido trabajando constantemente, el programa Contacto Joven, que es un programa de acompañamiento emocional a las y los jóvenes de todo el país, compartirles un poco de cómo vamos.",0.0,39,4,09,2020
GUILLERMO SANTIAGO RODRIGUEZ,"La verdad, estamos muy contentos y contentas por la respuesta que hemos recibido y también con mucha claridad de la importancia que tiene el cuidado de la salud mental en toda la población, pero principalmente en las juventudes de México.",0.0,40,4,09,2020
GUILLERMO SANTIAGO RODRIGUEZ,"Al día de hoy llevamos dos mil 858 casos ya atendidos, cinco mil 74 atenciones de cada uno de los problemas que se han presentado, el 38 por ciento de las personas que han llamado ha sido por estrés, el 25 por ciento por el tema de emociones, el 13 por ciento por pensamientos, muchas veces pensamientos de generarse daño a sí mismos, el 14 por ciento por crisis, el tres por ciento por violencia y el cuatro por ciento por adicción a sustancia sicoactivas.",0.0,85,4,09,2020
GUILLERMO SANTIAGO RODRIGUEZ,"Algo también que destacar. Como lo hemos venido diciendo, el 66 por ciento son mujeres jóvenes, de las cuales en promedio en general, de 20 a 29 años, es el 70 por ciento de las personas que están recurriendo a este contacto.",0.0,42,4,09,2020
GUILLERMO SANTIAGO RODRIGUEZ,"Nuevamente hacemos la invitación a todas las personas jóvenes que deseen se acompañadas en este espacio de diálogo interacción, es muy fácil, sólo hay que mandar un WhatsApp con la palabra ‘contacto’ al 55 72 11 2019, lo repito, 55 72 11 2019, y de manera inmediata le darán vinculación con otro joven para que de persona a persona y que puedan tener un acompañamiento dependiendo el tema que traiga, el problema que traiga, puede ser de dos sesiones de un mes hasta seis meses.",0.0,85,4,09,2020
GUILLERMO SANTIAGO RODRIGUEZ,Para cerrar mi participación quiero decir que es muy importante justo entender que la atención de las personas jóvenes debe hacerse de una manera integral y transversal de todas las políticas públicas en el país.,0.0,35,4,09,2020
GUILLERMO SANTIAGO RODRIGUEZ,"Eso es sumamente necesario, es un momento delicado para el mundo, pero especialmente para nuestra generación y por ello desde el Gobierno de México es que están haciendo todas estas acciones para poner en el centro de la política pública a las personas, a los y los jóvenes, y lograr la inclusión, como bien decimos, que nadie se quede afuera, que nadie se quede atrás y por eso mismo desde el Imjuve seguiremos trabajando por ello.",0.0,76,4,09,2020
GUILLERMO SANTIAGO RODRIGUEZ,"Muchas gracias. Excelente, tarde.",0.0,4,4,09,2020
HUGO LOPEZ-GATELL RAMIREZ," Muchas gracias, Guillermo Santiago, director general del Instituto Mexicano de la Juventud.",0.0,12,4,09,2020
HUGO LOPEZ-GATELL RAMIREZ,"Aprovecho para comentarles un par de cosas que me adelanto a hechos próximos, la Estrategia Nacional de Prevención de Adicciones Juntos por la Paz, la ENPA, ha seguido trabajando, como lo ha señalado el doctor Quijada, el doctor Gady Zabicky, nuestros colegas del campo de la salud mental y las adicciones, la doctora Lorena Rodríguez Bores, la doctora Evalinda Barrón, etcétera y uno de los pilares de esta estrategia es precisamente el trabajo con la juventud.",0.0,76,4,09,2020
HUGO LOPEZ-GATELL RAMIREZ,Lo que hace Guillermo Santiago y su equipo ha sido fundamental para abrir este trabajo hacia la juventud desde el territorio con las propias comunidades movilizándose por sus propios intereses en defensa de sus derechos y es un pilar de la estrategia.,0.0,42,4,09,2020
HUGO LOPEZ-GATELL RAMIREZ,"Digo que me adelanto porque próximamente, por instrucción del presidente volveremos a reactivar la parte de comunicación pública, de comunicación social relativa a la ENPA, pero estamos retomando sobre el trabajo que se continuó durante todos estos meses de la epidemia COVID, no ha parado la estrategia nacional y hoy Guillermo Santiago nos comenta de algunos de los elementos cruciales de esta construcción del bienestar a partir de las economías solidarias locales.",0.0,72,4,09,2020
HUGO LOPEZ-GATELL RAMIREZ,"El domingo, por cierto, viene el doctor Zabicky nuevamente y nos hablará de algunas de las otras adicciones que han quedado pendientes de mencionar, recientemente vino a hablar de alcohol, también de tabaco y hablará de adicciones y justamente verán ustedes este trabajo sinérgico con Imjuve. Muchas gracias, Guillermo.",0.0,49,4,09,2020
HUGO LOPEZ-GATELL RAMIREZ,Y aprovecho también para comentar una noticia positiva. En días recientes tuvimos un reto importante con documentos críticos que tienen que ver con la certificación de la muerte.,0.0,28,4,09,2020
HUGO LOPEZ-GATELL RAMIREZ,"Hay un documento oficial que se llama certificado de defunción, este fue establecido en México con un carácter nacional en los años 90, no más que eso, en los años 90 se estableció como un documento de carácter oficial para certificar las causas de defunción.",0.0,45,4,09,2020
HUGO LOPEZ-GATELL RAMIREZ,"Y desde luego, en la situación de una epidemia en donde ha habido un número importante de personas que han perdido la vida, no solamente las que directamente están registradas como que han perdido la vida por el COVID, sino lo que presentó el doctor Ruy López Ridaura hace algunas semanas, este exceso de mortalidad que todos los países del mundo han estado enfrentando. Algunos países tienen el doble, el triple, cuatro veces, cinco veces, algunos tienen hasta seis o incluso siete veces la mortalidad habitual por diversas causas.",0.0,89,4,09,2020
HUGO LOPEZ-GATELL RAMIREZ,Los países europeos de los países de la Unión Europea publicaron hace aproximadamente un mes 28 países su primer informe de mortalidad en exceso y tienen en promedio tres a cinco veces el exceso de mortalidad.,0.0,36,4,09,2020
HUGO LOPEZ-GATELL RAMIREZ,"La parte metodológica es muy importante, en este momento no se está disponiendo de la estadística específica de las causas de mortalidad, eso es un proceso analítico más complicado, pero es importante que en cuanto tenemos información sobre el exceso de mortalidad se haga público y por eso lo hicimos público.",0.0,51,4,09,2020
HUGO LOPEZ-GATELL RAMIREZ,Recordarán que hace más de cuatro meses vino aquí la jefa de Gobierno de la Ciudad de México y comentamos sobre dos ejercicios que arrancamos simultáneamente: uno para la Ciudad de México y otro para el conjunto del país.,0.0,39,4,09,2020
HUGO LOPEZ-GATELL RAMIREZ,"Entonces, ya tuvimos un primer informe preliminar, próximamente vamos a presentar una segunda ronda de resultados y conforme vayamos teniendo nuevas actualizaciones de este trabajo analítico lo iremos presentando.",0.0,29,4,09,2020
HUGO LOPEZ-GATELL RAMIREZ,"Pero regresando al tema del certificado, habíamos tenido un reto importante de que se agotaron los certificados de defunción en algunas entidades federativas. Entonces, hemos estado trabajando en los últimos 15 días, más o menos, 15 o 20 días en redistribuir certificados de defunción; éstos no son específicos de cada entidad, es un documento nacional que emite la Dirección General de Información en Salud de la Secretaría de Salud para que las personas que son legalmente competentes para certificar la defunción, que en su mayoría son personas de la profesión médica, lo hagan.",0.0,93,4,09,2020
HUGO LOPEZ-GATELL RAMIREZ,"Entonces, estuvimos redistribuyendo entre las entidades federativas, los que tenían todavía excedentes, hacia aquellas que se les agotó más rápidamente. Algunas en donde se agotó fueron Baja California, fueron el Estado de México, casi se agotaban en la Ciudad de México, pero ha sido un trabajo bastante intenso.",0.0,48,4,09,2020
HUGO LOPEZ-GATELL RAMIREZ,"La buena noticia es que ya llegaron los nuevos certificados, se mandaron por supuesto a imprimir nuevos, éstos se hacen una imprenta con características particulares, es material autocalcante, tienen que tener el sello nacional, etcétera, folios con tipografías específicas y ya llegaron, ya llegaron antes de que se pudieran acabar o antes de que se agotaran los que estábamos redistribuyendo, ya llegaron, tenemos más de un millón 100 mil certificados que llegaron desde ayer y se están repartiendo en las entidades federativas en las que están próximo a agotarse.",0.0,89,4,09,2020
HUGO LOPEZ-GATELL RAMIREZ,"Vamos a dar la palabra a Liliana Noble, de Pulso Saludable; luego aquí a Arturo Contreras, de Pie de Página.",0.0,20,4,09,2020
PREGUNTA," Buenas noches. Liliana Noble, de Pulso Saludable.",0.0,7,4,09,2020
PREGUNTA,"Doctor, hoy se conmemora el Día Mundial de la Salud Sexual. Yo le quisiera preguntar, ¿han pensado, al igual que Australia, en erradicar el cáncer cervicouterino a través de la vacunación del virus papiloma humano?, y le pregunto esto porque preocupa que no se ha cumplido este esquema por la contingencia, pero también no se vacuna a los niños, solamente a las niñas y yo sé que usted es muy persistente en cuidar la salud de nosotros. ¿Qué es lo que va a hacer el gobierno al respecto?",0.0,88,4,09,2020
PREGUNTA,Y tengo una pregunta para su invitado. Gracias.,0.0,8,4,09,2020
HUGO LOPEZ-GATELL RAMIREZ," Muchas gracias, cómo no, claro que sí. Sí, sí, confieso que soy persistente en varias cosas.",0.0,16,4,09,2020
HUGO LOPEZ-GATELL RAMIREZ,"Pongamos un poco en contexto, no se interrumpió la vacunación contra VPH por la contingencia, hay otra razón y es una razón mundial. Como ocurre en el campo de los productos farmacéuticos, pero de manera muy destacada en las vacunas, son monopolios o estrictamente oligopolios, es decir, muy pocas empresas fabrican vacunas innovadoras; incluso, las que fabrican vacunas, que ya no tienen patente, son muy pocas.",0.0,66,4,09,2020
HUGO LOPEZ-GATELL RAMIREZ,"El mercado global de vacunas, global, estoy hablando del mundo entero está ultra concentrado, gruesamente existen cuatro empresas farmacéuticas globales que generan vacunas nuevas y, si consideramos de manera un poquito amplia, otras que hacen réplicas de vacunas o algunas que se han incorporado más recientemente podríamos tener hasta siete u ocho.",0.0,52,4,09,2020
HUGO LOPEZ-GATELL RAMIREZ,"La vacuna contra el virus del papiloma humano conocido como VPH es una vacuna para que dos de estas grandes compañías farmacéuticas tenían una vacuna, modelos distintos de vacuna, en un caso cubría dos de las cepas que pueden causar cáncer cervicouterino y la otra producía esas mismas dos más otras dos que producen ciertas lesiones verrucosas del aparato reproductor.",0.0,60,4,09,2020
HUGO LOPEZ-GATELL RAMIREZ,"Aquí un elemento para familiarizar a cualquier persona que no conozca de este tema. Se conoce que la enorme mayoría más del 98 por ciento de los tumores del cuello uterino, el conocido como carcinoma cervicouterino, están relacionados con infección crónica por el virus de VPH. Este descubrimiento fue merecedor de un premio Nobel, ahora mismo no me acuerdo en qué año, pero hace pocos años, a las personas científicas que descubrieron esto. Entonces, no hay duda científica de que el virus del papiloma humano es una de las causas directas más relevantes del cáncer cervicouterino.",0.0,96,4,09,2020
HUGO LOPEZ-GATELL RAMIREZ,Explicando primero por qué se suspendió la vacuna y ahorita abordando más ampliamente cuáles son las estrategias mundiales y nacionales de eliminación o de erradicación.,0.0,25,4,09,2020
HUGO LOPEZ-GATELL RAMIREZ,"De estas dos compañías resulta que una de ellas decidió que ya no le era rentable fabricar la vacuna, curiosamente porque obtiene mayores ganancias de las regalías que la otra compañía le da por la patente que tiene de la tecnología de fabricación de la vacuna. Qué curioso, pero así ocurrió.",0.0,51,4,09,2020
HUGO LOPEZ-GATELL RAMIREZ,"Entonces, esta empresa decidió que ya no hace vacuna y esta otra empresa sigue haciendo vacuna, pero en esa transferencia que ocurrió entre 2018 y 2019 hubo una escasez global, porque esta empresa, la que se quedó, no pudo seguir, no alcanzó la producción necesaria para satisfacer la demanda global.",0.0,50,4,09,2020
HUGO LOPEZ-GATELL RAMIREZ,"La buena noticia es que en 2020 esto ha sido regularizado, la otra noticia tranquilizadora es: la vacuna no tiene un momento de oportunidad muy estrecho, en general el momento de oportunidad es entre los nueve y los 11 años de edad y en México se considera esta ventana que aproximadamente es entre el quinto año de primaria y el sexto año, finales del sexto año.",0.0,66,4,09,2020
HUGO LOPEZ-GATELL RAMIREZ,"Entonces, en 2021 ya vamos a tener esta compra de la nueva dotación en cantidades mayores a la necesidad anual para satisfacer precisamente a quienes se hayan quedado sin ello.",0.0,30,4,09,2020
HUGO LOPEZ-GATELL RAMIREZ,"La vacuna no es el único elemento necesario para eliminar el problema. El problema clínico, el problema médico, el problema de salud público es cáncer cervicouterino, esta es una enfermedad de transmisión sexual en la medida en que el virus VPH se transmite por vía sexual, es una enfermedad silenciosa en la medida en que no causa síntoma alguno hasta que existen ya lesiones cancerosas avanzadas.",0.0,66,4,09,2020
HUGO LOPEZ-GATELL RAMIREZ,"Por lo tanto, desde hace muchos años, desde los años 50 tardíos, se estableció un mecanismo de diagnóstico temprano, conocido como tamizaje, con una técnica que popularmente se conoce como el papanicolaou, por un científico griego que describió la tinción con la que se analizan las células, pero básicamente consiste en que toda mujer que ya tenga vida sexual, que haya tenido una experiencia reproductiva, se recomienda que periódicamente, tan periódicamente como cada año, acuda a una revisión específicamente para esto, se toma una muestra del cuello uterino, no duele, bueno, causa algunas molestias pero no duele, no daña, y en cambio permite detectar tempranamente lesiones que anticipan el cáncer por varios años.",0.0,113,4,09,2020
HUGO LOPEZ-GATELL RAMIREZ,"Y desde hace unos 12 o 15 se incorporó otra técnica más moderna, más allá de la microscopia de la evaluación de las células, es una técnica que se llama detección de captura de híbridos, donde se detectan las secuencias genéticas, un poco análogo, otra técnica, pero podríamos decir que análogo a la PCR que se utiliza para la detección de COVID y entonces se encuentra ya no sólo anticipadamente células pre-pre-precancerosas, se llaman células displásicas, sino el virus.",0.0,79,4,09,2020
HUGO LOPEZ-GATELL RAMIREZ,"Entonces, a lo que voy es: no pensar que con la vacuna basta para lograr el propósito de eliminar una enfermedad que es enteramente prevenible, que es el cáncer cervicouterino. Se requiere, de manera consistente, hacer el tamizaje en todas las mujeres hasta que tengamos todo un segmento poblacional de mujeres que desde niñas fueron vacunadas y tengamos la posibilidad de que haya una transmisión mínima, o eventualmente nula, del virus de papiloma humano.",0.0,74,4,09,2020
PREGUNTA, ¿Y pensaría también en vacunar a los niños?,0.0,8,4,09,2020
HUGO LOPEZ-GATELL RAMIREZ, Y este es un elemento muy importante.,0.0,7,4,09,2020
HUGO LOPEZ-GATELL RAMIREZ,"Como estrategia poblacional, la transmisión puede ocurrir desde luego de un hombre a una mujer, la transmisión del virus. En ciertas subpoblaciones de hombres, por ejemplo, en personas que viven con VIH, hombres que viven con VIH también pueden tener lesiones cancerosas en otras partes anatómicas que puedan estar relacionadas con el virus del VPH, pero el propósito de vacunar a varones también sería doble, protegerles a ellas, a ellos mismos y también evitar que se transmita.",0.0,77,4,09,2020
HUGO LOPEZ-GATELL RAMIREZ,"Es un fenómeno solidario como suele ocurrir en la salud pública, se vacunan a unos para que protejan a otras, en este caso las mujeres o bien a otros hombres también.",0.0,31,4,09,2020
HUGO LOPEZ-GATELL RAMIREZ,"Entonces, en México todavía no hemos rediseñado el programa en esa medida, razones son varias, pero una de ellas incluye esta inestabilidad en el mercado global de vacunas y en sexenios previos no se hizo este replanteamiento, es posible que nosotros emprendamos este replanteamiento.",0.0,44,4,09,2020
HUGO LOPEZ-GATELL RAMIREZ,"En las clínicas especializadas en VIH y las clínicas de salud sexual, aquí concretamente en la Ciudad de México en las Clínicas Condesa, sí se aplica la vacuna contra VPH también para los varones y hacia eso vamos, hacia esa tendencia.",0.0,41,4,09,2020
PREGUNTA, Gracias.,0.0,1,4,09,2020
PREGUNTA,"Y para Guillermo, me gustaría conocer, justamente, en esta conmemoración que hace el Imjuve para ayudar a los jóvenes a que conozcan los métodos de anticoncepción, para evitar las enfermedades de transmisión sexual, embarazos no planeados, cáncer cervicouterino y VIH-SIDA.",0.0,40,4,09,2020
PREGUNTA,Gracias.,0.0,1,4,09,2020
GUILLERMO SANTIAGO RODRIGUEZ, Muchísimas gracias por la pregunta.,0.0,5,4,09,2020
GUILLERMO SANTIAGO RODRIGUEZ,"Justo desde el Instituto Mexicano de la Juventud, en el Projuventud, que es el documento rector de la política pública para las y los jóvenes de todo el país, uno de sus principales objetivos es garantizar que las personas jóvenes tengan acceso a salud y sobre todo el derecho a la salud sexual y reproductiva.",0.0,55,4,09,2020
