Participante,Texto,Sentimiento,Palabras,Dia,Mes,Anio
HUGO LOPEZ-GATELL RAMIREZ," Insisto, esto es un mecanismo de reconocimiento mutuo, está perfectamente establecido. PIC/S no se inventó ayer ni empezó cuando México se adhirió, México es de los países que más recientemente se adhirió, hay países que están ahí desde los años 90, como Canadá, por ejemplo.",0.0,45,10,11,2020
HUGO LOPEZ-GATELL RAMIREZ,"Pero pregúntenlo, por favor, esto tiene que quedar muy claro. Y seguramente aparecerá especulación de que queremos importar medicamentos de baja calidad. Sepan ustedes que esto es falso, no vamos a importar medicamentos de baja calidad, lo que vamos a hacer es romper con algunas barreras proteccionistas que, de facto, ocurrían en el proceso de regulación sanitaria, entre otros, y que hacían que se redujeran las posibilidades de mercado, de acceso al mercado, del gobierno mexicano para las compras públicas de insumos para la salud.",0.0,85,10,11,2020
HUGO LOPEZ-GATELL RAMIREZ,"Muchas gracias, se nos acabó el tiempo. Perdón. Ernesto, ya no le dimos la palabra. Son las 20 horas con tres minutos, y la epidemia sigue, pero debemos seguirnos cuidando.",0.0,30,10,11,2020
HUGO LOPEZ-GATELL RAMIREZ,Muchas gracias. Usen su cubrebocas.,0.0,5,10,11,2020
HUGO LOPEZ-GATELL RAMIREZ,---,0.0,1,10,11,2020
