Participante,Texto,Sentimiento,Palabras,Dia,Mes,Anio
HUGO LOPEZ-GATELL RAMIREZ,"Por un lado, mayor oportunidad en la identificación de casos. En la medida en que hay una nueva tecnología… Que quede claro aquí, me estoy anticipando a la distorsión que se le va a dar a esto, si no existe esa tecnología no se puede tener la capacidad, cuando existe la tecnología por supuesto que hay que usarla si la tecnología es competente.",0.0,63,14,10,2020
HUGO LOPEZ-GATELL RAMIREZ,"Y el resultado en términos de la estadística es que se puede generar una mayor sensibilidad de detección. Esto es semejante a nuestra decisión recientemente comentada por el doctor Ryan, como lo acaban de ver, de incorporar el diagnóstico confirmatorio por asociación epidemiológica.",0.0,43,14,10,2020
HUGO LOPEZ-GATELL RAMIREZ,"Entonces, en este caso quienes resulten positivos a esta prueba, si es que la prueba es muy sensible, pueden ser casos considerablemente asintomáticos y va a haber un mayor número de casos.",0.0,32,14,10,2020
HUGO LOPEZ-GATELL RAMIREZ,"Y esto en su momento tendrá que interpretarse juiciosamente para que no se infiera una tendencia de alza explicable por un rebrote, sino más bien por este fenómeno de incremento en la capacidad de detección.",0.0,35,14,10,2020
HUGO LOPEZ-GATELL RAMIREZ," La siguiente semana consideramos que es muy probable que ya tengamos los resultados de la prueba de validación, si y sólo si, si y sólo si la prueba tiene un desempeño diagnóstico apropiado la estaremos adoptando; si no lo tiene no la estaremos adoptando, si no lo tiene no la estaremos adoptando.",0.0,52,14,10,2020
HUGO LOPEZ-GATELL RAMIREZ," En cuanto esté, si está la siguiente semana inmediatamente se procede a la solicitud de registro de Cofepris y el trámite, que estamos cuidando que los trámites no se entorpezcan por la burocracia sin perder su rigor metodológico, entonces en cuanto esté lo utilizamos, estamos a 15 de octubre, por lo tanto, estamos muy cerca efectivamente de noviembre.",0.0,58,14,10,2020
HUGO LOPEZ-GATELL RAMIREZ,Ya no nos va a dar tiempo de….,0.0,8,14,10,2020
HUGO LOPEZ-GATELL RAMIREZ," Es correcto, en principio, la donación es para el gobierno, es para el sector público, cuando decimos el sector público y el gobierno es las entidades federativas. El Indre, por supuesto, lo administra, lo regula, pero esto se usa en los estados que es donde está la población, sin distingo de quien gobierna, que fuerza política gobierna, etcétera.",0.0,58,14,10,2020
HUGO LOPEZ-GATELL RAMIREZ,"La priorización de envío de las cantidades de pruebas atenderá a las necesidades epidemiológicas. Desde luego, en donde hay una mayor necesidad de detección porque la epidemia está con tendencia al alta, serán prioritarios sobre estados que afortunadamente ya están teniendo una disminución muy significativa de los casos.",0.0,48,14,10,2020
HUGO LOPEZ-GATELL RAMIREZ,"Muchas gracias. Aquí terminamos, 20 horas con dos minutos y nos vemos mañana. Gracias.",0.0,14,14,10,2020
HUGO LOPEZ-GATELL RAMIREZ,---,0.0,1,14,10,2020
HUGO LOPEZ-GATELL RAMIREZ,VE 1326.,0.0,2,14,10,2020
