Participante,Texto,Sentimiento,Palabras,Dia,Mes,Anio
HUGO LOPEZ-GATELL RAMIREZ,"De momento no está considerado en esta campaña que eso ocurra, pero de acuerdo a los mapeos que tenemos de cobertura vacunal, sise redujera en un momento dado la proporción, el porcentaje de falta de vacuna en esas edades tendríamos que hacer una campaña semejante.",0.0,45,19,04,2021
HUGO LOPEZ-GATELL RAMIREZ,"Esto se ha hecho en el pasado. En 2010, por ejemplo, se hizo una campaña de vacunación contra rubeola dirigida a mujeres en edad reproductiva con el propósito de prevenir la rubeola congénita, se vacuna a las mujeres en edad reproductiva para que no les dé rubeola cuando están embarazadas y por lo tanto sus hijos, hijas, en formación no padezcan esta enfermedad.",0.0,63,19,04,2021
HUGO LOPEZ-GATELL RAMIREZ,"HUGO LÓPEZ-GATELL RAMÍREZ: Sí. No, me refiero, en este momento no tenemos preocupación de que la cobertura o la proporción de personas adultas jóvenes que están sin vacunación estuviera insuficiente.",0.0,30,19,04,2021
HUGO LOPEZ-GATELL RAMIREZ,HUGO LÓPEZ-GATELL RAMÍREZ: Muchas gracias.,0.0,5,19,04,2021
HUGO LOPEZ-GATELL RAMIREZ,"Es niño de edad avanzada y preadolescente, ese es el hoyo vacunal y es por eso que ponemos esta edad para la recuperación de coberturas.",0.0,25,19,04,2021
HUGO LOPEZ-GATELL RAMIREZ,HUGO LÓPEZ-GATELL RAMÍREZ: Muchas gracias.,0.0,5,19,04,2021
HUGO LOPEZ-GATELL RAMIREZ,"Miguel Rico, por favor. Nos quedan tres minutos.",0.0,8,19,04,2021
HUGO LOPEZ-GATELL RAMIREZ,"HUGO LÓPEZ-GATELL RAMÍREZ: Cómo no, con mucho gusto.",0.0,8,19,04,2021
HUGO LOPEZ-GATELL RAMIREZ,"Primero, recomiendo mucha cautela cuando se hacen comparaciones. Vemos a veces en la prensa esas oleadas de ‘primer lugar en esto, cuarto lugar en aquello, tercer lugar en aquello’.",0.0,29,19,04,2021
HUGO LOPEZ-GATELL RAMIREZ,"Casi siempre se trata de un error de interpretación, de una interpretación no profesional, no científica, no técnica de las comparaciones, no se considera toda la información disponible o se utilizan… Se comparan peras y manzanas, por decirlo de manera sencilla.",0.0,41,19,04,2021
HUGO LOPEZ-GATELL RAMIREZ,Este es el caso también. No tenemos en México primeros lugares de desnutrición por carencia entre las distintas naciones del mundo.,0.0,21,19,04,2021
HUGO LOPEZ-GATELL RAMIREZ,"Muy tristemente existen zonas del mundo donde la desnutrición es mucho mayor que en México, por la misma razón una injusta distribución de la riqueza entre países y al interior de los países. En México tenemos una desigualdad social pavorosa producto de este modelo económico que ha ido concentrando la riqueza en muy pocas manos y ha dejado desprotegida a la gran mayoría de la población, pero afortunadamente no tenemos ya un rezago de carencia, seguimos teniéndolo, pero no es el problema nutricional principal de la infancia mexicana.",0.0,88,19,04,2021
HUGO LOPEZ-GATELL RAMIREZ,"Lo que sí es el problema principal de la infancia mexicana es la desnutrición por mala calidad y exceso, y es lo que hemos dicho una y otra y otra vez, y seguimos diciendo, somos el primer lugar mundial, aquí sí, de sobrepeso y obesidad infantil y juvenil.",0.0,48,19,04,2021
HUGO LOPEZ-GATELL RAMIREZ,"Y la razón de esto es fundamentalmente es la mala alimentación, cosa que no es culpa de las familias y mucho menos de las personas adolescentes y niñas y niños, es culpa del ambiente alimentario que está repleto de productos industrializados, ultraprocesados y procesados, refrescos, falsos jugos, que en realidad son agua con exceso de azúcares, colorantes artificiales, etcétera, y la llamada comida chatarra, que es muy lucrativa, que se vende por cualquier esquina, que ha sustituido a dietas ancestrales mexicanas que son de buena calidad y que deberían estar mucho más accesible. Entonces, eso es lo que ha ocurrido.",0.0,100,19,04,2021
HUGO LOPEZ-GATELL RAMIREZ,"Con respecto a eso, la secretaria de Educación Pública, la maestra Delfina Gómez, tiene muy claro que una de las prioridades en esta alianza entre el sector Salud y el sector educativo es trabajar por lograr ambientes escolares saludables en múltiples aspectos y uno de ellos es que no exista este acceso tan prolífico que hay a estos productos chatarra y bebida chatarra que han dañado tanto a la niñez, la adolescencia y la adultez mexicana.",0.0,76,19,04,2021
HUGO LOPEZ-GATELL RAMIREZ,"Muchas gracias. Aquí se nos acaba el tiempo, son las 20 horas con un minuto, seguimos y nos vemos mañana en el Pulso de la Salud.",0.0,26,19,04,2021
HUGO LOPEZ-GATELL RAMIREZ,"Muchas gracias, Paco, muchas gracias. Hasta pronto.",0.0,7,19,04,2021
HUGO LOPEZ-GATELL RAMIREZ,---,0.0,1,19,04,2021
