Participante,Texto,Sentimiento,Palabras,Dia,Mes,Anio
HUGO LOPEZ-GATELL RAMIREZ,"Y el análisis de riesgo versus beneficio que hace la Agencia Europea de Medicamentos vuelve a ser en el sentido de que conviene seguir utilizando la vacuna AstraZeneca por ser una vacuna en términos generales, es decir, para la mayoría de la población, segura y desde luego eficaz, y solamente tener precaución específica en personas que tienen antecedentes ya sea genéticos, ya sea de padecer ciertas afecciones sanguíneas del sistema de coagulación que pudieran aumentar el riesgo de trombosis.",0.0,79,7,04,2021
HUGO LOPEZ-GATELL RAMIREZ,Ese es el planteamiento. Le voy a pedir al doctor Alomía se hace algunos comentarios adicionales.,0.0,16,7,04,2021
HUGO LOPEZ-GATELL RAMIREZ,"Y comentarles que nuestro Grupo Técnico Asesor en Vacunación conjuntamente con nuestra unidad que está analizando todos los días los Esavis está realizando un análisis de estas posturas, estamos seguros que la Organización Mundial de la Salud también va a hacer un planteamiento y lo haremos nosotros formalmente y por escrito en un lineamiento cuando tengamos todas esas consideraciones.",0.0,59,7,04,2021
HUGO LOPEZ-GATELL RAMIREZ,Doctor Alomía.,0.0,2,7,04,2021
HUGO LOPEZ-GATELL RAMIREZ," Entonces, en síntesis, tranquilidad, no hay ningún elemento de evidencia científica que sugiera un alto riesgo de trombosis con la vacuna AstraZeneca, por lo tanto, en la mayoría de los países, si no es que en todos quienes la estamos utilizando, se seguirá utilizando.",0.0,44,7,04,2021
HUGO LOPEZ-GATELL RAMIREZ,"Gracias, Arturo.",0.0,2,7,04,2021
HUGO LOPEZ-GATELL RAMIREZ," Sí, muchas gracias.",0.0,3,7,04,2021
HUGO LOPEZ-GATELL RAMIREZ,"Este es otro elemento interesante y alentador, porque ya lo tenemos contemplado y estamos preparados para estos eventos, elementos o momentos de mucha actividad en nuestro programa de vacunación.",0.0,29,7,04,2021
HUGO LOPEZ-GATELL RAMIREZ,"Como pueden ver, fuimos el primer país en América Latina que arrancó, tuvimos una fase de calibración, recordaran que así la designamos del operativo, después tuvimos una fase de expansión rápida en donde ya incorporamos la vacunación en personas adultas mayores, además de la que ya veníamos haciendo en trabajadoras y trabajadores de la salud.",0.0,55,7,04,2021
HUGO LOPEZ-GATELL RAMIREZ,Y otro momento de cambio de velocidad semejante ocurrirá cuando tengamos varias poblaciones ya con cantidades masivas de dosis.,0.0,19,7,04,2021
HUGO LOPEZ-GATELL RAMIREZ,"Efectivamente, la etapa 1, la de vacunación en personas adultas mayores, concluirá a finales de abril, posiblemente pensemos en el último día de abril, el 30 de abril, Día del Niño, terminaremos de vacunar a los abuelos y abuelas.",0.0,39,7,04,2021
HUGO LOPEZ-GATELL RAMIREZ,"Y enseguida, sin interrupción, empezaremos a vacunar a las personas del siguiente bloque de edad, 50 a 49 años, más toda aquella persona que tuviera más de 60 años y que por la razón que sea no haya sido vacunada durante la etapa 1.",0.0,44,7,04,2021
HUGO LOPEZ-GATELL RAMIREZ,"También estaremos complementando las segundas dosis de todas aquellas personas que hasta ese momento la necesiten, es decir, posiblemente habrá todavía algunas personas trabajadoras de la salud a quienes les falte la segunda dosis, habrá el conjunto de las personas adultas mayores a quien les falte la segunda dosis y empezaremos primeras dosis en personas de 50 años en adelante.",0.0,60,7,04,2021
HUGO LOPEZ-GATELL RAMIREZ,"También ahí retomaremos, siempre y cuando tengamos evidencia de que el riesgo de una tercera ola no parece un riesgo inminente, retomaremos con la vacunación al personal educativo en otras entidades federativas, siguiendo los mismos criterios ya trazados, ya analizados, conversados y construidos que junto con la Secretaría de Educación Pública que consiste en garantizar que en las entidades federativas que estén en semáforo verde, donde haya voluntad de vislumbrar y empezar a establecer las condiciones para la apertura escolar, estén garantizados estos mecanismos; pero seguiremos vacunando, entonces empezaremos en el personal educativo en estados que estén en color verde.",0.0,100,7,04,2021
HUGO LOPEZ-GATELL RAMIREZ,"Si en algún momento ya terminamos esa etapa y hay entidades federativas en amarillo, se vacunará en amarillo.",0.0,18,7,04,2021
HUGO LOPEZ-GATELL RAMIREZ,"No necesariamente hay una relación inmediata entre terminar la vacunación y abrir las escuelas, son dos elementos que van en paralelo, uno ayuda al otro, pero desde luego hay otras consideraciones en la preparación de la apertura de las escuelas.",0.0,40,7,04,2021
HUGO LOPEZ-GATELL RAMIREZ,Pero sí estaremos vacunando por seguramente arriba de un millón de dosis por día en el momento en que tengamos grandes poblaciones. Y en su momento vendrán los de 40 y más y seguirá la misma mecánica.,0.0,37,7,04,2021
HUGO LOPEZ-GATELL RAMIREZ," Estamos trabajando en ello, los mecanismos de registro son varios. Uno es esta página mivacuna.salud.gob.mx que en su momento fue útil para hacer la planeación de la logística de vacunación de las personas adultas mayores.",0.0,35,7,04,2021
HUGO LOPEZ-GATELL RAMIREZ,"También el trabajo de campo ha sido sumamente importante, lo que hace el sistema de Bienestar al nivel de las localidades ayudó a renovar, refrendar y verificar padrones.",0.0,28,7,04,2021
HUGO LOPEZ-GATELL RAMIREZ,"También el trabajo que tenemos en colaboración con la Secretaría de Gobernación, específicamente con el Registro Nacional de Población a cargo de nuestro amigo Jorge Wheatley, ha sido muy útil, porque nos da con un nivel de detalle muy grande cuáles son las distribuciones poblacionales.",0.0,45,7,04,2021
HUGO LOPEZ-GATELL RAMIREZ,"Sobre ese se ha hecho verificaciones en el trabajo de campo y hemos tenido personas que, aunque estaban registradas por distintas razones, no sólo por el COVID, aunque algunas también ya no están, han perdido la vida o se han mudado de su locación.",0.0,44,7,04,2021
HUGO LOPEZ-GATELL RAMIREZ,"Entonces, ese trabajo fino requiere otro tipo de mecanismos. Recordarán aquellas llamadas telefónicas que se estaban haciendo fueron para ese propósito, para identificar la vigencia de la información de las personas.",0.0,31,7,04,2021
HUGO LOPEZ-GATELL RAMIREZ,"Gracias, Arturo.",0.0,2,7,04,2021
HUGO LOPEZ-GATELL RAMIREZ,"Natalia Vitela, diario Reforma.",0.0,4,7,04,2021
HUGO LOPEZ-GATELL RAMIREZ," Son casos muy seleccionados. Y en la entrevista que se hace y se seguirá haciendo a las personas que llegan a los puestos de vacunación se hace un par de preguntas semejantes a las que se hace en una historia clínica en una consulta médica que buscan recolectar información sobre posibles riesgos. Y continuamente revisamos este cuestionario, y ahora con estos elementos seguramente es de mayor importancia prestar atención a ello.",0.0,71,7,04,2021
HUGO LOPEZ-GATELL RAMIREZ,"Pero queremos enfatizar mucho, ojalá que su periódico mañana no saque un nuevo encabezado alarmista. Para que haya objetividad, el mensaje que da la organización, en su momento la Organización Mundial de la Salud y la Agencia Europea de Medicamentos y que hoy ratifica oficialmente la Agencia Europea de Medicamentos, les podemos compartir el documento si no lo tienen a la mano, lo que indica es: un evento muy, muy raro, ya dijo el número el doctor Alomía, y por lo tanto no es un motivo específico de preocupación.",0.0,89,7,04,2021
HUGO LOPEZ-GATELL RAMIREZ, Se refiere a aquellas que en alguna conferencia de prensa…,0.0,10,7,04,2021
HUGO LOPEZ-GATELL RAMIREZ," Sí, ya habíamos comentado sobre eso hace algunas semanas, varias semanas. El doctor Manuel de la O Cavazos, secretario de Salud de Nuevo León, y la doctora Gloria Molina, secretaria de Salud de Tamaulipas, tomaron la decisión de hacer una conferencia de prensa conjunta para expresar la posición de sus gobiernos, suponemos que de sus gobernadores, además de ella y él, de no utilizar una vacuna que tuvo una pequeña variación en la temperatura durante su proceso de transporte.",0.0,79,7,04,2021
HUGO LOPEZ-GATELL RAMIREZ,"Explicamos aquí en esta conferencia, y lo conoce la secretaria Molina y el secretario De la O, que, de acuerdo al perfil de estabilidad, de termoestabilidad, como se conoce, del registro sanitario y de la evaluación que hace Cofepris está lejísimos de ser un problema y no hay una indicación de que pudiera estar afectada la potencia de la vacuna y mucho menos su seguridad por este evento.",0.0,68,7,04,2021
HUGO LOPEZ-GATELL RAMIREZ,"Respetamos mucho a nuestras compañeras secretarias y secretarios, sabemos que a veces toman decisiones mayormente técnicas, a veces influidas también por lo que es legítimo, las decisiones de sus jefes.",0.0,30,7,04,2021
HUGO LOPEZ-GATELL RAMIREZ,"Entonces, si la decisión del gobierno de Nuevo León y el gobierno de Tamaulipas, suponiendo que siguiera siendo el caso para ambos estados, es no vacunar en este momento, no utilizar estas 40 mil dosis, no hay problema, el resto del país las necesita y si ellos han decidido o sus gobernadores que Tamaulipas en este momento espere al avance de la vacunación, pues esperamos.",0.0,65,7,04,2021
HUGO LOPEZ-GATELL RAMIREZ,"El programa de vacunación es un programa del Gobierno de México y simplemente serán utilizadas las vacunas que son seguras, que son estables, que están en buena calidad en el resto del país.",0.0,33,7,04,2021
HUGO LOPEZ-GATELL RAMIREZ," No tengo conocimiento de ello. Mañana tenemos una de las reuniones periódicas que solemos tener con los gobernadores, no ha sido el caso que el gobernador de Tamaulipas ni el gobernador de Nuevo León acudan a estas reuniones de alta importancia, se discuten temas como el programa de vacunación y la protección de las personas residentes en el país, pero suponemos que sus grupos técnicos asistirán, frecuentemente la doctora Molina y el doctor De la O participan en representación del estado en esta reunión, mañana es esto, posiblemente salga el tema y ya veremos.",0.0,94,7,04,2021
HUGO LOPEZ-GATELL RAMIREZ, Así es.,0.0,2,7,04,2021
HUGO LOPEZ-GATELL RAMIREZ, Reporte de qué ¿perdón?,0.0,4,7,04,2021
HUGO LOPEZ-GATELL RAMIREZ," No tengo información y podemos recopilarla, le corresponde más a Protección Civil informar sobre este asunto.",0.0,16,7,04,2021
HUGO LOPEZ-GATELL RAMIREZ, Por favor.,0.0,2,7,04,2021
HUGO LOPEZ-GATELL RAMIREZ, Lo de la…,0.0,3,7,04,2021
HUGO LOPEZ-GATELL RAMIREZ," Lo de la ola, ayer me lo preguntaban también otras colegas reporteras, Milenio y Televisa también.",0.0,16,7,04,2021
HUGO LOPEZ-GATELL RAMIREZ,"Recordamos al público en general: las predicciones que se hacen en ciencia no tienen un carácter que se pueda hacer una predicción exacta, este día en tal momento tantas personas.",0.0,30,7,04,2021
HUGO LOPEZ-GATELL RAMIREZ,Lo que me preguntaban ayer es de cuántos casos estaríamos hablando en una tercera ola.,0.0,15,7,04,2021
HUGO LOPEZ-GATELL RAMIREZ,"Esto durante 2020 fue motivo, entre otros diarios el suyo de estimular, una suerte de contraste de decir: ‘Nos dijeron que iba a haber en tal fecha el pico de la epidemia’.",0.0,32,7,04,2021
HUGO LOPEZ-GATELL RAMIREZ,"Entonces, nos da la impresión de que esta pregunta quizá no ha quedado totalmente clara en algunos medios cómo funciona la ciencia en ese sentido.",0.0,25,7,04,2021
HUGO LOPEZ-GATELL RAMIREZ,"No es factible que científicamente se puede decir cuándo empezaría una tercera ola, cuarta ola o quinta ola o primera ola incluso, cuándo llegaría a su punto máximo, cuántos casos involucraría, cuántos serían mujeres, cuántos hombres, en qué entidades.",0.0,39,7,04,2021
HUGO LOPEZ-GATELL RAMIREZ,"Esto escapa de la realidad científica, lo que tenemos es un monitoreo diario, para eso tenemos un Sistema de Vigilancia Epidemiológica que cumple su propósito y vamos analizando la información y, como lo hemos hecho desde que empezó la epidemia, lo presentamos públicamente, la evidencia directa, tenemos bases de datos de acceso abierto, datos abiertos y también el análisis que hacemos no sólo nosotros, sino también entidades académicas y científicas.",0.0,70,7,04,2021
HUGO LOPEZ-GATELL RAMIREZ,": Efectivamente, todos los días monitoreamos esto y todos…",0.0,9,7,04,2021
HUGO LOPEZ-GATELL RAMIREZ," Todos los días monitoreamos distintos indicadores y los presentamos aquí. Espero que estén ya familiarizadas y familiarizados, incluyendo el diario Reforma, con cuáles son estos indicadores.",0.0,26,7,04,2021
HUGO LOPEZ-GATELL RAMIREZ,"Para quienes nos ve por primera vez, mucho de lo que se presenta aquí no sale en los medios, pero lo pueden ver aquí en la conferencia y hablamos precisamente de estos indicadores: la tendencia en el tiempo y en el espacio de los casos la ocupación hospitalaria, el porcentaje de positividad, la letalidad, etcétera.",0.0,55,7,04,2021
HUGO LOPEZ-GATELL RAMIREZ,"Entonces, lo vamos a estar monitoreando, como lo hemos venido haciendo, y en un momento dado conforme siga avanzando el programa de vacunación, que ya lleva más de 10 millones de dosis aplicadas, tomaremos la decisión de cuál es el sitio donde se van a seguir con las demás fases, que será todo el país.",0.0,55,7,04,2021
HUGO LOPEZ-GATELL RAMIREZ,"El programa de vacunación es universal y es gratuito, y queremos recordarlo especialmente en estos tiempos electorales, no es propiedad de ningún partido político, es ajeno a la actividad política, es un programa público del Gobierno de México y es gratuito, que no le vayan a estafar queriéndole vender vacunas o queriéndole vender favores, es muy importante en este momento.",0.0,60,7,04,2021
HUGO LOPEZ-GATELL RAMIREZ,"Son las 8:00 de la noche en punto, terminamos aquí la conferencia de prensa y seguimos siempre abiertos a cualquier otro cuestionamiento.",0.0,22,7,04,2021
HUGO LOPEZ-GATELL RAMIREZ,Muchas gracias.,0.0,2,7,04,2021
