Participante,Texto,Sentimiento,Palabras,Dia,Mes,Anio
GUILLERMO PEÑALOZA,"Además, de esto pueden activar las áreas para el desarrollo de la mejora de la atención, y esto es bien importante que se les quede, porque voy a hablar más delante de esta parte, de la mejora de la atención y las habilidades como la planeación. Imagínense nada más las cosas positivas de todo lo que se pueden llegar a generar los videojuegos.",0.0,63,20,09,2020
GUILLERMO PEÑALOZA,"Ahora sí, como tal, como les mencionaba, va a mejorar la atención, pero por qué es importante.",0.0,17,20,09,2020
GUILLERMO PEÑALOZA,¿Qué creen?,0.0,2,20,09,2020
GUILLERMO PEÑALOZA,"La FDA, que es órgano más importante administrativo de Estados Unidos que regula los medicamentos, el 15 de junio de 2020 de este año aprobó un videojuego, un videojuego, imagínense nada más, para el tratamiento del trastorno por déficit de atención e hiperactividad. Claro, este tiene que ser recetado por médicos de Estados Unidos evidentemente, porque sí es una cuestión controlada y no se deja de lado del uso del fármaco para poder tratar el trastorno.",0.0,76,20,09,2020
GUILLERMO PEÑALOZA,"Pero ahora imagínense esta parte de llegar a poder tener un tratamiento de un videojuego para un trastorno mental, una cosa maravillosa que pueden tener acceso rápidamente porque, como lo veíamos, ya muchos tienen la facilidad de tener un celular o una tableta o una computadora para poder tener acceso a estos juegos. Imagínense esta parte bien interesante y bien padre, ojalá que llegue en algún futuro en nuestro país.",0.0,70,20,09,2020
GUILLERMO PEÑALOZA,"Pero también otra cosa bien padre que sucedió hace poco, el Issste, el 20 de noviembre, sacó un pequeño robot que se llama LaLuchy Robotina, y esta le permitió a través de ciertos algoritmos poder acercarse a estas personas porque estamos en situación de pandemia, y se pueden acercar a través… los psicólogos, perdón, los psicólogos se pueden acercar a través de este robot que va visitando los cuartos, visita a los pacientes que se encuentran en un estado de estrés pues sicosocial porque están tal vez están infectados, tal vez son los familiares de las personas que tienen la infección. Y, entonces, ¿qué es lo que le va a generar?, pues mucha más ayuda a estas personas.",0.0,118,20,09,2020
GUILLERMO PEÑALOZA,"Y otra de las cosas bien importantes que también se pueden utilizar a través de los juegos, y esto que quede claro para los profesores, es un método que se le llama ludificación o gamificación, esto muy en español, pero gamification, que es un aprendizaje basado en juegos.",0.0,48,20,09,2020
GUILLERMO PEÑALOZA,"La siguiente, por favor, porque ya queda poco tiempo, para ir a unas recomendaciones.",0.0,14,20,09,2020
GUILLERMO PEÑALOZA,"Primero que nada, hay otra cosa que se llama el trastorno uso pulso consultivo de juegos, en donde va a tener tres características importantes.",0.0,24,20,09,2020
GUILLERMO PEÑALOZA,"Ya hablamos de lo positivo, vamos a hablar de una característica negativa, que es una dificultad para controlar el tiempo de juego, va a tener una prioridad por realizar la actividad del videojuego por encima de cualquier otra actividad y va a tener un aumento en la conducta compulsiva a pesar de tener consecuencias negativas.",0.0,55,20,09,2020
GUILLERMO PEÑALOZA,"Este diagnóstico solamente se encuentra en el CIE-11 que está aún en revisión, no es oficial todavía, que quede muy claro esa parte, todavía no estamos basando en el CIE-10, que es el Catálogo Internacional de Enfermedades por la OMS.",0.0,40,20,09,2020
GUILLERMO PEÑALOZA,"Entonces, es bien importante que se está considerando, pero como profesionales de la salud mental nos tenemos que actualizar y este es un tema que va… que tenemos que tener en cuenta.",0.0,32,20,09,2020
GUILLERMO PEÑALOZA,"Y bien importante, solo el tres por ciento de todos los videojugadores lo van a presentar, o sea, realmente tres de cada 100 videojugadores.",0.0,24,20,09,2020
GUILLERMO PEÑALOZA,"Por último, quiero darles unas recomendaciones, esto es algo bien importante para ustedes papás, para todas las personas que se encuentran con este estrés de ‘está jugando demasiado, está haciendo muchas actividades de la pantalla y demás’.",0.0,37,20,09,2020
GUILLERMO PEÑALOZA,¿Cuáles son las recomendaciones que la OMS tal cual está diciendo que tienen que tener de un tiempo de uso de pantalla?,0.0,22,20,09,2020
GUILLERMO PEÑALOZA,"En los lactantes realmente menores de un año no se recomienda como tal, en los niños de uno a dos años tampoco se recomienda como tal que tengan una actividad frente a una pantalla.",0.0,34,20,09,2020
GUILLERMO PEÑALOZA,"Niños de tres a cuatro años ahí sí pueden tener actividad frente a una pantalla y habla de esta cuestión de sedentarismo, entonces lo máximo que se recomienda en realidad son 560 minutos no más de 60 minutos, porque realmente lo que tienen que hacer los niños es hacer mucha actividad física, una cuestión de estimulación a través de la actividad física.",0.0,62,20,09,2020
GUILLERMO PEÑALOZA,"Y, por último, los mayores de cinco años, ahora sí que todas las demás personas, lo que más se recomienda es que sean máximo 120 minutos con descansos, descansos de lo mejor 10 a 15 minutos y que siempre se acompañe de una actividad física. La siguiente, por favor.",0.0,49,20,09,2020
GUILLERMO PEÑALOZA,"Realmente ahí terminamos las recomendaciones, creo que esa es una de las cosas más importantes, podríamos hablar muchísimo más de toda esta tecnología, de esta cuestión de redes sociales, pero realmente no nos queda tanto tiempo.",0.0,36,20,09,2020
GUILLERMO PEÑALOZA,Muchas gracias por su atención y cualquier cosa estamos por acá.,0.0,11,20,09,2020
JUAN MANUEL QUIJADA GAYTAN," Muchas gracias, doctor Guillermo Peñaloza.",0.0,5,20,09,2020
JUAN MANUEL QUIJADA GAYTAN,"Es importante enfatizar esto de nuestra parte para los padres, para los maestros los tiempos que utilizan y los descansos que son necesarios frente a las pantallas en general para toda la población.",0.0,33,20,09,2020
JUAN MANUEL QUIJADA GAYTAN,"Es cuanto, señor secretario.",0.0,4,20,09,2020
HUGO LOPEZ-GATELL RAMIREZ," Muchas gracias, doctor Quijada, doctor Peñaloza.",0.0,6,20,09,2020
HUGO LOPEZ-GATELL RAMIREZ,Nos queda tiempo para una pregunta. Natalia Vitela y a ver si nos da tiempo con Héctor García.,0.0,18,20,09,2020
PREGUNTA," Gracias. Buenas noches, doctor.",0.0,4,20,09,2020
PREGUNTA,"Quería saber a cuánto asciende el anticipo que va a dar México a la iniciativa Covax, entiendo que es el 9 de octubre que es el anticipo que se tiene que dar.",0.0,32,20,09,2020
PREGUNTA,"Y si nos puede decir sobre el semáforo, ¿cuándo se presenta?",0.0,11,20,09,2020
PREGUNTA,Gracias.,0.0,1,20,09,2020
HUGO LOPEZ-GATELL RAMIREZ, Con gusto. Esta información sobre la negociación con Covax el mecanismo colaborativo de la Organización Mundial de la Salud lo vamos a explicar en detalle a lo largo de la semana.,0.0,31,20,09,2020
HUGO LOPEZ-GATELL RAMIREZ,"La razón es el formato de convenio que planteó la iniciativa, es un formato genérico para los países estados miembros de la OMS, y México, igual que otros pocos países, hicimos algunas propuestas de modificación para que se ajustara más a nuestra realidad jurídica, económica y procedimental.",0.0,47,20,09,2020
HUGO LOPEZ-GATELL RAMIREZ,"Esto el viernes, que era la fecha límite para ratificar la decisión de México a Covax, así se planteó, hicimos saber a la iniciativa GAVI, que es la Alianza Global para Vacunas, quien es el portal de entrada a Covax, que así lo haríamos, estuvimos en conversaciones favorecidas por la cancillería, y quedamos que en el curso de la siguiente semana se estarán estableciendo ya los pormenores, y de ello derivará ya el momento, que efectivamente es el 9 de octubre en que tendremos que pagar el enganche de acuerdo a las condiciones estipuladas, pero lo informaremos a lo largo de la semana, lo informaremos en la semana.",0.0,108,20,09,2020
HUGO LOPEZ-GATELL RAMIREZ,"Y el semáforo, como hemos convenido con la Conferencia Nacional de Gobernadores, lo hacemos público cada quincena, de modo que este viernes próximo pasado no lo presentamos, lo conocen, se las enviamos a las 32 entidades federativas cuál es el estado que guarda la estimación de riesgo COVID en cada una de las 32 entidades federativas, pero no lo hacemos público, excepto que fuera, circunstancia que no ha sido el caso, que se presentara una condición inesperada de aumento del riesgo, no ha sido el caso, está todo más o menos en lo convencional, y la próxima semana, el viernes presentaremos la nueva ronda de semáforo. Gracias.",0.0,107,20,09,2020
HUGO LOPEZ-GATELL RAMIREZ,"Héctor García, nos da tiempo para una última pregunta.",0.0,9,20,09,2020
PREGUNTA," Rápidamente, subsecretario. El segundo voluntario de AstraZeneca recibió o se anunció que tuvo una enfermedad neurológica de estos ensayos por la vacuna del COVID, ¿qué piensa de eso?",0.0,28,20,09,2020
HUGO LOPEZ-GATELL RAMIREZ," Es correcto, se conoció, el propio laboratorio AstraZeneca, con residencia principalmente en el Reino Unido, hizo público que un segundo voluntario de los que participan en el ensayo clínico de la vacuna COVID de este laboratorio ha presentado una enfermedad neurológica aguda de tipo inflamatorio, posiblemente compatible con mielitis trasversa, que es la condición clínica que ya se corroboró en un primer voluntario hace una semana.",0.0,66,20,09,2020
HUGO LOPEZ-GATELL RAMIREZ,Lo que pienso es que es una señal importante a considerar y que estoy tranquilo de que el Comité de Seguridad y Monitoreo de Datos del ensayo clínico del laboratorio AstraZeneca está haciendo el proceso adecuado de vigilancia y por eso se pueden detectar estos casos.,0.0,46,20,09,2020
HUGO LOPEZ-GATELL RAMIREZ,"No hay que saltar a conclusiones sobre la relación que pudiera guardar esta condición clínica, la mielitis trasversa o cualquier otro evento agudo grave con la condición de haber sido vacunado con el producto que está en fase de evaluación, porque esto depende de una evaluación más sistemática que el propio Comité de Seguridad y Monitoreo de datos realiza, es decir, es una señal que es muy importante que se haga pública, debemos tener consciencia de que esto ha ocurrido, pero no debemos saltar a una conclusión anticipada, porque carecería de un fundamento científico apropiado de que la vacuna es insegura.",0.0,101,20,09,2020
HUGO LOPEZ-GATELL RAMIREZ,"Si en un momento dado fuera la circunstancia de que se presentan repetidos casos de esta u otras condiciones y de que esto se relaciona con el hecho de haber sido aplicado el producto candidato a vacuna, podría llevar incluso a que se parara por completo el ensayo clínico, pero no es el caso, no por tener una segunda persona voluntaria con esta afección se puede arribar a esa conclusión.",0.0,70,20,09,2020
HUGO LOPEZ-GATELL RAMIREZ,"Insisto, da tranquilidad saber que hay un Comité de Seguridad y Monitoreo de Datos que es muy celoso de su deber y que está muy pendiente de detectar, analizar y evaluar los riesgos de las personas voluntarias que participan en el ensayo clínico. Muchas gracias.",0.0,45,20,09,2020
HUGO LOPEZ-GATELL RAMIREZ,"Aquí terminamos, 20:01, empieza la semana 39, hoy es domingo 20 de septiembre de 2020, siete semanas consecutivas de descenso en todos los indicadores de la epidemia. La epidemia COVID-19 no ha acabado, pero muestra un cambio sostenido a la baja y debemos seguir manteniendo las medidas de precaución, incluida la sana distancia, para lograr un control más sostenido. Muchas gracias.",0.0,61,20,09,2020
HUGO LOPEZ-GATELL RAMIREZ,---,0.0,1,20,09,2020
HUGO LOPEZ-GATELL RAMIREZ,VE 1266.,0.0,2,20,09,2020
