Participante,Texto,Sentimiento,Palabras,Dia,Mes,Anio
HUGO LOPEZ-GATELL RAMIREZ,"Sin embargo, hoy lo constatamos, por lo que nos explicaron, tomaron una decisión muy inteligente de crear un centro virtual en donde este personal, que además es médicos, médicas, muy talentosos, con una enorme experiencia, han estado apoyando 24 horas al día lo siete días a la semana para asesorar por una vía remota de telesalud, de telemedicina, las operaciones diagnósticas y terapéuticas.",0.0,63,31,07,2020
HUGO LOPEZ-GATELL RAMIREZ,Le damos la palabra al maestro Zoé Robledo para que comente.,0.0,11,31,07,2020
HUGO LOPEZ-GATELL RAMIREZ, Muchas gracias.,0.0,2,31,07,2020
HUGO LOPEZ-GATELL RAMIREZ,"Vamos con una persona atrás, usted allá de la máscara tan amable y luego la compañera.",0.0,16,31,07,2020
HUGO LOPEZ-GATELL RAMIREZ, Muchas gracias.,0.0,2,31,07,2020
HUGO LOPEZ-GATELL RAMIREZ,"El semáforo, insisto, es un instrumento técnico que nos permite el monitoreo continuo, día con día de la evidencia sobre cuál es la trayectoria de la epidemia. La trayectoria le llamamos al cambio en el tiempo y el cambio en el espacio, ya que sea que va disminuyendo la velocidad a la que ocurren los contagios o va a aumentando, o la velocidad a la que se propagan en el territorio.",0.0,71,31,07,2020
HUGO LOPEZ-GATELL RAMIREZ,"No es correcto desde el punto de vista técnico anticipar con demasiada antelación predicciones. Esto para un símil, es como el monitoreo ambiental, uno no puede predecir con demasiada anticipación cómo va a estar el estado del tiempo, si va a hacer frío, calor, soleado, lluvia con demasiados días de anticipación, entonces, lo vamos informando por eso cada semana.",0.0,59,31,07,2020
HUGO LOPEZ-GATELL RAMIREZ,"Lo que sí podemos decir es que, en el estado de Puebla, y es lo que le comentaba a la colega hace unos minutos, hemos visto una buena organización de la respuesta, hemos visto un riguroso manejo de la epidemia en términos de las medidas de confinamiento, de sana distancia, y en la parte del sistema de salud han ido avanzando de acuerdo a un plan de escalamiento y reconversión que fue planteado desde el inicio.",0.0,76,31,07,2020
HUGO LOPEZ-GATELL RAMIREZ,"Entonces, esperamos que en su momento esto permita que se empiecen abrir las actividades económicas y sociales de acuerdo también a un plan de desconfinamiento, que vamos a estar trabajando por instrucción del gobernador Barbosa con la secretaria de Economía del estado y el secretario de Salud del estado para ir identificando esas oportunidades. Muchas gracias.",0.0,56,31,07,2020
HUGO LOPEZ-GATELL RAMIREZ," Gracias, maestro Zoé.",0.0,3,31,07,2020
HUGO LOPEZ-GATELL RAMIREZ,"Vamos con usted, por favor.",0.0,5,31,07,2020
HUGO LOPEZ-GATELL RAMIREZ," Con mucho gusto. Esto que usted dice: ‘Hay tanto problema’, insisto, es una verdad construida, yo sé que es parte del oficio periodístico hacer una afirmación, no necesariamente con evidencia, para ver qué responde la persona que se entrevista; y respeto su trabajo, por supuesto.",0.0,45,31,07,2020
HUGO LOPEZ-GATELL RAMIREZ,"Podemos decir, ha sido muy constructiva la relación con los gobernadores, todos, incluido nuestro anfitrión esta noche por supuesto, y existen opiniones que enriquecen.",0.0,24,31,07,2020
HUGO LOPEZ-GATELL RAMIREZ,Y otra cosa que también podemos aprender de ello es la democracia. En términos de una nación sería sumamente preocupante si no hubiera pluralidad de versiones y de visiones sobre las cosas.,0.0,32,31,07,2020
HUGO LOPEZ-GATELL RAMIREZ,"Qué bueno que haya pluralidad y eso para nosotros, el Gobierno de México, es un baluarte de la vida pública y lo vamos no solamente a respetar siempre, sino a estimular cada quien en su campo de responsabilidad.",0.0,38,31,07,2020
HUGO LOPEZ-GATELL RAMIREZ,¿Qué vamos a hacer?,0.0,4,31,07,2020
HUGO LOPEZ-GATELL RAMIREZ,"Lo que se generó por consenso que es: el Consejo Nacional de Salud, que lo preside el secretario de Salud, mi maestro el doctor Alcocer, convocará a una reunión de trabajo técnica la próxima semana.",0.0,35,31,07,2020
HUGO LOPEZ-GATELL RAMIREZ,"En este consejo participan los 32 secretarias y secretarios de Salud de los estados, participa el director general del IMSSS, el Issste, la gerencia médica de Pemex y de las Fuerzas Armadas y vamos a construir siempre sobre la realidad, sobre la evidencia y sobre ciencia para tener los mejores instrumentos técnicos.",0.0,52,31,07,2020
HUGO LOPEZ-GATELL RAMIREZ,Le damos la palabra al maestro Zoé Robledo.,0.0,8,31,07,2020
HUGO LOPEZ-GATELL RAMIREZ," Muchas gracias, maestro Zoé.",0.0,4,31,07,2020
HUGO LOPEZ-GATELL RAMIREZ,"Nos quedan dos minutos, ya no nos da tiempo para atender otra pregunta. Quisiera cerrar con un mensaje sobre el propósito de esta visita.",0.0,24,31,07,2020
HUGO LOPEZ-GATELL RAMIREZ,"La transformación del Sistema Nacional de Salud México en esta etapa se orienta por un modelo que se llama Atención Primaria de la Salud. Este modelo se estableció como propuesta hace 40 años, y a lo largo de 40 años sistemáticamente la Organización Mundial de la Salud y la Organización Panamericana de la Salud ha mantenido la vigencia de este modelo al incorporar los retos contemporáneos de salud de los países del mundo, lo sigue recomendando, en abril de 2019, México tuvo el privilegio de ser la sede de la presentación de un informe sobre atención primaria de la salud que ratifica la vigencia de este modelo.",0.0,107,31,07,2020
HUGO LOPEZ-GATELL RAMIREZ,"Y esto se encuentra con una visión amplia de la salud que tiene que ver con el bienestar, la salud es una parte fundamental del bienestar, y por eso en el Gobierno de México tenemos la aspiración de construir un Estado de bienestar.",0.0,43,31,07,2020
HUGO LOPEZ-GATELL RAMIREZ,"Y esto implica hacer una transformación del Estado para que sea un Estado que garantiza los derechos individuales y sociales en forma real. Eso además abre la puerta a una política multisectorial, y por eso es que venimos con representación de múltiples sectores del gobierno nacional, pero además requiere la contribución de todos los órdenes de gobierno.",0.0,57,31,07,2020
HUGO LOPEZ-GATELL RAMIREZ,"Y por eso es que nos da mucho gusto, y se lo agradecemos públicamente al gobernador Barbosa que nos reciba, y que reciba con entusiasmo esta iniciativa, la haga suya, que se construya también con la colaboración de los poderes municipales, y además en primera y en última instancia con la comunidad, es decir, la colaboración de la sociedad es imprescindible.",0.0,61,31,07,2020
HUGO LOPEZ-GATELL RAMIREZ,"Y de momento esta iniciativa de acción local comunitaria se enfoca a responder con toda esta riqueza de acción de un Estado de bienestar a la pandemia de COVID, pero a partir de ella se construye la salud y el bienestar enfocándonos en tres elementos fundamentales: en la salud, el acceso a agua y la nutrición saludable, que nos permitirán tener mejores condiciones de vida, vidas más saludables y desde luego vidas más duraderas.",0.0,74,31,07,2020
HUGO LOPEZ-GATELL RAMIREZ,"Muchas gracias, gobernador; muchas gracias a todas y todos ustedes, gracias a todos los compañeros y compañeras del gobierno, y de las organizaciones internacionales de Naciones Unidas. Gracias.",0.0,28,31,07,2020
HUGO LOPEZ-GATELL RAMIREZ,---,0.0,1,31,07,2020
