Participante,Texto,Sentimiento,Palabras,Dia,Mes,Anio
RICARDO CORTES ALCALA,"La estrategia de APS no es exclusiva de estas cuatro entidades federativas, en estas cuatro entidades federativas es en las cuatro en las que el Instituto Nacional de Salud Pública específicamente y en conjunto con la Organización Panamericana de la Salud están apoyando a los servicios de salud en la implementación de la estrategia, el resto de entidades federativas han tomado el documento normativo que compartimos, que está en la página coronavirus.gob.mx y hemos apoyado también en ver cómo ha estado cada estado llevando a cabo la estrategia de APS.",0.0,90,5,05,2021
RICARDO CORTES ALCALA,"Sobre por qué esos cuatro estados, ahí sí, doctora Reyes o doctor Malo.",0.0,13,5,05,2021
MIGUEL MALO SERRANO," Bueno, nosotros hemos hecho este trabajo, digamos, en estrecha coordinación con la Secretaría de Salud y yo diría que ha sido un poco al azar la cuestión de los estados en el sentido de que por cierto tipo, digamos, de relaciones de la coyuntura hubo interés de parte de los gobiernos estatales y de las secretarías de Salud.",0.0,58,5,05,2021
MIGUEL MALO SERRANO,"Entonces, para una investigación como la que se está haciendo es importante que haya, diríamos, toda la colaboración posible de la Secretaría de Salud.",0.0,24,5,05,2021
MIGUEL MALO SERRANO,"Ahora, lo que creo que es muy interesante, que ya se mencionó aquí, es que, digamos, es un trabajo, más bien de rescate de esa identidad de los propios estados, es decir, de toda la diversidad que se da en la respuesta de los propios estados.",0.0,46,5,05,2021
MIGUEL MALO SERRANO,Y seguramente toda la propuesta metodológica que se está trabajando va a ser útil para otros estados para en función de revisar qué indicadores podrían trabajarse para mejorar la respuesta en atención primaria.,0.0,33,5,05,2021
MIGUEL MALO SERRANO,"Sobre la otra pregunta, la pandemia a todo el mundo, a todos los países y particularmente a las secretarías de Salud, a los ministerios de Salud nos va a dejar una experiencia fundamental, una experiencia fundamental que tiene que ser rescatada justamente para fortalecer el trabajo en pospandemia.",0.0,48,5,05,2021
MIGUEL MALO SERRANO,"Nunca como en la pandemia la salud ha estado en la primera línea de prioridad de las políticas gubernamentales. Y eso hay que rescatar en el sentido de decir: Bueno, qué es lo que ha pasado, cómo se ha dado la transformación de los servicios y cómo se puede fortalecer eso para mejorar la salud de la población y el acceso a los servicios de salud.",0.0,66,5,05,2021
MIGUEL MALO SERRANO,"Le pongo un ejemplo concreto, lo que ya mencionaba la doctora Reyes, la atención virtual, la atención por llamadas telefónicas, la atención vía páginas web, esa es una cosa que se va a fortalecer y que va a apoyar a las poblaciones para tener mejor acceso a los servicios de salud.",0.0,51,5,05,2021
MIGUEL MALO SERRANO,"Entonces, ese es, por ejemplo, un elemento que seguramente va a estar saliendo mucho, como ya lo mencionó la doctora Reyes, en todas las propuestas de los servicios, y que de hecho ha sido una de las cosas que ha rescatado también la Secretaría de Salud federal, como un ejemplo.",0.0,50,5,05,2021
RICARDO CORTES ALCALA,"RICARDO CORTÉS ALCALÁ: Muchas gracias, doctor.",0.0,6,5,05,2021
RICARDO CORTES ALCALA,"No hay invasión dado que, como lo hemos comentado, la salud es una materia de concurrencia y de corresponsabilidad tanto del orden federal como del estatal, del municipal y de sociedad y gobierno.",0.0,33,5,05,2021
RICARDO CORTES ALCALA,Muchas gracias.,0.0,2,5,05,2021
RICARDO CORTES ALCALA,Juan.,0.0,1,5,05,2021
RICARDO CORTES ALCALA,"Ah, sobre la patente, bueno, será una decisión que se tome en un futuro. Seguramente con la forma de ser y pensar de este gobierno del presidente López Obrador, seguramente será una vacuna disponible para todo el mundo.",0.0,38,5,05,2021
RICARDO CORTES ALCALA,"Adelante, Juan.",0.0,2,5,05,2021
PREGUNTA," Bueno, rápidamente. En el último de los casos de aquí de esto que han aplicado ¿cuáles serían los elementos más importantes que podría México dar precisamente a otros países?, ¿cuáles serían así a grandes rasgos?",0.0,35,5,05,2021
MIGUEL MALO SERRANO, ¿Qué es lo que nosotros hemos visto con toda la estrategia esta que se ha propuesto desde el nivel federal?,0.0,20,5,05,2021
MIGUEL MALO SERRANO,"Este fortalecimiento de todo lo que es la atención desde el centro de salud hacia la comunidad, primera cosa, es decir, el volcamiento, la apertura diríamos de los servicios de salud de los centros de salud hacia lo comunitario, ese es un aspecto fundamental.",0.0,44,5,05,2021
MIGUEL MALO SERRANO,"El otro aspecto importante, tal vez la doctora Hortensia puede completar, es los despachos de participación y cogestión, como decía el doctor Cortés, de ninguna manera es una invasión, todo lo contrario, es una propuesta de aporte colectivo donde trabaja el aspecto comunitario con los voluntarios donde trabajan los ayuntamientos, los gobiernos locales y donde trabajan intersectorialmente distintas instituciones para eso.",0.0,61,5,05,2021
MIGUEL MALO SERRANO,Ese es uno de los dos aspectos que hemos encontrado que es muy positivo ¿no?,0.0,15,5,05,2021
MIGUEL MALO SERRANO,"No sé, tal vez la doctora Reyes.",0.0,7,5,05,2021
RICARDO CORTES ALCALA,"RICARDO CORTÉS ALCALÁ: ¿Doctora Reyes, algún comentario?",0.0,7,5,05,2021
HORTENSIA REYES MORALES, Yo dos muy puntuales a esta interesante pregunta.,0.0,8,5,05,2021
HORTENSIA REYES MORALES,"El primero, es un gran ejemplo de la coordinación entre las instituciones de salud y la coordinación con otros sectores para atender un problema común de interés a todos.",0.0,29,5,05,2021
HORTENSIA REYES MORALES,"Y la segunda, la participación de la propia población, que ha sido muy activa y que ha aprendido tanto en esta pandemia de cuáles son los riesgos, las posibilidades de contagio y que va estar participando cada vez en su propio autocuidado.",0.0,42,5,05,2021
HORTENSIA REYES MORALES,"Pienso que esas dos son ejemplos que cuando usted pregunta que se pueden extrapolar para continuar fortaleciéndolos y tal vez para otros países, otras regiones.",0.0,25,5,05,2021
RICARDO CORTES ALCALA,"RICARDO CORTÉS ALCALÁ: Muchísimas gracias, doctora Reyes, doctor Malo.",0.0,9,5,05,2021
RICARDO CORTES ALCALA,"Son las 20:00 horas de este miércoles 5 de mayo, vamos a dejar las últimas dos participaciones pendientes para mañana.",0.0,20,5,05,2021
RICARDO CORTES ALCALA,"Muchísimas gracias a todas las personas que nos acompañaron aquí en Palacio Nacional, el Salón Tesorería y sobre todo a usted en casa. No se olvide que la epidemia sigue activa, que sí, sí va en descenso, pero que sigue activa y que no hay que olvidarnos de no bajar la guardia y de mantener las medidas básicas de prevención que se resumen en el A,B,C,D,E por la salud.",0.0,69,5,05,2021
RICARDO CORTES ALCALA,Muchísimas gracias. Muy buenas noches.,0.0,5,5,05,2021
RICARDO CORTES ALCALA,---,0.0,1,5,05,2021
