Participante,Texto,Sentimiento,Palabras,Dia,Mes,Anio
HUGO LOPEZ-GATELL RAMIREZ," Gracias, doctor Alomía.",0.0,3,29,07,2020
HUGO LOPEZ-GATELL RAMIREZ,"Le pedimos amablemente, entonces, al secretario de Salud, doctor Jorge Alcocer, si nos comparte.",0.0,14,29,07,2020
HUGO LOPEZ-GATELL RAMIREZ," Muchas gracias, gracias doctor por esta explicación amplia y detallada de los conceptos y de las realidades que enfrenta México y el mundo en el desarrollo de vacunas y en su potencial adquisición.",0.0,33,29,07,2020
HUGO LOPEZ-GATELL RAMIREZ,"Vamos a empezar con Carlos Guzmán la ronda de preguntas, Araceli Aranday, después usted y nos vamos luego por este lado.",0.0,21,29,07,2020
HUGO LOPEZ-GATELL RAMIREZ," Sobre la aplicación móvil, desde hace varios meses, lo recordarán seguramente, presentamos una aplicación móvil COVIDMX, una aplicación para teléfonos móviles creada por el gobierno mexicano que no tuvo un costo relevante, se hizo con los propios funcionarios, servidores que trabajan en la Unidad de Política Digital Nacional del Gobierno de México, adscritos aquí a la Oficina de Presidencia, Emiliano Calderón es el ingeniero, Emiliano Calderón es su líder.",0.0,69,29,07,2020
HUGO LOPEZ-GATELL RAMIREZ,"Esta ha sido de gran utilidad, periódicamente el doctor Ricardo Cortés nos informa sobre su uso porque nos ha permitido intercambiar con la población respuestas a preguntas que son básicas de todos los días, se lo recordamos a la población:",0.0,40,29,07,2020
HUGO LOPEZ-GATELL RAMIREZ,"Si usted presenta síntomas de COVID, fiebre, tos, dolor de garganta, dolor de cabeza, malestar general, debilidad, quizá diarrea, entre otros, tiene la inquietud de si tiene o no COVID y si usted tuviera instalada o algún familiar suyo, en caso de que usted no esté enfocado en el ambiente tecnológico, la aplicación COVIDMX podría ahí tener muchas respuestas, incluido dónde me puedo atender, ahí va a poder ver un mapa de cuáles son los hospitales de su localidad que están disponibles o están designados para ser COVID.",0.0,88,29,07,2020
HUGO LOPEZ-GATELL RAMIREZ,En esta aplicación se han ido agregando otras funcionalidades y se trabaja en este momento en agregar un componente tecnológico de rastreo de contactos.,0.0,24,29,07,2020
HUGO LOPEZ-GATELL RAMIREZ,"Esto lo que va a permitir es que de manera voluntaria y, por supuesto, controlada las personas decidan si quieren incorporar un mecanismo en el que puedan ser identificadas o solicitar a sus conocidos y conocidas el ser potencialmente identificadas como contactos, esto desde luego garantizando absolutamente el cuidado de los datos personales, la confidencialidad y utilizándose solamente para propósitos de una identificación temprana de personas que pudieran ser contactos de alguien con COVID. Muchas gracias, Carlos.",0.0,77,29,07,2020
HUGO LOPEZ-GATELL RAMIREZ,"Araceli Aranday de Canal 11, por favor.",0.0,7,29,07,2020
HUGO LOPEZ-GATELL RAMIREZ, Muchas gracias. Usted y nos vamos acá de este lado con el colega.,0.0,13,29,07,2020
HUGO LOPEZ-GATELL RAMIREZ," De manera genérica -gracias, doctor- de manera genérica el marco de colaboración internacional de México para el tema de salud o los temas de salud es muy amplio, México tiene una larga tradición de colaboración en materia científica, tecnológica, de generación de conocimiento, de formación de profesionales por muchos, muchos años, más de 50 o 60 años.",0.0,57,29,07,2020
HUGO LOPEZ-GATELL RAMIREZ,"El Consejo Nacional de Ciencia y Tecnología, Conacyt, ha sido una piedra angular de esta cooperación, en su programa de becas al extranjero para estudios de posgrado, en el cual muchos fuimos beneficiarios de ese importantísimo programa, también en el enlace con grupos de investigación y la comunidad científica de México orientada a temas de biomedicina y de salud, de ciencias de la salud, tiene un muy enriquecedor marco de intercambio global.",0.0,72,29,07,2020
HUGO LOPEZ-GATELL RAMIREZ,"El T-MEC, hasta donde llega mi conocimiento, no necesariamente aporta una pieza adicional en la que se haya pactado elementos que faciliten de manera específica estos intercambios ya de por sí muy productivos.",0.0,33,29,07,2020
HUGO LOPEZ-GATELL RAMIREZ,"Entonces, desde luego seguirá, como también anunció el doctor Alcocer hace algunas semanas en el Pulso de la Salud y detalló el doctor Svarch, tenemos un programa nuevo de formación de los profesionales humanos, particularmente en el área de especialización médica, que es un programa nuevo en el que se va a duplicar el número de residentes o de estudiantes de posgrado de especialidades médicas, habitualmente hay un cupo máximo de 10 mil para la formación en México.",0.0,78,29,07,2020
HUGO LOPEZ-GATELL RAMIREZ,"Y conscientes de que tenemos un déficit muy importante de formación de especialistas, cosa que el propio COVID nos ha corroborado, ya lo sabíamos, pero lo ha corroborado, entonces el doctor Alcocer ha instruido que se acelere el paso para tener esta ampliación de la formación de especialistas, y en ello se han echado mano nuevamente del Conacyt, hemos tenido el apoyo también de la Secretaría de Educación Pública, de la Secretaría de Relaciones Exteriores, para explorar cuáles son las oportunidades también para mandar a becarias y becarios mexicanos a formarse con la expectativa de que después retornen y contribuyan a enriquecer la capacidad del sistema de salud.",0.0,108,29,07,2020
HUGO LOPEZ-GATELL RAMIREZ, Gracias doctor.,0.0,2,29,07,2020
HUGO LOPEZ-GATELL RAMIREZ,"Liliana Noble de Pulso Saludable, y después usted, compañero.",0.0,9,29,07,2020
HUGO LOPEZ-GATELL RAMIREZ, Muchas gracias. Usted por favor.,0.0,5,29,07,2020
HUGO LOPEZ-GATELL RAMIREZ," No se preocupe, ahorita páseselo a los compañeros y si no, imprima, generalmente ya está en electrónico estos.",0.0,18,29,07,2020
HUGO LOPEZ-GATELL RAMIREZ," Muchas gracias. Perdón, no recuerdo de qué medio dijo usted qué es.",0.0,12,29,07,2020
HUGO LOPEZ-GATELL RAMIREZ," El Heraldo de México. Es que me llama la atención, es la primera vez que viene ¿verdad?, a la conferencia, como trae cubrebocas N95 no lo reconocía.",0.0,27,29,07,2020
HUGO LOPEZ-GATELL RAMIREZ,"Estos temas casi todas las tardes lo tratamos, entonces como llevamos 152 sesiones, con mucho gusto le voy a responder sus inquietudes [falla de transmisión] que sea tan amable usted o sus colegas del Heraldo que hubieran venido antes, revisen la 152 o las más cercanas.",0.0,46,29,07,2020
HUGO LOPEZ-GATELL RAMIREZ,Específicamente sobre cubrebocas ayer la compañera que está al frente de usted…,0.0,12,29,07,2020
HUGO LOPEZ-GATELL RAMIREZ, Se agradecen siempre las dudas.,0.0,5,29,07,2020
HUGO LOPEZ-GATELL RAMIREZ,"Quizá definitivamente usted es parte de la población y de los editores de El Heraldo de México también lo son y con mucho gusto lo volvemos a comentar, pero ayer, le recomiendo con todo gusto que revise la conferencia de ayer.",0.0,41,29,07,2020
HUGO LOPEZ-GATELL RAMIREZ,"Lilian Noble, de Pulso Saludable aquí presente comentó o preguntó sobre esto, también en el Pulso de la Salud, que es los martes por la mañana junto con el presidente, es la conferencia matutina que tiene el presidente todas las mañanas, hablamos de esto, porque alguien preguntó sobre el tema del cubrebocas.",0.0,52,29,07,2020
HUGO LOPEZ-GATELL RAMIREZ,"En síntesis y sí, también le recomiendo no imprimir, hay que tratar de conservar el ambiente, la evidencia científica hoy está muy ampliamente disponible, como acaba de señalar nuestro secretario, hay más de 35 mil artículos de distintos temas que tienen que ver con COVID y uno de los temas de interés público en todo el mundo ha sido el tema de los cubrebocas.",0.0,64,29,07,2020
HUGO LOPEZ-GATELL RAMIREZ,"Le resumo con mucho gusto para usted y para la audiencia, si alguien comparte su inquietud, lo que comentábamos ayer y que hemos comentado en innumerables ocasiones, también le recomiendo coronavirus.gob.mx, es el portal de gobierno donde están los lineamientos técnicos, busque uno que se llama Guía de control de infecciones, que lo coordinó la doctora Alethse de la Torre, ayer estuvo aquí con nosotros también, ella es una especialista en este tema control de infecciones, es infectóloga.",0.0,78,29,07,2020
HUGO LOPEZ-GATELL RAMIREZ,"Y este lineamiento lo revisamos periódicamente conforme surge alguna evidencia científica relevante, este y todos, pero el caso de este hay indicaciones específicas sobre el uso de cubrebocas, sobre donde es más útil y sobre el correcto uso, que es algo muy, muy importante.",0.0,44,29,07,2020
HUGO LOPEZ-GATELL RAMIREZ,Uno de los elementos que ahí se describe es cuáles son los cubrebocas que pueden tener la eficiencia suficiente en términos de filtrado para potencialmente reducir el riesgo de inoculación o de inspirar las partículas líquidas que contienen los virus provenientes de una persona infecciosa.,0.0,45,29,07,2020
HUGO LOPEZ-GATELL RAMIREZ,"Por cierto, el que usted trae es un N95, este generalmente se recomienda solamente para las personas que están en el campo clínico, particularmente en los procedimientos que generan aerosoles, como la intubación endotraqueal o las tomas de muestras.",0.0,39,29,07,2020
HUGO LOPEZ-GATELL RAMIREZ,"El cubrebocas en general, como decíamos ayer, es un aditamento útil para disminuir significativamente la propagación de partículas a partir de la nariz y boca de alguien infectante, su uso comunitario masivo puede contribuir a disminuir la probabilidad de que una persona con potencial infectante contagie a otras.",0.0,48,29,07,2020
HUGO LOPEZ-GATELL RAMIREZ,"Y hay un elemento que es crucial y es donde la evidencia científica tiene todavía un área muy, muy grande de impresión o de ausencia de evidencia, entre otras razones porque resulta muy complicado el generar evidencia útil al respecto y es el uso correcto, versus el uso no correcto.",0.0,50,29,07,2020
HUGO LOPEZ-GATELL RAMIREZ,"Hay un artículo muy importante en este sentido, con suerte y es uno de los que usted ya imprimió, que se publicó en la revista Lancet hace tres semanas, está basado en un método de generación de conocimiento, que es la modelación matemática y en términos gruesos la conclusión es que si prácticamente toda la población usara consistentemente el cubrebocas todo el tiempo, eso aunado a otras medidas, la sana distancia, lavarse las manos, quedarse en casa si se tienen síntomas, podría contribuir a una reducción, ahí consideran alrededor de unas tres decenas porcentuales del riesgo de propagación.",0.0,98,29,07,2020
HUGO LOPEZ-GATELL RAMIREZ,"Entonces, en suma, y es lo que decíamos ayer, por eso le recomiendo ver tanto la conferencia en la mañana como la de la tarde, el Gobierno de México ha recomendado el cubrebocas, no de ahorita desde el inicio, vea las guías, desde el inicio de la epidemia, y eso sigue vigente.",0.0,52,29,07,2020
HUGO LOPEZ-GATELL RAMIREZ,"Ayer aquí mismo yo me puse un cubrebocas para ilustrarlo, y recomendamos el uso de cubrebocas, puede ser un elemento que junto con otras medidas contribuya y no descuidemos tampoco las otras medidas.",0.0,33,29,07,2020
HUGO LOPEZ-GATELL RAMIREZ,"Muchas gracias. Son las 20:00 horas. Le agradecemos muchísimo al doctor Alcocer, secretario de Salud y maestro de muchas generaciones. Muchas gracias, doctor.",0.0,23,29,07,2020
HUGO LOPEZ-GATELL RAMIREZ," Gracias a ustedes, buenas noches.",0.0,5,29,07,2020
HUGO LOPEZ-GATELL RAMIREZ,---,0.0,1,29,07,2020
