Participante,Texto,Sentimiento,Palabras,Dia,Mes,Anio
ANDREA ELIZABETH GUAJARDO," En la III Región Naval nosotros tenemos un proceso o una forma de vacunación que le llamamos ‘moros estáticos’. Los ´moros estáticos’ es que nuestro adulto mayor llegue, se establezca en la silla y en esa silla pase todo el proceso sin tener que moverse.",0.0,45,11,04,2021
ANDREA ELIZABETH GUAJARDO,"Comienza con el registro. Como podemos ver acá, están sentados ellos, ahí llega el personal de la Secretaría de Bienestar a registrarlos y a hacerles su papelito para la segunda dosis.",0.0,31,11,04,2021
ANDREA ELIZABETH GUAJARDO,"Después, llega el personal de enfermeros a tomarles su triaje, que es una prueba rápida para ver los signos vitales, la temperatura, para hacer una pequeña historia clínica y saber que no tengan ninguna contraindicación para colocarle la vacuna.",0.0,39,11,04,2021
ANDREA ELIZABETH GUAJARDO,"Después, llega nuestro personal de vacunadoras a aplicarles su dosis, a esa misma silla.",0.0,14,11,04,2021
ANDREA ELIZABETH GUAJARDO,"Se esperan 30 minutos en esta misma silla, se les está vigilando, se le dan las indicaciones y posterior a eso se retiran.",0.0,23,11,04,2021
ANDREA ELIZABETH GUAJARDO,"Punto de esto es que nuestro personal de adulto mayor no se mueva o no anden deambulando para evitar accidentes, para evitar que se caigan para evitar que se puedan lastimar.",0.0,31,11,04,2021
