Participante,Texto,Sentimiento,Palabras,Dia,Mes,Anio
PREGUNTA, Buenas tardes. Arturo Contreras de Pie de Página.,0.0,8,13,06,2020
PREGUNTA,"Ahora con el… ayer nos comentaban sobre el cambio en cómo se determina el semáforo con la anuencia de los gobernadores y se cambiaron algunas metodologías, se cambió un poco el método.",0.0,32,13,06,2020
PREGUNTA,"En Quintana Roo nos dicen que el regreso, a pesar que están en el naranja, que es de preparación, como dicen ahora, no ha sido nada paulatino, sino que están abriendo actividades esenciales que consideran muchas y el regreso ha sido como más precipitado. Entonces, ¿qué pasa ahí?",0.0,48,13,06,2020
PREGUNTA,"Y ahora que comentaban sobre las actividades deportivas de la Femexfut en este caso, el regreso a la Nueva Normalidad de personas deportistas, recomendaciones para gimnasios, para albercas, ¿qué tipos de cuidados se deben tener en estos momentos? Gracias.",0.0,39,13,06,2020
HUGO LOPEZ-GATELL RAMIREZ," Gracias. Todavía no hablamos de gimnasios y albercas porque ahorita no deben operar, así de simple. Y ahorita me pongo a explicarlo vamos a crear confusión.",0.0,26,13,06,2020
HUGO LOPEZ-GATELL RAMIREZ,"Sobre velocidades de regreso a la normalidad, uno de los elementos que nos interesa que quede claro es la prevención de un fenómeno como este o de cualquier otro fenómeno de salud, requiere una participación de todas y todos.",0.0,39,13,06,2020
HUGO LOPEZ-GATELL RAMIREZ,"Es decir, la perspectiva de que el gobierno con una disposición administrativa, ya sea el gobierno federal o estatal o el municipal va a resolverse, se va a encargar de la epidemia es limitada. Es limitada porque aun cuando empiece a disminuir el riesgo epidémico y progresemos de los semáforos rojo, naranja, amarillo, verde, el riego epidémico en el mundo entero seguirá vigente, y no sólo para esta enfermedad, cuando empiece octubre empezará también el riesgo epidémico de la influenza.",0.0,80,13,06,2020
HUGO LOPEZ-GATELL RAMIREZ,¿Cuál es la manera de prevenir la influenza?,0.0,8,13,06,2020
HUGO LOPEZ-GATELL RAMIREZ,"No es solamente vacunándose, de hecho las vacunas se usan para la población de alto riesgo, es guardando la sana distancia, es teniendo una higiene continúa de manos, es quedándonos en casa si tenemos síntomas, si nos alcanza un estornudo o la tos, usando el estornudo de etiqueta, protegiéndolo con el ángulo de codo, etcétera, teniendo obviamente una alimentación saludable, reposo, etcétera.",0.0,62,13,06,2020
HUGO LOPEZ-GATELL RAMIREZ,"Muchas veces las condiciones sociales, quizá la mayoría de las veces, son el factor limitante más grande que puede haber. La gente no tiene acceso a agua potable o no tiene acceso a agua, o no tiene posibilidades de guardar la sana distancia porque vive en un espacio muy pequeño y estos factores deben, espero, modificarse progresivamente, pero son parte de la injusticia social que vive, no sólo México, sino el mundo entero desde hace décadas, décadas, siglos de hecho.",0.0,80,13,06,2020
HUGO LOPEZ-GATELL RAMIREZ,"Ahora, lo que sí se puede es tener una participación más activa, no proyectar a que me cierren un espacio para que yo me pueda proteger. Si yo tengo que salir a la calle, incorporar estos cambios de práctica.",0.0,39,13,06,2020
HUGO LOPEZ-GATELL RAMIREZ,"La población es mayor de edad, excepto quienes son desde luego menores de edad, de 18 y menos, la población es mayor de edad, no tiene sentido tratarle como si no lo fuera. Gracias.",0.0,34,13,06,2020
HUGO LOPEZ-GATELL RAMIREZ,Dulce Soto.,0.0,2,13,06,2020
PREGUNTA, Buenas noches.,0.0,2,13,06,2020
PREGUNTA,"Quiero preguntarle si les han dado alguna explicación de por qué Nuevo León y Coahuila presentan, son estos estados que presentan más rezago en el reporte de la información y de los casos, ¿a qué se debe?",0.0,37,13,06,2020
PREGUNTA,Y si nos puede detallar que otros estados también tienen rezago después de estos dos.,0.0,15,13,06,2020
PREGUNTA,"Y la siguiente era, solamente, recordarle cuándo podría presentar otra vez datos sobre los casos de las infecciones respiratorias agudas graves que se han registrado en todo lo que va de 2020 y también los decesos por estas infecciones, todos, sé que había hecho una presentación previa.",0.0,47,13,06,2020
PREGUNTA,Por favor.,0.0,2,13,06,2020
HUGO LOPEZ-GATELL RAMIREZ," Con mucho gusto, la preparamos en el curso de la semana, ya hay seguramente datos de mayo, porque en los cortes de información de los registros de defunción no es la estadística oficial, está a cargo del Inegi, y esa tiene un proceso muy sofisticado que cumple estándares internacionales muy altos del sistema de la clasificación internacional de enfermedades, pero el registro inmediato de mortalidad de las causas que no son relacionadas con muerte violenta, sí las compila la Secretaría de Salud, y yo creo que ya debemos tener información de mayo y entonces actualizaríamos, habíamos presentado hasta abril, con mucho gusto.",0.0,102,13,06,2020
HUGO LOPEZ-GATELL RAMIREZ,¿Por qué este retraso de la notificación?,0.0,7,13,06,2020
HUGO LOPEZ-GATELL RAMIREZ,"Hay muchas razones, a veces son técnicas, y es el proceso del diagnóstico y la confirmación, pero muchas otras veces es simplemente la comunicación. Hemos platicado varias veces, la Secretaría de Salud federal es la responsable de compilar la información de la vigilancia epidemiológica, hay un sistema que se llama así, Sistema Nacional de Vigilancia Epidemiológica, que en su forma contemporánea se estableció en 1995, pero México tiene vigilancia epidemiológica desde 1888.",0.0,72,13,06,2020
HUGO LOPEZ-GATELL RAMIREZ,"Y el ejercicio consiste en que las unidades de salud, los hospitales, por ejemplo, cuando se detectan casos de COVID que todavía no se les hace la prueba, sino que se les reconoce por sus condiciones clínicas, fiebre, tos, dolor de garganta, etcétera, las personas profesionales de la salud, los médicos y médicas, identifican a estos casos; y generalmente hay o debe haber en todos los hospitales una unidad de vigilancia epidemiológica hospitalaria, que es la responsable de integrar esta información.",0.0,81,13,06,2020
HUGO LOPEZ-GATELL RAMIREZ,"Antiguamente se le notificaba del hospital a la jurisdicción sanitaria, de la jurisdicción sanitaria a la Oficina Estatal de Epidemiología, y de la Oficina Estatal de Epidemiología a la Dirección General de Epidemiología, la que dirige el doctor Alomía, y ese procedimiento se hacía en transacciones de papel, se registraba un formato, el formato se compilaba en los distintos formatos de cada paciente, se mandaban a jurisdicción, de la jurisdicción al estado, etcétera.",0.0,73,13,06,2020
HUGO LOPEZ-GATELL RAMIREZ,"Desde hace ya varios años tenemos plataformas electrónicas, de modo que desde el punto de origen en el hospital, la Unidad de Vigilancia Epidemiológica es la que es responsable, obviamente los directores y directoras de los hospitales son a su vez responsables de supervisar que ese proceso ocurra, ingresan a la plataforma, y en esta plataforma que se llama red Sisver o Sistema de Vigilancia Epidemiológica de Enfermedad Respiratoria, red Sisver, o sistema de vigilancia epidemiológica de enfermedad respiratoria, ingresan la información correspondiente a los casos.",0.0,86,13,06,2020
HUGO LOPEZ-GATELL RAMIREZ,"Y en otra plataforma informática que se llama red IRAG, notifican diariamente números de ocupación de las distintas camas, y esa es la otra información que presentamos aquí.",0.0,28,13,06,2020
HUGO LOPEZ-GATELL RAMIREZ,"A veces hay retrasos por distintas razones prácticas, pero cuando hay un retraso tan consistente o tan persistente, pues es importante investigar a qué se debe. Hasta el momento no tenemos una explicación, ni de la secretaría de Salud de Nuevo León ni de la Secretaría de Salud de Coahuila, que son las que a lo largo de ya 10 días han tenido una proporción de casos sospechosos mayor incluso que la cantidad de casos confirmados y esto es algo que es difícil de pensar, que es sólo por una peculiaridad de la presentación de la epidemia. Gracias.",0.0,98,13,06,2020
HUGO LOPEZ-GATELL RAMIREZ,"Son las 19:59 horas, aquí terminamos.",0.0,6,13,06,2020
HUGO LOPEZ-GATELL RAMIREZ,"Sólo quisiera una última frase. Recordarle a la población que aun cuando los semáforos de la entidad en la que usted vive pasaran a naranja no se ha acabado la epidemia, no se va a acabar pronto, todavía en la entidad en la que usted vive, lo más probable, todas tienen una actividad epidémica, algunas empezarán a salir de esta intensa actividad epidémica y en todo momento usted puede hacer algo para proteger su propia salud, la salud de las personas de su familia y de sus allegados, y en general de la comunidad.",0.0,94,13,06,2020
HUGO LOPEZ-GATELL RAMIREZ,"Lávese continuamente las manos todas las veces que pueda, hágalo con agua y jabón, si no hay agua y jabón utilice alcohol gel, cuando salga a la calle hágalo solamente si tiene que hacerlo; si no hay una razón indispensable para hacerlo quédese en casa, todavía es importante quedarse en casa.",0.0,51,13,06,2020
HUGO LOPEZ-GATELL RAMIREZ,"Y tercero, también muy importante, conserve sana distancia, sana distancia para el tema de COVID. La epidemia que estamos viviendo implica que la vía respiratoria, su nariz, su boca, su cara, no esté cerca de la cara de otra persona, que estén por lo menos, como ha dicho el doctor Ricardo Cortés, deseablemente a dos metros. Póngase a platicar si lo necesita, pero entre más cortito el tiempo de plática mejor y definitivamente a dos metros.",0.0,76,13,06,2020
HUGO LOPEZ-GATELL RAMIREZ,"Si a usted le sorprende un estornudo y no puede contenerlo no lo tape con las manos, tápelo con el brazo, ‘achú’, igual la tos. Esto debe permanecer por siempre, por siempre, no solamente ahorita, por siempre.",0.0,37,13,06,2020
HUGO LOPEZ-GATELL RAMIREZ,Muchas gracias.,0.0,2,13,06,2020
HUGO LOPEZ-GATELL RAMIREZ,---,0.0,1,13,06,2020
HUGO LOPEZ-GATELL RAMIREZ,VE 1043.,0.0,2,13,06,2020
