Participante,Texto,Sentimiento,Palabras,Dia,Mes,Anio
PREGUNTA," Dijo que iba a hablar de las muertes, cómo se estimaban. ¿Nos puede explicar?",0.0,14,15,04,2020
HUGO LOPEZ-GATELL RAMIREZ," No se hace una estimación, se hace una contabilización directa debido a que el 100 por ciento de los casos fatales son analizados.",0.0,23,15,04,2020
PREGUNTA," Perdón, ya nada más: ¿qué cambia en la fase 3, además de esto que nos acaba de…?",0.0,17,15,04,2020
HUGO LOPEZ-GATELL RAMIREZ, Cuando anunciemos la fase 3 lo explicaremos. Por favor.,0.0,9,15,04,2020
PREGUNTA," Hola. Ernestina Álvarez, de MVS.",0.0,5,15,04,2020
PREGUNTA,"Quería ver si ha tenido contacto con algunos gobernadores, sobre todo de Acción Nacional, quienes a través de sus redes sociales han denunciado que estos insumos que les llegaron de personal médico es de mala calidad, incluso ellos han puesto algunas fotos donde estas batas son completamente transparentes.",0.0,48,15,04,2020
PREGUNTA,"¿Sabe si hubo un error o qué ha pasado con esto?, tomando en cuenta que estos gobernadores señalaron que van a regresar los insumos al gobierno federal.",0.0,27,15,04,2020
PREGUNTA,Gracias.,0.0,1,15,04,2020
HUGO LOPEZ-GATELL RAMIREZ," Cómo no. Vi esto que me platica de las redes sociales. Lo que hay no es ningún error, es un problema de comunicación.",0.0,23,15,04,2020
HUGO LOPEZ-GATELL RAMIREZ,"Se especificó, cuando se mandaron estos insumos, estas batas transparentes, por si usted se las encuentra en algún medio de información o las redes sociales, no tienen un uso clínico, no tiene.",0.0,32,15,04,2020
HUGO LOPEZ-GATELL RAMIREZ,"Si nos están escuchando estos respetabilísimos gobernadores con quienes hemos tenido múltiples conversaciones de otros temas, lo que les recuerdo es: estas batas transparentes y los insumos que circularon ustedes, fotos, no tienen una indicación de uso clínico, es decir, no son para médicos y enfermeras que están en las unidades de salud, precisamente porque son de un material muy delgado.",0.0,61,15,04,2020
HUGO LOPEZ-GATELL RAMIREZ,"Esto no es tampoco -que quede muy claro- lo que se compró en China. Aunque son de fabricación china, no es lo que vino en los aviones por compra, esto fue un donativo, así como hemos tenido muchísimos.",0.0,38,15,04,2020
HUGO LOPEZ-GATELL RAMIREZ,"Y lo que se pretende es tener una bata de uso muy simple para el personal comunitario que tiene un riesgo de exposición muy bajo; por ejemplo, quien está en la puerta de una dependencia pública haciendo los filtros sanitarios, tomando la temperatura puede usar este tipo de equipamiento.",0.0,49,15,04,2020
HUGO LOPEZ-GATELL RAMIREZ,Muchas gracias.,0.0,2,15,04,2020
HUGO LOPEZ-GATELL RAMIREZ,"Vamos a dar lugar a la última pregunta a una mujer, nos queda minuto y medio.",0.0,16,15,04,2020
PREGUNTA," Muchas gracias, doctor, Nurit Martínez, del periódico El Sol de México.",0.0,11,15,04,2020
PREGUNTA,"Preguntarle, de estas localidades, capitales que usted ya habla que están en una condición muy por delante del resto del país, ¿podríamos decir ya que son los focos rojos? Ayer hablaba usted de una fase 3 prácticamente en los hechos en estos lugares.",0.0,43,15,04,2020
PREGUNTA,"Y la otra, respecto a la última pregunta de mi compañera nada más para precisar, ¿hay una confrontación con los gobernadores por la calidad de los insumos?",0.0,27,15,04,2020
HUGO LOPEZ-GATELL RAMIREZ, Gracias por sus preguntas.,0.0,4,15,04,2020
HUGO LOPEZ-GATELL RAMIREZ,"Retomo sobre la segunda porque conecta con lo que platicó su compañera. No hay confrontación alguna con ningún gobernador por razón alguna. Como hemos dicho siempre, estamos perfectamente dispuestos a escuchar cualquier inquietud sobre este o cualquier otro tema, en este caso estamos hablando de salud, y hemos tenido siempre conversaciones muy afables, muy respetuosas y muy constructivas con todos los gobernadores y las dos gobernadoras, con la gobernadora y la jefa de gobierno.",0.0,74,15,04,2020
HUGO LOPEZ-GATELL RAMIREZ,"Entonces, en este momento lo que identificamos a partir de la comunicación que ellos hicieron pública, autoidentificándose en un grupo que ellos mismos ya se habían suscrito, es totalmente respetable que también que se organicen como consideren más procedente, y en este grupo de gobernadores de Acción Nacional, como se ha denominado al grupo, escuchamos con el mismo respeto que escuchamos a cualquier otra agrupación o a ellos con mayor razón, son la autoridad sanitaria en los estados.",0.0,78,15,04,2020
HUGO LOPEZ-GATELL RAMIREZ,"Aquí lo que haremos es aclarar el punto. Espero que esta comunicación pública ayude, pero se hará también de manera más formal. Estos equipos no tienen una utilidad clínica, no fueron enviados para la utilidad clínica y tampoco que se compró en China con el propósito de dotar de equipos de protección personal, simplemente es un donativo que tiene utilidad para los servicios comunitarios de bajo riesgo de exposición.",0.0,69,15,04,2020
HUGO LOPEZ-GATELL RAMIREZ,"Y sobre la primera pregunta, es importante, qué bueno que hace esta pregunta. La distribución de la enfermedad COVID es heterogénea, es decir, ocurre en parches. Recordarán que, desde enero, cuando presentábamos continuamente las tablas de medidas de control sanitario correspondientes a cada fase, identificábamos que de acuerdo a dónde hubiera la transmisión, se aplicarían ciertas medidas.",0.0,57,15,04,2020
HUGO LOPEZ-GATELL RAMIREZ,"Cuando anticipamos en México, que esto es algo relativamente inusual en otros países, anticipamos casi 15 días las medidas de fase 2, preferimos aprovechar la oportunidad de hacer las que se pueden hacer nacionales, y esto lo anclamos en términos de tiempo a la suspensión anticipada del ciclo escolar, y aprovechamos para lograr una inmovilización masiva y tener la mayor reducción de casos.",0.0,63,15,04,2020
HUGO LOPEZ-GATELL RAMIREZ,"De aquí en adelante donde ya tenemos una muy importante diferencia de transmisión focalizada, principalmente en las zonas urbanas y las metropolitanas, definitivamente es deseable que tengan un ritmo diferente. Esto lo comentamos también referido al Valle de México hace casi cuatro semanas, y por eso promovimos lo que en su momento fue una iniciativa de la jefa de gobierno y del gobernador Alfredo del Mazo, que tomaron el control de lo que les corresponde, trabajando, aliados en un ambiente de colaboración metropolitana.",0.0,83,15,04,2020
HUGO LOPEZ-GATELL RAMIREZ,"Entonces, ellos, ustedes lo habrán notado, han tenido anticipación de algunas medidas. El cierre de los comercios, por ejemplo, fue un poco más estricto en esta zona de lo que ha sido en el resto del país. Eso es correcto, porque nos permite precisamente segmentar las intervenciones de acuerdo a lo donde se necesita, según la intensidad de transmisión.",0.0,59,15,04,2020
HUGO LOPEZ-GATELL RAMIREZ,Muchas gracias. Me parece que ahí terminamos. Nos vemos mañana.,0.0,10,15,04,2020
HUGO LOPEZ-GATELL RAMIREZ,---,0.0,1,15,04,2020
HUGO LOPEZ-GATELL RAMIREZ,VE 910.,0.0,2,15,04,2020
