Participante,Texto,Sentimiento,Palabras,Dia,Mes,Anio
DAVID KERSHENOBICH STALNIKOWITZ, Un comentario muy breve.,0.0,4,14,04,2021
DAVID KERSHENOBICH STALNIKOWITZ, Un comentario muy breve escuchando las opiniones de mis compañeros.,0.0,10,14,04,2021
DAVID KERSHENOBICH STALNIKOWITZ,"Yo creo que independientemente, y eso se discutió en nuestras mesas de trabajo, independientemente de las medidas que se tomen hay dos puntos que son fundamentales:",0.0,26,14,04,2021
DAVID KERSHENOBICH STALNIKOWITZ,"Uno, es la calidad y seguridad de la atención a cualquier nivel, sea primario, secundario, terciario; no se puede dejar de paso el que sea con calidad y seguridad en forma.",0.0,31,14,04,2021
DAVID KERSHENOBICH STALNIKOWITZ,"Y el segundo es que la atención… Tenemos que cambiar el modelo, el modelo de atención integral de un paciente que le evitemos que vaya a distintos sitios, a distintos especialistas.",0.0,31,14,04,2021
DAVID KERSHENOBICH STALNIKOWITZ,"Entonces, eso va de acuerdo a lo que decía Ruy, el modelo de atención integral a nivel primario se vuelve muy importante.",0.0,22,14,04,2021
DAVID KERSHENOBICH STALNIKOWITZ,Es breve mi comentario sobre esos dos puntos.,0.0,8,14,04,2021
