Participante,Texto,Sentimiento,Palabras,Dia,Mes,Anio
JOSE LUIS ALOMIA ZEGARRA," Gracias. Con su permiso, señor secretario, subsecretario.",0.0,7,28,03,2020
JOSE LUIS ALOMIA ZEGARRA,"Como pueden ver ustedes, en las láminas que acostumbramos todos los días en esta conferencia, actualizar la pandemia a nivel mundial. Continua su evolución, el 75 por ciento de los casos, tres cuartas partes de ellos se han presentado en los últimos 14 días, lo que marca la evolución y la mantención de la transmisión en los diferentes países, sumando ya una totalidad de más de 571 mil casos. La tasa de letalidad mundial global se encuentra estable en relación a los últimos días, 4.6 por ciento, es lo que ha venido prácticamente sucediendo.",0.0,94,28,03,2020
JOSE LUIS ALOMIA ZEGARRA,"En la siguiente diapositiva podemos ver nuestro panorama nacional en función de la distribución de los casos confirmados en el país. es importante igual comentarles que este mapa que ustedes ven en la diapositiva lo pueden ustedes ahora encontrar en la página de la Dirección General de Epidemiología, con la ventaja de que en la página se encuentra de manera interactivo, es decir, cada vez que ustedes den un click sobre alguno de los estados que ahí aparece, podrán encontrar la información en relación a los casos confirmados específicos para ese estado, casos sospechosos, en su momento pendientes de resultado y, muy importante, aquellos casos que han sido también descartados.",0.0,110,28,03,2020
JOSE LUIS ALOMIA ZEGARRA,"Son 848 casos los que tenemos el día de hoy en la actualización, cuatro mil 341 casos se han descartado, eso también se ha incrementado; dos mil 623 casos se encuentran aún clasificados como sospechosos, por lo que podríamos lógicamente tener más casos para el día de mañana; y lamentablemente se actualiza a 16 defunciones las que han incurrido hasta el momento en México.",0.0,64,28,03,2020
JOSE LUIS ALOMIA ZEGARRA,"Si vemos nuestra gráfica de distribución de los casos confirmados, tenemos ya ahora un nuevo balance entre hombres y mujeres, aunque los hombres todavía siguen siendo un poco más la proporción en los que se ha presentado.",0.0,37,28,03,2020
JOSE LUIS ALOMIA ZEGARRA,"La manera cómo se ha presentado clínicamente entre hospitalizados y ambulatorios, prácticamente sigue también similar, 12 por ciento tuvieron que ingresar a una unidad de segundo nivel.",0.0,27,28,03,2020
JOSE LUIS ALOMIA ZEGARRA,"Y en la gráfica inferior izquierda podemos ver, de ese 12 por ciento que representan 85 personas que fueron ingresadas a un segundo nivel, felizmente el 67 por ciento de ellas están en condición estable o estuvieron en condición estable, un 28 por ciento de ellas sí tuvieron una gravedad y fue la razón y la evolución durante la hospitalización, incluyendo un cinco por ciento que se encontraron en una condición crítica, digamos, dado que tuvieron que ser intubados.",0.0,79,28,03,2020
JOSE LUIS ALOMIA ZEGARRA,"Vemos que las proporciones de atención por institución se mantienen similar, se ha mantenido prácticamente de esa manera durante la última semana.",0.0,22,28,03,2020
JOSE LUIS ALOMIA ZEGARRA,"Pueden ver también la distribución en la gráfica de la derecha, la que está en barras cuál ha sido el grupo de edad que ha estado siendo afectado. Vemos cómo el grupo de jóvenes en edad productiva, adultos jóvenes en edad productiva son los que hasta el momento tienen, digamos, la mayor carga de enfermedad en relación a casos confirmados, repuntando en su momento en los mayores de 65 años, en donde también vemos cómo hay ese incremento.",0.0,78,28,03,2020
JOSE LUIS ALOMIA ZEGARRA,"En el siguiente mapa podemos ver ahora la cómo se distribuye, cuáles son las características de las 16 defunciones.",0.0,19,28,03,2020
JOSE LUIS ALOMIA ZEGARRA,"Aquí sí vemos una mayor predominancia por los hombres con un 87 por ciento, vemos cómo la obesidad y la hipertensión siguen siendo las principales comorbilidades y, por lo tanto, factores de riesgo que han afectado a las personas, seguidas sólo por una pequeña fracción por la diabetes, que prácticamente son las tres principales. El tabaquismo y la insuficiencia renal crónica también se han presentado como ya lo veíamos anteriormente.",0.0,70,28,03,2020
JOSE LUIS ALOMIA ZEGARRA,"Tenemos la distribución por estados, ustedes la pueden apreciar y consultar, y también pueden notar que en la distribución por edad si bien es cierto ha habido defunciones también en adultos jóvenes, la gran mayoría, de hecho, el casi el 70 por ciento de ellas se ha presentado precisamente en adultos mayores, que sabemos que son el grupo principalmente en riesgo de complicarse y fallecer en esta enfermedad.",0.0,68,28,03,2020
JOSE LUIS ALOMIA ZEGARRA,"La siguiente gráfica nos vuelve a actualizar la cantidad de casos que en su momento ya no tienen un nexo epidemiológico a la importación, es decir, que se consideran ya como transmisión en la comunidad. Vemos cómo esta cantidad de casos día con día sigue incrementándose y así lo vamos a ver en la medida que nos vayamos adelantando, avanzando en este escenario 2 y transitando a un escenario 3, en donde sabemos y lo habíamos dicho desde un inicio en relación a los escenarios, los brotes comunitarios, es decir, la transmisión en la comunidad es la que empieza ya a tomar la relevancia a los casos importados que dejan de serlo y entonces en fase 3 empieza en su momento la elevación de la transmisión.",0.0,126,28,03,2020
JOSE LUIS ALOMIA ZEGARRA,Ese es el panorama para hoy.,0.0,6,28,03,2020
HUGO LOPEZ-GATELL RAMIREZ," Muchas gracias, doctor Alomía.",0.0,4,28,03,2020
HUGO LOPEZ-GATELL RAMIREZ,"Antes de pasar a la sección de preguntas y respuestas -me vuelvo a parar-, quisiera despedir a nuestro grupo técnico, presentándolos en lo individual y pidiéndoles si son tan amables de pasar a continuar las labores, dado que esto no para y está reunido todo el grupo del comando operativo.",0.0,50,28,03,2020
HUGO LOPEZ-GATELL RAMIREZ,"Está la doctora Ana de la Garza, a quien ya conocen, es directora de Investigación Operativa Epidemiológica; el doctor Christian Zaragoza, epidemiólogo también. La doctora, además es doctora en salud pública.",0.0,31,28,03,2020
HUGO LOPEZ-GATELL RAMIREZ,"El doctor Christian Zaragoza, quien es especialista en epidemiología, director de Información Epidemiológica; el doctor Ruy López Ridaura, director general del Centro Nacional de Programas Preventivos y Control de Enfermedades, es doctor en Epidemiología, investigador nacional del Sistema Nacional de Investigadores nivel 2.",0.0,43,28,03,2020
HUGO LOPEZ-GATELL RAMIREZ,"El teniente Víctor Gómez Bocanegra, quien es jefe de Epidemiología de la Secretaría de Marina; la doctora Concepción Grajales Muñiz, quien es la coordinadora de Vigilancia Epidemiológica del Instituto Mexicano del Seguro Social, también médica especialista en epidemiología; el doctor Víctor Hugo Aburto, quien es investigador nacional nivel 3, es epidemiólogo, doctor en epidemiología y es el director de Prestaciones Médicas del Instituto Mexicano del Seguro Social.",0.0,67,28,03,2020
HUGO LOPEZ-GATELL RAMIREZ,"El doctor Mauricio Hernández Ávila, quien es investigador nacional nivel 3, doctor en epidemiología y director de Prestaciones Económicas y Sociales del Instituto Mexicano del Seguro Social; la doctora Alethse de la Torre Rosas, quien es directora general del Centro Nacional para la Prevención y Control del VIH/sida, es médica internista, médica especialista en infectología y además maestra en salud pública y epidemiología.",0.0,63,28,03,2020
HUGO LOPEZ-GATELL RAMIREZ,"El doctor Ricardo Cortés Alcalá, quien es director general de Promoción de la Salud y además es médico especialista en epidemiología; la doctora Celia Alpuche Aranda, quien es directora del Centro de Investigación sobre Enfermedades Infecciosas del Instituto Nacional de Salud Pública, es también investigadora nacional nivel 2 y expresidenta de la Asociación Mexicana de Infectología y Microbiología Clínica; y la doctora Espitia, quien es médica especialista en neumología del Instituto de Seguridad y Servicios Sociales para los Trabajadores del Estado y además es doctora en políticas públicas de salud.",0.0,90,28,03,2020
HUGO LOPEZ-GATELL RAMIREZ,"Este es parte de nuestro grupo técnico. Trajimos a algunos de ellos, que son muy representativos de los liderazgos del grupo científico y técnico. Allá en el comando operativo están reunidos muchos más y les pido respetuosamente si pueden retirarse para continuar con las labores mientras termina la conferencia de prensa. Muchas gracias.",0.0,53,28,03,2020
HUGO LOPEZ-GATELL RAMIREZ,"Ahora sí, abrimos a preguntas y respuestas. Tratemos de ser concretos y ordenados, por favor. Vamos a empezar por la primera fila, los cuatro en la primera fila y nos seguimos en la siguiente fila, por favor.",0.0,37,28,03,2020
PREGUNTA," Quiero preguntarles, hoy informó el gobernador de Hidalgo que dio positivo del coronavirus.",0.0,13,28,03,2020
HUGO LOPEZ-GATELL RAMIREZ, Es correcto.,0.0,2,28,03,2020
PREGUNTA, El 18 de marzo estuvo presente en una conferencia mañanera con el presidente Andrés Manuel López Obrador.,0.0,17,28,03,2020
PREGUNTA,¿El presidente se va a hacer una prueba de coronavirus o va a tomar algunas medidas como de aislamiento o de prevención?,0.0,22,28,03,2020
HUGO LOPEZ-GATELL RAMIREZ," No, no aplica, porque el periodo relevante de contagiosidad empieza, en el caso de la persona afectada, en el momento en que empieza a desarrollar síntomas.",0.0,26,28,03,2020
HUGO LOPEZ-GATELL RAMIREZ,"La probabilidad de que una persona en el periodo previo a los síntomas, es decir, el periodo de incubación sea contagioso es muy bajo y además hacer la prueba en una persona cualquiera, sea el presidente o sea cualquier otro ser humano tiene un rendimiento muy bajo en la medida en que la persona sea asintomática. Desde luego, si fuera el caso que el licenciado López Obrador tuviera síntomas, sería atendido como corresponde a cualquier otro ser humano.",0.0,78,28,03,2020
PREGUNTA," Pero esto pasó la semana pasada, o sea, dentro de 14 días que a veces se recomiendan, ¿de todas formas, no es necesario?",0.0,23,28,03,2020
HUGO LOPEZ-GATELL RAMIREZ," Así es. Las pruebas se hacen para verificar el estado de una persona enferma, hacerla simplemente como una medida de precaución no tiene una indicación médica.",0.0,26,28,03,2020
PREGUNTA, ¿Y si desarrollara síntomas?,0.0,4,28,03,2020
HUGO LOPEZ-GATELL RAMIREZ, Se procederá conforme a la ciencia médica.,0.0,7,28,03,2020
PREGUNTA, Gracias.,0.0,1,28,03,2020
HUGO LOPEZ-GATELL RAMIREZ," Por favor, el compañero de aquí.",0.0,6,28,03,2020
PREGUNTA," Gracias, Poncho Gutiérrez, de SDP Noticias y Multimedios.",0.0,8,28,03,2020
PREGUNTA,"Nada más para aterrizar las cifras, porque en noticieros han manejado que siete de cada 10 mexicanos se van a enfermar y, si hacemos las cuentas, hablamos de millones de muertes.",0.0,31,28,03,2020
PREGUNTA,"¿Nos podría dar un estimado de cuántos fallecimientos habrá?, ¿decenas, miles o millones?, digo, para tranquilizar la gente, por favor.",0.0,20,28,03,2020
HUGO LOPEZ-GATELL RAMIREZ,": Con mucho gusto. Lo hemos explicado, que, con base en distintos ejercicios técnicos y científicos de modelación matemática,-algunos los hemos hecho nosotros como gobierno, varios otros los han hecho entidades académicas- lo interesante y reconfortante es que estas estimaciones son coincidentes.",0.0,42,28,03,2020
HUGO LOPEZ-GATELL RAMIREZ,"Esto no es tranquilizador en el sentido de que nos pinta un panorama importante de atender y por eso reiteramos en este momento que no podemos perder la última oportunidad que tenemos. Y para no perderla, la única manera para no perderla es quedarnos en casa, todo mundo se tiene que quedar en casa, a menos que cumpla una actividad crítica para el sustento de la vida pública, por importante que le parezca su actividad, solamente aquellas que son críticas para la vida pública, para el sustento del país.",0.0,89,28,03,2020
HUGO LOPEZ-GATELL RAMIREZ,"Respecto a la cantidad de casos, se ha dicho muchas veces, lo hemos dicho nosotros, lo han dicho en otros países, por ejemplo, la canciller alemana Angela Merkel, tenemos que distinguir claramente la diferencia entre infección y enfermedad.",0.0,38,28,03,2020
HUGO LOPEZ-GATELL RAMIREZ,"Infección, lo más probable es que la enorme mayoría de los países de todo el mundo terminen infectados, pero eso no quiere decir enfermedad. Eso debe de quedar muy claro, infección no quiere decir enfermedad.",0.0,35,28,03,2020
HUGO LOPEZ-GATELL RAMIREZ,"Entonces, la proporción de personas en todos los países que finalmente puede llegar a estar infectada es cercana al 70 u 80 por ciento.",0.0,24,28,03,2020
PREGUNTA, Pero en cifras aterrizadas.,0.0,4,28,03,2020
HUGO LOPEZ-GATELL RAMIREZ," Esto quiere decir que la mayoría de las mexicanas y los mexicanos vamos en algún momento a lo largo de esta epidemia, y esta epidemia puede ser larga como lo hemos dicho, larga, podemos llegar a estar infectados.",0.0,38,28,03,2020
HUGO LOPEZ-GATELL RAMIREZ,"Las cifras concretas sobre las personas que van a necesitar atención, las personas que al necesitar atención van a tener enfermedad leve, moderada o grave y desafortunadamente la cantidad de personas que pueden morir depende mucho de las intervenciones que hagamos.",0.0,41,28,03,2020
HUGO LOPEZ-GATELL RAMIREZ,"Por lo tanto, es estéril estar hablando de cada uno de los distintos escenarios, que sólo causaríamos confusión. Lo que se sabe es que la mayoría de las personas van a estar infectadas y que, de los que estén infectados, ocho de cada 10 van a tener una enfermedad leve, más o menos uno a dos de cada 10 van a tener una enfermedad suficientemente importante para ser hospitalizados y menos del cinco al seis por ciento van a necesitar atención en medicina crítica.",0.0,84,28,03,2020
PREGUNTA," Doctor, gracias. Subsecretario, dos preguntas concretas.",0.0,6,28,03,2020
PREGUNTA,"Ha habido publicaciones respecto a las modificaciones de las cifras de fallecimientos por neumonía en México, se ha dicho que habrían aumentado el número de casos en años anteriores para que la gente que desafortunadamente muere por COVID se cuente como neumonía y de esta forma se altere el promedio comparativo. ¿Es así o no es así?",0.0,57,28,03,2020
PREGUNTA,"Necesitamos, digamos, claridad en estos momentos, sobre todo ante el anuncio que nos hace.",0.0,14,28,03,2020
PREGUNTA,"¿Cuáles serían entonces, si no es así, estas cifras de 2018, 2019 y 2020?, para tener muy claro cuántos mueren por neumonía y cuántos por COVID.",0.0,26,28,03,2020
PREGUNTA,Y lo segundo sería si se tiene la certeza de que las muertes que le han reportado o que les han reportado por neumonía no son realmente por COVID y en qué se basaría esa certeza científicamente hablando. Si nos puede hacer favor de responder.,0.0,45,28,03,2020
HUGO LOPEZ-GATELL RAMIREZ, Con mucho gusto.,0.0,3,28,03,2020
HUGO LOPEZ-GATELL RAMIREZ,"Gracias por la pregunta, gracias, porque es muy importante disipar campañas de desinformación deliberadas que han existido, específicamente la que ocurrió en las últimas 24 horas, en donde se empezó a inflar sin ninguna base de evidencia la falsa idea, aquí le estoy respondiendo, la falsa idea de que el gobierno intenta modificar las cifras de neumonía o de cualquier otro padecimiento para ocultar la importancia de COVID. La falsa idea.",0.0,71,28,03,2020
HUGO LOPEZ-GATELL RAMIREZ,"Estas gráficas -me paro nuevamente- se llaman canal endémico. El canal endémico es una gráfica que utilizamos en epidemiología desde hace muchísimos años, es parte sustancial del Sistema Nacional de Vigilancia Epidemiológica que representa lo que ha ocurrido en los últimos siete años y lo que está ocurriendo en el año presente, y se va actualizando semana tras semana con la notificación de casos que provienen de más de 26 mil unidades de atención de salud de primero, segundo o tercer nivel que representa la totalidad del Sistema Nacional de Salud y que están obligadas, de acuerdo a la Ley General de Salud, a notificar distintos padecimientos, en este caso neumonías y bronconeumonías.",0.0,113,28,03,2020
HUGO LOPEZ-GATELL RAMIREZ,"Lo que se ve en la gráfica, para que todos lo tengamos claro, en la progresión de las semanas de todo un año, desde la semana uno hasta la semana 52, el número de casos registrados de neumonías y bronconeumonías.",0.0,40,28,03,2020
HUGO LOPEZ-GATELL RAMIREZ,"Y esta es la gráfica nacional y trajimos la de tres estados, teníamos por supuesto la de 32 estados, también tenemos la de todos los municipios y las jurisdicciones, esta es la nacional. Les voy a mostrar la de tres estados que fueron involucrados en esta campaña de desinformación que no tiene base de evidencia.",0.0,55,28,03,2020
HUGO LOPEZ-GATELL RAMIREZ,"Lo que se ve finalmente en los colores es cómo se ha comportado la notificación y bronconeumonías en los últimos siete años, esto es el percentil 25, es decir, una cuarta parte de los siete años existentes ha tenido esta cantidad de neumonías bronconeumonías.",0.0,44,28,03,2020
HUGO LOPEZ-GATELL RAMIREZ,"Lo que está en la parte amarilla es lo que hay entre el 25 por ciento y el 50 por ciento de los números registrados en los últimos siete años, finalmente, lo que está en la parte alta de la zona amarilla y la parte alta de la zona roja es lo que representa entre el 50 por ciento y el 75 por ciento de lo ocurrido en los últimos siete años.",0.0,72,28,03,2020
HUGO LOPEZ-GATELL RAMIREZ,"Y, por último, la línea azul representa 2020, son los registros en tiempo real semana por semana que generan 26 mil unidades de salud. Este registro, tal como se registra, se presenta aquí, y lo que se puede ver es la cantidad de neumonías y bronconeumonías a nivel nacional comparadas con lo ocurrido en los siete años anteriores, y podemos ver que se encuentra dentro de lo esperado, de hecho por debajo de la cantidad esperada en 25 por ciento de los números desde el inicio del año y hasta el momento actual.",0.0,93,28,03,2020
HUGO LOPEZ-GATELL RAMIREZ,"En las siguientes tres es el mismo tipo de gráfica, pero representa tres estados de la república:",0.0,17,28,03,2020
HUGO LOPEZ-GATELL RAMIREZ,"Jalisco, y podemos ver que al inicio del año hubo un incremento, estamos hablando de la semana 4, esto es al final de enero, hay un pequeño incremento en el número de casos de neumonía que posteriormente tiene este comportamiento.",0.0,40,28,03,2020
HUGO LOPEZ-GATELL RAMIREZ,"En la siguiente es el caso de Nuevo León, donde tenemos este mismo comportamiento, alrededor del 25 al 50 por ciento de lo que ha ocurrido en los últimos.",0.0,29,28,03,2020
HUGO LOPEZ-GATELL RAMIREZ,"Y en la última, el Estado de México, en donde tenemos esta existencia de casos que después fue descendiendo.",0.0,19,28,03,2020
HUGO LOPEZ-GATELL RAMIREZ,"Cierro diciendo lo que ocurrió al inicio del año todavía presenta el comportamiento de la temporada de influenza. La influenza ocurre todos los años entre octubre y marzo, y entre octubre y marzo la influenza es una de las enfermedades, posiblemente la principal causante de neumonías, bronconeumonías, tanto en casos como en defunciones.",0.0,53,28,03,2020
PREGUNTA," Discúlpeme nada más la insistencia. Entonces, ¿tienen la certeza de lo que les reportan como neumonía es fallecimiento por neumonía y lo que es COVID o fallecimiento por COVID?, ¿es así?",0.0,31,28,03,2020
HUGO LOPEZ-GATELL RAMIREZ," COVID es una enfermedad que tiene tres presentaciones: leve, que no tiene neumonía; moderada, que pudiera tener neumonía o ser una inflamación del árbol bronquial; y grave, donde clásicamente hay daño pulmonar agudo y neumonía.",0.0,35,28,03,2020
HUGO LOPEZ-GATELL RAMIREZ,"Son, por decirlo de otra manera, COVID es parte del mundo de las neumonías y por eso monitoreamos también esto, porque esto puede ser una señal indirecta de la existencia anormal de COVID.",0.0,33,28,03,2020
HUGO LOPEZ-GATELL RAMIREZ,"A lo largo del año y a lo largo de las semanas vamos a estar compartiendo estas curvas ya que hoy se las presentamos, porque son uno de los siete componentes de la vigilancia integrada de la epidemia de COVID.",0.0,40,28,03,2020
HUGO LOPEZ-GATELL RAMIREZ,"Entonces, la respuesta es clara: sí, efectivamente, las señales del Sistema Nacional de Vigilancia Epidemiológica consistentemente muestran que la idea de que hay un exceso de neumonías atípicas es falsa y de que no corresponde con el comportamiento de COVID.",0.0,40,28,03,2020
PREGUNTA," Y nada más, discúlpeme el atrevimiento y el aprovechar, pero para que me quede claro y poder transmitirlo, así es que la neumonía a lo mejor podría ser una complicación de alguien que padece COVID.",0.0,35,28,03,2020
HUGO LOPEZ-GATELL RAMIREZ, Así lo he dicho. La neumonía es una de las manifestaciones clínicas que ocurrirá en el cinco por ciento aproximadamente o en promedio cinco por ciento de las personas que tengan COVID.,0.0,32,28,03,2020
PREGUNTA, ¿Y la tabla de fallecimientos aparecería como muerte por neumonía o muerte por COVID?,0.0,14,28,03,2020
HUGO LOPEZ-GATELL RAMIREZ," Aparecería como muerte por COVID, por supuesto.",0.0,7,28,03,2020
PREGUNTA," Gracias, muy amable.",0.0,3,28,03,2020
PREGUNTA," De este lado, doctor Gatell; canciller, buenas noches, también a la mesa. Carlos Guzmán, de ABA Noticias. Tres preguntas muy rápidas.",0.0,21,28,03,2020
PREGUNTA,"La primera, si nos puede decir si este llamado que hace a quedarse en casa por un mes va a implicar el mover la fecha de regreso posible de los niños a la escuela que estaba planteada para el 20 de abril.",0.0,42,28,03,2020
PREGUNTA,"La segunda, que nos hable un poquito de la cuestión de cómo va el reclutamiento de médicos, especialistas, enfermeras; y si en dado caso de que no se cumpla el número de especialistas se puede abrir a enfermeras generales u otro de especialistas para poder cubrir y capacitar antes de que comience todo esto.",0.0,54,28,03,2020
PREGUNTA,"Y para el canciller Marcelo Ebrard, si nos puede hablar un poquito de cómo va la cuestión de repatriados, especialmente en el caso de una peruana que está… una mexicana que está en Perú y también de los argentinos.",0.0,39,28,03,2020
HUGO LOPEZ-GATELL RAMIREZ, Muchas gracias. Sus preguntas también son muy valiosas.,0.0,8,28,03,2020
HUGO LOPEZ-GATELL RAMIREZ,"Sobre el reclutamiento de personal médico, este continúa, este forma parte de la convocatoria inicial que ya estaba abierta para reclutar personal médico para el bienestar. En este caso la hemos enfocado mayormente a las especialidades médicas relevantes para la atención de COVID.",0.0,43,28,03,2020
HUGO LOPEZ-GATELL RAMIREZ,"Hasta el momento tenemos un progreso importante, donde ha habido cerca de dos mil 500 presentaciones, es decir, personas, especialistas en los campos relevantes que se han sumado a la convocatoria. No todos pueden ser incorporados debido a que los perfiles profesionales pudieran no ser los adecuados y estaremos anunciando conforme ya se vayan concretando este reclutamiento.",0.0,57,28,03,2020
PREGUNTA, En el caso de la movilidad de la fecha.,0.0,9,28,03,2020
HUGO LOPEZ-GATELL RAMIREZ," Muchas gracias, también por eso. En fecha muy próxima, -regreso a un asunto que ya conocen, pero para que todos lo tengan presente- el Consejo de Salubridad General desde el 19 de marzo se declaró en sesión permanente. Esto lo que nos permite es tener una agilidad inmediata para la convocatoria del consejo y que el consejo pueda ir revisando las decisiones mayores sobre las intervenciones de salud pública.",0.0,69,28,03,2020
HUGO LOPEZ-GATELL RAMIREZ,"En este momento, y para que lo recuerde la población, la medida masiva de distanciamiento social que se puede resumir con: quédate en casa, quédate en casa. Es del 23 marzo y hasta el 19 de abril, sin embargo, como muy atinadamente usted señala, la medida puede estar sujeta a revisión para su ampliación, pero de momento no se ha tomado esa decisión, de momento está sujeta a una deliberación muy próxima del Consejo de Salubridad General; si así se decidiera, lo anunciaremos oportunamente.",0.0,84,28,03,2020
PREGUNTA," Lo del canciller, por favor.",0.0,5,28,03,2020
MARCELO EBRARD CASAUBON," Muchas gracias, buenas noches, buenas noches colegas, señor secretario, señor subsecretario, señor director, amigas, amigos todos.",0.0,16,28,03,2020
MARCELO EBRARD CASAUBON,"Bueno, en primer lugar, sumarme al llamado que hace el doctor López-Gatell respecto a quedarnos en casa. Usted preguntó de qué va a depender los números o qué números. Sólo añadiría pues depende también de qué hagamos cada uno de nosotros. A mayor disciplina y contribución de cada uno de nosotros, mejor nos irá como país.",0.0,56,28,03,2020
MARCELO EBRARD CASAUBON,"Paso a contestar lo que usted me pregunta. Se han repatriado poco más de ocho mil personas de muy diversos países, hemos venido informando día a día. Para ello hemos contado con el apoyo de las aerolíneas mexicanas Interjet, Aeroméxico, principalmente.",0.0,41,28,03,2020
MARCELO EBRARD CASAUBON,"Hemos contado con el respaldo del Instituto Nacional de Migración que ha contratado vuelos especiales, como, por ejemplo, el que se hizo ahora a Cuzco, Perú, donde había un grupo importante de mexicanas y mexicanos que quedaron ahí, digamos, que atrapados, atrapadas por la disposición que se tomó por parte del gobierno de ese país hermano de cerrar sus fronteras. Entonces, se quedaron sin ninguna alternativa.",0.0,66,28,03,2020
