Participante,Texto,Sentimiento,Palabras,Dia,Mes,Anio
HUGO LOPEZ-GATELL RAMIREZ,"Desde luego esto se hace de manera planeada, si no se hiciera de manera planeada pues sería nocivo, sería dañino para las personas que, teniendo una situación que requiere atención pronta o urgente, no se realice.",0.0,36,22,04,2021
HUGO LOPEZ-GATELL RAMIREZ,"Entonces, en nuestra guía de continuidad de operaciones, que está desde el año pasado, establecimos criterios para la organización de los servicios de salud no COVID, de modo que se pudiera programar, lo que es urgente se tiene que atender urgente, lo que es prioritario en términos médicos, pero no necesita ser atendido en un lapso de días o pocas semanas, pero sí de meses, se atiende dentro de ese intervalo.",0.0,71,22,04,2021
HUGO LOPEZ-GATELL RAMIREZ,"Lo que puede posponerse, porque es un procedimiento electivo se programa electivamente y habido diferimientos.",0.0,15,22,04,2021
HUGO LOPEZ-GATELL RAMIREZ,"Y, finalmente, hay algunas situaciones que podrían esperar al menos teóricamente más de varios meses y se posponen hasta el final.",0.0,21,22,04,2021
HUGO LOPEZ-GATELL RAMIREZ,"Ahora, lo que usted relata de esta persona que se atiende en el Hospital General de Zona 2-A de Troncoso del Instituto Mexicano del Seguro Social, desde luego es posible que se trate de un fallo de comunicación en donde, de acuerdo a la descripción, una persona que tiene miomatosis uterina tiene anemia como consecuencias seguramente de sangrados periódicos o abundantes, entonces no se puede seguir posponiendo.",0.0,67,22,04,2021
HUGO LOPEZ-GATELL RAMIREZ,"No tenemos en este momento, a reserva de que el doctor Alomía lo haya localizado… Hay los números de atención de las instituciones, en el portal coronavirus están todos ellos, pero para pronta referencia vamos a trasladarlos a la parte inicial del portal coronavirus, más allá de que si se pone imss.gob.mx sale la página del Seguro Social y seguramente en la portada vienen los números de atención a la derechohabiencia donde se puede hablar por teléfono o hacer reportes de correo electrónico.",0.0,83,22,04,2021
HUGO LOPEZ-GATELL RAMIREZ,"HUGO LÓPEZ-GATELL RAMÍREZ: Cómo no, importantísima, seguramente el usuario que le consulta esto trabaja en la industria farmacéutica y legítimamente tiene la inquietud de que se acorten los tiempos de resolución.",0.0,31,22,04,2021
HUGO LOPEZ-GATELL RAMIREZ,"Con mucha satisfacción y orgullo recibimos el trabajo espléndido, espléndido que está haciendo el doctor Alejandro Svarch, titular de la Cofepris, porque efectivamente, en muy pocos meses avanzó lo que no se había avanzado en dos años.",0.0,37,22,04,2021
HUGO LOPEZ-GATELL RAMIREZ,"Y no sólo eso, sino que se metió a las profundidades de Cofepris, un día les detallaré el sentido metafórico de esto tiene un sentido muy real. Se metió a revisar rezagos de años que incluso transcienden el sexenio, había procesos de solicitud de autorización sanitaria de medicamentos, de equipos, de biológicos, de unidades operativas, de establecimientos comerciales que tenían años de rezago.",0.0,63,22,04,2021
HUGO LOPEZ-GATELL RAMIREZ,"Pero lo alarmante no es sólo el rezago y lo decimos enfática y abiertamente, lo alarmante era la discrecionalidad.",0.0,19,22,04,2021
HUGO LOPEZ-GATELL RAMIREZ,¿Qué quiere decir esto?,0.0,4,22,04,2021
HUGO LOPEZ-GATELL RAMIREZ,Algunos se les daba carretera rápida a otros la mayoría se les estancaba.,0.0,13,22,04,2021
HUGO LOPEZ-GATELL RAMIREZ,"Pero eso no es todavía lo más grave, sino que la razón por la que a unos se les daba carretera rápida era por corrupción, corrupción, franca, simple, llanamente, lo decimos, en Cofepris había un monstruoso procedimiento de corrupción, proceso de corrupción.",0.0,42,22,04,2021
HUGO LOPEZ-GATELL RAMIREZ,¿Qué implicaba eso?,0.0,3,22,04,2021
HUGO LOPEZ-GATELL RAMIREZ,Que de manera discrecional personal directivo del más alto nivel en Cofepris decidía quién pasaba rápido y quién no mediante ciertos estímulos.,0.0,22,22,04,2021
HUGO LOPEZ-GATELL RAMIREZ,"Hoy no pasa eso y tenemos enorme satisfacción y orgullo de que el doctor Svarch limpió, está limpiando todo ese procedimiento, poniendo reglas claras, estableciendo para todo mundo los mismos procedimientos y además -eso ya se anunciara, cuando lo culminemos- está un proceso de digitalización de trámites, es decir, ya no son sótanos llenos de carpetas de papel empolvándose, no es una metáfora lo que estoy diciendo, es una realidad, sino una plataforma electrónica que permitirá en todo momento y en tiempo real a los órganos de fiscalización del Ejecutivo o del Legislativo poder monitorear el procedimiento de trámite.",0.0,99,22,04,2021
HUGO LOPEZ-GATELL RAMIREZ,"Entonces, es un proceso complejo, yo creo que vamos a invitar un día al doctor Svarch o alguna de sus colaboradoras o colaboradores para que nos muestre justamente.",0.0,28,22,04,2021
HUGO LOPEZ-GATELL RAMIREZ,"Y respecto a protocolos de investigación clínica fue una de las primeras acciones que hizo el doctor en este proceso de limpieza tomando como referencia los estándares de procedimiento de la Agencia Europea de Medicamentos, que son de los más sobresalientes del mundo.",0.0,43,22,04,2021
HUGO LOPEZ-GATELL RAMIREZ,"No me acuerdo en este momento los tiempos, pero lo que antes se llevaba vamos a decir tres meses hoy se hace en tres semanas.",0.0,25,22,04,2021
HUGO LOPEZ-GATELL RAMIREZ,"HUGO LÓPEZ-GATELL RAMÍREZ: Años, los atrasos eran… Estamos hablando de 60 mil trámites con un promedio de cuatro o cinco años de retraso.",0.0,23,22,04,2021
HUGO LOPEZ-GATELL RAMIREZ,"HUGO LÓPEZ-GATELL RAMÍREZ: Esto es un daño muy grande y además para todas y todos, es un daño para las empresas privadas, porque obviamente les implica perder competitividad, perder dinero, porque no pueden empezar a vender sus productos cuando legítimamente han solicitado los trámites, pero además es un daño al patrimonio nacional, porque obviamente reduce el mercado de insumos para la salud a unas cuantas firmas o grupos de proveeduría, entonces eso daña al patrimonio nacional.",0.0,76,22,04,2021
HUGO LOPEZ-GATELL RAMIREZ,"HUGO LÓPEZ-GATELL RAMÍREZ: Por eso le digo, un día vamos a invitar al doctor, le podríamos dar semanas de conferencias de prensa exclusivamente de ese tema porque es muy basto, muy completo, pero el resumen es una monstruosa corrupción.",0.0,39,22,04,2021
HUGO LOPEZ-GATELL RAMIREZ,"Quiero aclarar, siempre que lo digo lo hago, siempre que menciono esto lo hago, que no era responsabilidad del personal de base, tenemos un gran respeto por el personal de base de Cofepris, igual que el resto de la Secretaría de Salud, que está muy entregado a su labor, se trataba de cuadros directivos de varias administraciones pasadas que han estado reciclándose, entrando, saliendo, saliendo hacia terceros autorizados, etcétera, etcétera.",0.0,70,22,04,2021
HUGO LOPEZ-GATELL RAMIREZ,"Muchas gracias, Juan.",0.0,3,22,04,2021
HUGO LOPEZ-GATELL RAMIREZ,"Creo que nos da tiempo de una última pregunta y quizá dos, si le damos a Otilia Carbajal.",0.0,18,22,04,2021
HUGO LOPEZ-GATELL RAMIREZ,"HUGO LÓPEZ-GATELL RAMÍREZ: Ya casi, probablemente el martes próximo, es un adelanto, todo depende que de que logremos pensamos que lo vamos a lograr, pero siempre pudiera haber un imprevisto y siempre hay que decir con toda franqueza que pudiera haber un imprevisto, ojalá que no sea el caso, en culminar la vacunación a personas adultas mayores.",0.0,57,22,04,2021
HUGO LOPEZ-GATELL RAMIREZ,"No queremos empezar con el segundo bloque, porque esto podría ser confuso al proceso de vacunación.",0.0,16,22,04,2021
HUGO LOPEZ-GATELL RAMIREZ,"En algunas entidades federativas ya hemos terminado a las personas adultas mayores y estaríamos ya en condiciones de empezar, pero preferimos que no haya este traslape de grupos prioritarios para que no se confunda a la población.",0.0,37,22,04,2021
HUGO LOPEZ-GATELL RAMIREZ,"Pero inmediatamente terminemos, nos falta muy poquito, podríamos anunciarlo, posiblemente el próximo martes en el Pulso de la Salud ya estaremos anunciando el inicio de vacunación en personas de 50 y más.",0.0,32,22,04,2021
HUGO LOPEZ-GATELL RAMIREZ,"HUGO LÓPEZ-GATELL RAMÍREZ: Claro, esa pregunta es relevante, es semejante a lo que comentábamos aquí para Grupo Fórmula. La asignación de vacuna depende cuánta vacuna hay y qué tamaño de población hay, y en todo momento tratamos de empatar hasta donde es posible la cantidad de personas con el tamaño del embarque, a veces no es posible y se hace de otra manera.",0.0,63,22,04,2021
HUGO LOPEZ-GATELL RAMIREZ,"Sin perder de vista el eje de la priorización, que es la edad, y también cobertura simultánea o lo más simultáneo que sea posible de las zonas rurales, las zonas urbanas, las zonas suburbanas, esto por un criterio fundamental que es la equidad social, la justicia social. En las zonas rurales apartadas, históricamente por décadas se ha vivido carencia de servicios, por lo tanto, restricción de derechos.",0.0,67,22,04,2021
HUGO LOPEZ-GATELL RAMIREZ,"Y nos interesa mucho que no se vuelva a dejar olvidadas a las comunidades rurales o las comunidades indígenas, como preguntaba ayer Marco Olvera, queremos que todas y todos estén integradas e integrados.",0.0,33,22,04,2021
HUGO LOPEZ-GATELL RAMIREZ,Muchas gracias.,0.0,2,22,04,2021
HUGO LOPEZ-GATELL RAMIREZ,"Creo que nos da tiempo, entonces, Otilia Carbajal, para una pregunta breve, son las 19:58.",0.0,15,22,04,2021
HUGO LOPEZ-GATELL RAMIREZ,"HUGO LÓPEZ-GATELL RAMÍREZ: Cómo no, gracias por preguntarlo, Otilia.",0.0,9,22,04,2021
HUGO LOPEZ-GATELL RAMIREZ,"Este es un tema efectivamente que causa inquietud, básicamente se los relato, en síntesis. Ya se están produciendo. Recuerden que las vacunas de AstraZeneca que serán envasadas en México o que están siendo envasadas en México, se fabrican a granel en una empresa argentina que está en Buenos Aires, la compañía mAbxience.",0.0,52,22,04,2021
HUGO LOPEZ-GATELL RAMIREZ,"Y ahí se exportan a México, vienen en contenedores muy grandes y después pasan a esta empresa Liomont, cuya planta está en Ocoyoacac, Estado de México, y se envasan. El proceso de envasado ha requerido varios elementos de calibración para que esté en los estándares de calidad más altos posibles.",0.0,50,22,04,2021
HUGO LOPEZ-GATELL RAMIREZ,"Durante un tiempo, un pequeño retraso de aproximadamente unos 10 y 12 días que tuvo que ver con la escasez mundial de unos filtros, de un componente muy específico del proceso de fabricación. Esto ya fue solventado hace varias semanas, más de un mes y medio, y ahorita ya se está en el proceso de envasado.",0.0,56,22,04,2021
HUGO LOPEZ-GATELL RAMIREZ,"Cofepris ya ha recibido el primero de cuatro lotes que se esperaba ya entrar al último elemento del proceso, ahora de la verificación sanitaria, y conforme se vayan produciendo y se vayan entregando a Cofepris se hace este proceso último que dura 18 días y se libera.",0.0,47,22,04,2021
HUGO LOPEZ-GATELL RAMIREZ,"Y todavía hay un paso adicional que hasta el momento la empresa, no Liomont, sino la empresa Astra en su matriz en Oxford está planteando que se necesitan unos días más para un proceso específico técnico que tiene que ver con la calidad del envasado.",0.0,45,22,04,2021
HUGO LOPEZ-GATELL RAMIREZ,"Entonces, la respuesta en síntesis, pero quise darle todos los elementos a usted y al público es: aún tenemos retraso y no hay una fecha precisa de liberación, en cuanto la tengamos lo haremos de conocimiento.",0.0,36,22,04,2021
HUGO LOPEZ-GATELL RAMIREZ,"Muchas gracias, aquí terminamos. Sigue la vacunación contra COVID, seguirá, hemos avanzado mucho y de manera muy expedita con la vacunación al personal educativo y se sigue vacunando a personal de salud de primera y segunda línea, y también a personas adultas mayores posiblemente para terminar muy pronto en lo que sigue de la semana.",0.0,55,22,04,2021
HUGO LOPEZ-GATELL RAMIREZ,Muchas gracias.,0.0,2,22,04,2021
HUGO LOPEZ-GATELL RAMIREZ,---,0.0,1,22,04,2021
