Participante,Texto,Sentimiento,Palabras,Dia,Mes,Anio
HUGO LOPEZ-GATELL RAMIREZ," Gracias, doctor Alomía.",0.0,3,15,04,2021
HUGO LOPEZ-GATELL RAMIREZ,"Hablemos de vacunación, continúa la vacunación, está avanzando a un ritmo ya bastante estable, por arriba de 500 mil dosis al día.",0.0,22,15,04,2021
HUGO LOPEZ-GATELL RAMIREZ,"Como pueden ver y lo hemos mostrado aquí, la distribución de las vacunas ocurre de acuerdo a los paquetes semanales, tenemos embarques semanales particularmente de la vacuna Pfizer, que es la que tiene embarques más regulares y eso nos permite enviar el paquete, lo que lleva más o menos unos cuatro días, o cinco a veces, según la complejidad de los sitios donde se entregan los insumos y las vacunas y a partir de ahí se abre el paquete y se empiezan a vacunar a las personas.",0.0,87,15,04,2021
HUGO LOPEZ-GATELL RAMIREZ,"Y estamos logrando, como ven, cada vez más alto, cada vez mayor cantidad en la cantidad de vacunas que se ponen cuando se abre el paquete y en los días que le siguen.",0.0,33,15,04,2021
HUGO LOPEZ-GATELL RAMIREZ,"Ya habíamos llegado a un récord de 535 mil vacunas y nos mantenemos por arriba de 500 mil. Hasta ayer a las 9:00 de la noche, recuerden que ahora informamos el corte de las nueve de la noche, pusimos 505 mil 338 en un día.",0.0,45,15,04,2021
HUGO LOPEZ-GATELL RAMIREZ,"En forma acumulativa, contadas desde el 24 de diciembre del año pasado, cuando empezó el programa de vacunación, ya llevamos 12 millones 917 mil 963 vacunas aplicadas.",0.0,27,15,04,2021
HUGO LOPEZ-GATELL RAMIREZ,"Lo vemos en su distribución por las distintas poblaciones específicas que estamos vacunando en las personas que trabajan en el sector salud en la primera línea tenemos 913 mil 326, el personal educativo, que esta cuenta es exclusivamente de Campeche, ya hemos anunciado que a partir del martes 20 de abril inicia la vacunación en las demás entidades federativas, primero con una lista de cinco entidades federativas que iniciarán este proceso.",0.0,71,15,04,2021
HUGO LOPEZ-GATELL RAMIREZ,"Estamos trabajando ahorita, justo venimos de la reunión del gabinete con el presidente en donde estamos afinando los distintos detalles para que arranque apropiadamente esto el 20 de abril.",0.0,29,15,04,2021
HUGO LOPEZ-GATELL RAMIREZ,"Y mañana tendremos el gusto de acompañar al presidente y a la secretaria de Educación Pública, la maestra Delfina Gómez Álvarez y presentaremos ya la lista, el orden en que se irán vacunando el personal educativo en las 32 entidades federativas.",0.0,41,15,04,2021
HUGO LOPEZ-GATELL RAMIREZ,"Por parte de las personas adultas mayores de 60 años, 60 años de edad y más, tenemos nueve millones 645 mil 656 que ya han recibido o bien esquemas con la primera dosis, siete millones y medio, o bien esquemas ya completos con las dos dosis o en el caso de la vacuna CanSino con la única dosis que se requiere para este esquema, dos millones 180 mil.",0.0,68,15,04,2021
HUGO LOPEZ-GATELL RAMIREZ,"Los Esavis, eventos supuestamente asociados a vacunación e inmunización, que es el monitoreo de la seguridad de la seguridad de las vacunas en su uso en condiciones reales no ha variado y la no variación es a partir de una frecuencia baja, una frecuencia baja lo cual es muy importante, porque nos va mostrando en la vida real que son vacunas seguras y desde luego son vacunas probadamente eficaces.",0.0,69,15,04,2021
HUGO LOPEZ-GATELL RAMIREZ,"Hoy tuvimos embarques, hoy tuvimos 500 mil dosis de la vacuna SinoVac, Coronavac es el nombre de la vacuna, SinoVac el nombre de la compañía china que la fabrica y hoy tuvimos 500 mil dosis en este embarque que llegó muy temprano en la mañana.",0.0,45,15,04,2021
HUGO LOPEZ-GATELL RAMIREZ,"Y, posteriormente, -tuvimos en la siguiente imagen, por favor- 487 mil 500 dosis de Pfizer-BioNTech del segundo de los embarques de esta semana.",0.0,23,15,04,2021
HUGO LOPEZ-GATELL RAMIREZ,"Tuvimos el lunes una cantidad semejante, hoy… Perdón, sí hoy tuvimos 487 mil y mañana recibimos de 375 mil también en la mañana, se presentará en el curso de la conferencia matutina el enlace directo como se hizo esta mañana.",0.0,40,15,04,2021
HUGO LOPEZ-GATELL RAMIREZ,"Esta es la distribución general, hasta el momento hemos recibido 17 millones 888 mil 350 dosis de vacuna, la gran mayoría ya fueron utilizadas, ya fueron aplicadas, la diferencia esto lo recordamos de cuando en cuando entre esta cantidad recibida y las que ya se aplicaron es precisamente las que están activamente aplicándose, ya están en las entidades federativas y se están poniendo, se estarán poniendo durante esta semana.",0.0,69,15,04,2021
HUGO LOPEZ-GATELL RAMIREZ,Esta es la distribución por tipo de vacuna y seguiremos recibiendo embarques de estas mismas vacunas que por el momento son las que están contratadas por el Gobierno de México.,0.0,30,15,04,2021
HUGO LOPEZ-GATELL RAMIREZ,"Hay una más, aquí está la panorámica del calendario, justamente vamos marcando en amarillo las que ya llegaron y en color gris las que están por llegar, ya recibimos este embarque, este embarque.",0.0,33,15,04,2021
HUGO LOPEZ-GATELL RAMIREZ,"Corrijo, hace rato dije otro número, es 328 mil 575 que se reciben mañana.",0.0,14,15,04,2021
HUGO LOPEZ-GATELL RAMIREZ,"Tenemos ya hoy, esta es noticia también, bueno, ya recibimos estas 500 mil de Sinovac y hace menos de dos horas Cofepris liberó ya estas 670 mil, por eso no está actualizado, porque fue apenas hace unos pocos minutos que fueron ya liberadas estas 670 mil.",0.0,46,15,04,2021
HUGO LOPEZ-GATELL RAMIREZ,"Entonces, tenemos casi los dos millones y medio que recibimos esta semana. Gracias.",0.0,13,15,04,2021
HUGO LOPEZ-GATELL RAMIREZ,"Vamos entonces a darle la palabra a nuestra compañera y compañero de las entidades federativas. Va a hablar primero la doctora Oliva López Arellano y posteriormente el doctor Javier Lozano Herrera, coordinador de Salud del Instituto de Salud del Estado de México.",0.0,42,15,04,2021
HUGO LOPEZ-GATELL RAMIREZ,"Doctor Oliva, por favor.",0.0,4,15,04,2021
HUGO LOPEZ-GATELL RAMIREZ," Muchas gracias, doctora López Arellano, secretaria de Salud de la Ciudad de México.",0.0,13,15,04,2021
HUGO LOPEZ-GATELL RAMIREZ,"Vamos a dar paso ahora a la siguiente presentación, que es a cargo del doctor Javier Lozano Herrera, coordinador de Salud del Instituto de Salud del Estado de México, quien representa al secretario de Salud de la entidad, el doctor Gabriel O'Shea.",0.0,42,15,04,2021
HUGO LOPEZ-GATELL RAMIREZ,"Doctor Lozano, si eres tan amable de compartirnos la experiencia del Estado de México.",0.0,14,15,04,2021
HUGO LOPEZ-GATELL RAMIREZ," Muchas gracias doctor Javier Lozano Herrera, coordinador de Salud del Instituto de Salud del Estado de México.",0.0,17,15,04,2021
HUGO LOPEZ-GATELL RAMIREZ,"Como comentábamos al inicio y lo comentábamos la semana pasada, cuando tuvimos el privilegio de tener por vía remota a nuestro compañero de Campeche, el propósito de esta modalidad de la sesión es tener un conocimiento más cercano al terreno, más cercano a la población.",0.0,45,15,04,2021
HUGO LOPEZ-GATELL RAMIREZ,"La Secretaría de Salud del Gobierno de México tiene una función normativa y excepto en el caso de los Institutos Nacionales de Salud y Hospitales de Alta Especialidad tiene acciones directas de atención de la salud, pero todo lo demás se articula o se ejecuta a partir o a través de las secretarías estatales de Salud.",0.0,56,15,04,2021
HUGO LOPEZ-GATELL RAMIREZ,"Me gustaría aprovechar la oportunidad con hacerles algunas preguntas a ambos, quizá podremos dividirnos el doctor Alomía y yo, y me gustaría empezar con una pregunta a la doctora López Arellano, en adelante el doctor Alomía podría preguntarle al doctor Lozano, si está de acuerdo, doctor.",0.0,46,15,04,2021
HUGO LOPEZ-GATELL RAMIREZ,"Estimada doctora, una cosa que creo que es notoria en el relato y en la forma en que se organizó la Ciudad de México para proveer servicios de salud no solamente los que ya estaban articulándose con una modalidad, con una visión diferente a partir de este importantísimo modelo Atención Primaria de Salud.",0.0,53,15,04,2021
HUGO LOPEZ-GATELL RAMIREZ,"Ayer en la conferencia participó nuestro grupo asesor, nuestro seminario permanente y hablábamos precisamente del énfasis que se ha puesto en la Atención Primaria de la Salud como el modelo de reorganización del sistema de salud que nos permite un mayor acercamiento comunitario.",0.0,43,15,04,2021
HUGO LOPEZ-GATELL RAMIREZ,"Y es notorio que en la Ciudad de México a lo largo de toda la respuesta de la pandemia ese ha sido el signo característico, el acercamiento a la comunidad. Lo fue cuando empezaron los primeros casos y los primeros retos de identificación con los estudios de brote, la epidemia el primer caso detectado fue aquí en la Ciudad de México; lo fue posteriormente rumbo al pico máximo de verano cuando ustedes tuvieron el reto de atender los brotes en, por ejemplo, mercados públicos de gran tamaño, la Central de Abastos; y lo es ahora lo cual no es sorpresa alguna, al contrario, es prueba de un trabajo muy congruente y muy consistente en la organización del operativo de vacunación.",0.0,120,15,04,2021
HUGO LOPEZ-GATELL RAMIREZ,"Pensando en las personas adultas mayores la vacuna es no solamente, como lo podría ser para el conjunto de la población, un mecanismo de protección biológica frente a la epidemia, sino también una modificación de la vida que se ha tenido en el último más de 12 o 14 meses, porque las personas adultas mayores son quizá quienes han tenido el confinamiento más intenso y más persistente.",0.0,67,15,04,2021
HUGO LOPEZ-GATELL RAMIREZ,"Las personas adultas mayores por su vulnerabilidad han tenido que estar prácticamente aisladas de su familia en algunos casos, de sus amigas y amigos, de su comunidad.",0.0,27,15,04,2021
HUGO LOPEZ-GATELL RAMIREZ,"Al ver las imágenes del video lo que vemos es desde luego ojos, caras, sonrisas, lágrimas que reflejan este cambio del estado de ánimo y que reflejan cómo las personas con la vacunación están encontrando el reinicio de su vida en comunidad.",0.0,42,15,04,2021
HUGO LOPEZ-GATELL RAMIREZ,"Entonces, me gustaría preguntarle: ¿qué recolección tiene el gobierno de la Ciudad de México y en particular la Secretaría de Salud, los servicios estatales de salud de esta experiencia de esperanza que tienen ahora las personas adultas mayores, supongo que en su momento las demás edades que serán vacunadas?",0.0,49,15,04,2021
HUGO LOPEZ-GATELL RAMIREZ," Muchas gracias, doctora López Arellano, secretaria de Salud de la Ciudad de México. Doctor Alomía, si quiere abordar la opinión del doctor Lozano.",0.0,23,15,04,2021
HUGO LOPEZ-GATELL RAMIREZ," Muchas gracias, doctor Lozano.",0.0,4,15,04,2021
HUGO LOPEZ-GATELL RAMIREZ,"Vamos a dar paso, siempre lamentamos mucho cuando tenemos invitadas, invitados, que el tiempo sea tan breve, pero desde luego podemos repetir sesiones con este propósito de ser incluyentes.",0.0,29,15,04,2021
HUGO LOPEZ-GATELL RAMIREZ,"Vamos a abrir a preguntas y comentarios, veo aquí ya la mano de… Ah, está pendiente usted, usted lleva unos días, vamos a darle paso a la compañera, nos vamos con Miguel, nos vamos con Marco Antonio.",0.0,37,15,04,2021
HUGO LOPEZ-GATELL RAMIREZ,Por favor.,0.0,2,15,04,2021
HUGO LOPEZ-GATELL RAMIREZ," Muchas gracias, Valeria, por sus preguntas.",0.0,6,15,04,2021
HUGO LOPEZ-GATELL RAMIREZ,"Brevemente, para darle paso a la doctora López Arellano, pondré el marco de referencia con lo que usted comenta en la perspectiva nacional.",0.0,23,15,04,2021
HUGO LOPEZ-GATELL RAMIREZ,"Efectivamente, la variabilidad de esta epidemia es muy impresionante. Por variabilidad nos referimos a que en distintos países o incluso al interior de países, en el caso nuestro al interior de las distintas entidades federativas el comportamiento de la epidemia es muy variante. Tenemos países en donde ha habido ya dos, tres o incluso cuatro olas epidémicas. A estas alturas, todo mundo identifica las olas epidémicas, son estos ciclos en los que se va presentando mayor intensidad de la epidemia, y luego disminuye y luego nuevamente aumenta.",0.0,87,15,04,2021
HUGO LOPEZ-GATELL RAMIREZ,"Empezamos el año y más o menos a mitad de enero los países europeos occidentales empezaron a tener mayor actividad epidémica y algunos han tenido ya terceras y cuartas olas que superan -un poco en relación a la otra pregunta- el tamaño o la intensidad epidémica, el número de casos, el número de personas hospitalizadas y lamentablemente fallecidas de lo que tuvieron en las olas previas.",0.0,66,15,04,2021
HUGO LOPEZ-GATELL RAMIREZ,"El tiempo que ha trascurrido entre una ola y la siguiente y la siguiente es muy variable entre países, aun países que podrían ser semejantes en tamaño poblacional, en ingresos, en movilidad, en estilos de vida, etcétera.",0.0,37,15,04,2021
HUGO LOPEZ-GATELL RAMIREZ,"Lo mismo está ocurriendo desde finales de enero en América Latina, particularmente América del Sur; hay varios países que volvieron a tener oleadas epidémicas, en este caso son segundas olas y sólo algunos tienen terceras olas.",0.0,36,15,04,2021
HUGO LOPEZ-GATELL RAMIREZ,"En este momento, Estados Unidos y Canadá ya tienen también una tendencia ascendente, aumentan los casos en estas dos naciones; afortunadamente, todavía no con la intensidad que ha ocurrido ya en las otras naciones.",0.0,34,15,04,2021
HUGO LOPEZ-GATELL RAMIREZ,"Tomando en cuenta esto y el monitoreo que hacemos todos los días de la epidemia en México y en el mundo, anunciamos justo desde febrero que habría que estar preparados para una posible tercera ola. Esto lo destacamos en particular antes de la Semana Santa ante la posibilidad de que la movilidad de las personas, -esto lo abordará la doctora López Arellano- de las personas fuera de su localidad y hacia otros estados pudiera facilitar o favorecer que se presentara un repunte de la epidemia.",0.0,85,15,04,2021
HUGO LOPEZ-GATELL RAMIREZ,"Hace una semana comentamos el caso de Chihuahua, también mencionamos a Baja California Sur, en este momento Guerrero también es una entidad que nos preocupa en ese sentido. Hay algunas entidades federativas que están teniendo no una reducción, sino un aumento.",0.0,41,15,04,2021
HUGO LOPEZ-GATELL RAMIREZ,"Aquí lo que vemos es la necesidad de sumar esfuerzos, subir esfuerzos y sobre todo, como hemos dicho, tener una noción de lo que importante que es el trabajo técnico precisamente de las secretarías de Salud. En la Secretaría de Salud los equipos técnicos de epidemiología, de salud pública, tienen mucha experiencia acumulada y hay que escuchar cuáles son las indicaciones o las recomendaciones que en este momento le hacen a sus gobernadores, gobernadoras, porque hay que tomar decisiones que seguramente tienen que ver con reducir la movilidad.",0.0,88,15,04,2021
HUGO LOPEZ-GATELL RAMIREZ,"Le doy la palabra a la doctora López Arellano, si es tan amable.",0.0,13,15,04,2021
HUGO LOPEZ-GATELL RAMIREZ," Gracias, doctora López Arellano.",0.0,4,15,04,2021
HUGO LOPEZ-GATELL RAMIREZ,"Vámonos aquí con Miguel y, si nos da tiempo, también con Marco Antonio Olvera.",0.0,14,15,04,2021
HUGO LOPEZ-GATELL RAMIREZ," Muchas gracias, Miguel. Desafortunadamente se nos acabó el tiempo, son las 8:00 de la noche en punto, ojalá que pueda venir mañana Marco y empieza usted.",0.0,26,15,04,2021
HUGO LOPEZ-GATELL RAMIREZ,"Y agradecemos muchísimo a la doctora Oliva López Arrellano, al doctor Javier Lozano, quien representa a la Ciudad de México, al Estado de México, en esta acción concertada de la nación mexicana en la respuesta a la epidemia, y en este momento en el programa de vacunación contra COVID.",0.0,49,15,04,2021
HUGO LOPEZ-GATELL RAMIREZ,Seguimos. Muchas gracias.,0.0,3,15,04,2021
HUGO LOPEZ-GATELL RAMIREZ,---,0.0,1,15,04,2021
