Participante,Texto,Sentimiento,Palabras,Dia,Mes,Anio
RICARDO CORTES ALCALA," Muchas gracias, doctor López-Gatell.",0.0,4,7,05,2020
RICARDO CORTES ALCALA,"Muy buenas tardes, noches, a todas y todos.",0.0,8,7,05,2020
RICARDO CORTES ALCALA,"Muchas gracias a todos los que están en casa, todavía quedándose en casa, que cada vez sean un poquito más. A todas, amigas, amigos, muchísimas gracias.",0.0,26,7,05,2020
RICARDO CORTES ALCALA,"Hoy lo que voy a presentar es sobre el contacto ciudadano, las diferentes formas que tenemos de mantener un contacto directo para ofrecer la mejor información a las personas que están en casa.",0.0,33,7,05,2020
RICARDO CORTES ALCALA,"Tenemos, primero, el sitio www.coronavirus.gob.mx, que ha llegado a tener 16 millones 180 mil 967 diferentes usuarios desde que se lanzó, con un total de visitas de más de 33 millones.",0.0,31,7,05,2020
RICARDO CORTES ALCALA,Los últimos botones que hemos puesto para diferente información es el del Instituto Nacional de los Pueblos Indígenas. Muchísimas gracias a este instituto por ayudarnos a traducir el material disponible que hemos diseñado en conjunto en diferentes dependencias de la administración pública federal y con el apoyo también de organizaciones de la sociedad civil que hemos trabajado y que ahora también están disponibles en diferentes idiomas y en diferentes variantes de los idiomas de lengua indígena que tenemos en nuestro país.,0.0,81,7,05,2020
RICARDO CORTES ALCALA,"Asimismo, el vínculo al sitio de datos personales seguros con el que trabajamos con el Instituto Nacional de Acceso a la Información Pública y de estos 16 millones de usuarios el 96 por ciento se encuentra en nuestro país y el restante cuatro por ciento distribuido en todo el mundo, en segundo lugar, los Estados Unidos de América con 1.3 por ciento de las personas que visitan el sitio.",0.0,69,7,05,2020
RICARDO CORTES ALCALA,"Lo que estamos viendo es también en el sitio www.coronavirus.gob.mx, la pestaña de datos abiertos, muy, muy importante, algo que, como ya lo hemos dicho, no se había hecho en el Sistema Nacional de Vigilancia Epidemiológica, a través de la dirección general de epidemiología se abren los datos abiertos nominales con la ayuda también del Instituto Nacional de Acceso a la Información Pública en donde con la protección de los datos personales lo que se ofrece a la población, a los investigadores, a los dateros, que han estado muy activos en el análisis de esta información, se ofrece información anonimizada lo más profunda que se pueda, no tenía… que se pueda de acuerdo a la ley.",0.0,116,7,05,2020
RICARDO CORTES ALCALA,"No tenían un identificador único, lo solicitó la ciudadanía a través de Twitter, se hizo un identificador único para darle seguimiento.",0.0,21,7,05,2020
RICARDO CORTES ALCALA,Han estado también en contacto a través de las cuentas de diferentes redes sociales haciéndonos saber algunas inconsistencias que se dan en el manejo de los datos.,0.0,27,7,05,2020
RICARDO CORTES ALCALA,"Es importante saber que, como el doctor Alomía ya lo ha presentado, los datos que nosotros presentamos en este sitio de datos abiertos son los datos que los estados ingresan al sistema de información.",0.0,34,7,05,2020
RICARDO CORTES ALCALA,"Si en ese registro hay una discrepancia o hay algún error que después el propio servidor público del estado en el que trabaja solicita la rectificación del dato, porque registró una defunción cuando no había defunción o registró un dato, una persona que decía ser caso ambulatorio, pero que estaba hospitalizado o que falleció, con el tipo de cosas que las mismas autoridades estatales van solicitando a la autoridad en epidemiología encabezada por el doctor José Luis Alomía para que se rectifiquen los datos.",0.0,84,7,05,2020
RICARDO CORTES ALCALA,"Así también es que con estos abiertos la gente, los analistas, ustedes como reporteras y reporteros también pueden analizar los datos que hay y hacer también sus notas y análisis que requieran.",0.0,32,7,05,2020
RICARDO CORTES ALCALA,"Este tablero de datos que tiene datos estatales y municipales, que tiene una forma de tablero de control en donde uno puede dar click en cada uno de los estados para que haga un acercamiento y se abra los datos municipales, además tiene una barra de tiempo que podemos ver aquí. Este es un ejemplo, esta página puede seguir bajando, pero si esta barra de tiempo nosotros la ampliamos se van abrir los datos completos para poderlos visualizar en ese mismo momento desde el mes de abril que inició con nuestro primer caso confirmado.",0.0,94,7,05,2020
RICARDO CORTES ALCALA,Hemos recibido más de dos millones y medio de personas que día con día han entrado a visitar este sitio y en donde también en este botón se puede descargar la base de datos abierta.,0.0,35,7,05,2020
RICARDO CORTES ALCALA,"Y en este mapa HD es en donde entra también un mapa de alta definición con datos municipales y en el comparativo es cómo podemos entrar y es cómo han entrado a analizar y a comparar, uno selecciona Ciudad de México y pone los datos de Ciudad de México; si también selecciona junto con Ciudad de México, Jalisco, Nuevo León o los estados que ustedes así lo requieran, se va graficando por encima uno de los datos, cada uno de los estados que ustedes quieren ver y comparar.",0.0,88,7,05,2020
RICARDO CORTES ALCALA,"Susana Distancia, el chat de Susana Distancia sigue activo, 165 mil, básicamente 164 mil personas han chateado con Susana y con esta interacción se han respondido más de tres millones de mensajes, continuamos con una satisfacción superior al 70 por ciento y en pláticas y en trabajos con la empresa que nos da este servicio de WhatsApp para poder mejorar, tanto las preguntas como el rendimiento de esta aplicación.",0.0,69,7,05,2020
RICARDO CORTES ALCALA,"Si en los próximos segundos ustedes en casa le toman foto a este código QR, los llevará a descargar el contacto de Susana Distancia, si no el teléfono, recuérdenlo, es: 55 86 33 85 89.",0.0,35,7,05,2020
RICARDO CORTES ALCALA,"Otra forma de contacto ciudadano es a través de las redes sociales y aquí lo que queremos presentar son las seis publicaciones con mayor impacto en las redes sociales que hemos tenido y la verdad es que orgullosamente una de las más importantes, con un impacto en más de 20 millones de personas es la presentación de la guía para la protección de la salud de las personas con discapacidad que se hizo este conteo el 1º de mayo, pero también, en general, son las conferencias de prensa de todos los días a las 19 horas las que más visitan ha tenido, más impacto.",0.0,104,7,05,2020
RICARDO CORTES ALCALA,"Esto nos da mucho gusto porque quiere decir que quienes o tienen oportunidad de ver en vivo la conferencia pueden y han accedido a través de las redes sociales a verla por primera vez o si tienen también ustedes, como reporteros y reporteras, alguna duda, están todas en la página de coronavirus.gob.mx para poder revisar con detenimiento lo que aquí se dice todos los días a las 19:00 horas.",0.0,69,7,05,2020
RICARDO CORTES ALCALA,"La aplicación Covid-19 MX, que está disponible en los tres sistemas operativos para dispositivos móviles han tenido, hemos tenido más de 400 mil descargas de esta aplicación y con esto, por ejemplo, los datos que en las personas van dejando de contacto y de su estado de salud.",0.0,48,7,05,2020
RICARDO CORTES ALCALA,Hemos visto cómo el 30 por ciento de las personas que han entrado se han registrado y hay utilizado los servicios de esta plataforma para tener más información para saber cuáles son los grupos de mayor riesgo.,0.0,37,7,05,2020
RICARDO CORTES ALCALA,"El 30 por ciento padece obesidad, muy similar, muy parecido a los resultados de la Encuesta Nacional de Salud y Nutrición 2018, al igual que el 13.2 por ciento de personas que reportan presentar presión arterial alta de las personas que han utilizado la aplicación.",0.0,45,7,05,2020
RICARDO CORTES ALCALA,El 7.8 por ciento reportan padecer o vivir con diabetes y poco menos del uno por ciento han sido personas en estado de embarazo quienes han utilizado el servicio de la aplicación Covid19Mx.,0.0,33,7,05,2020
RICARDO CORTES ALCALA,"Finalmente, uno de los primeros, de las primeras formas que se utilizaron para el contacto ciudadano el teléfono 800 0044 800 en los últimos 14 días se han recibido un total de 81 mil 575 llamadas. Esto lo podemos ver en un sistema de seguimiento que generó la Dirección General de Tecnologías de Información. Muchísimas gracias a su titular y a todo su equipo que nos brinda esta información valiosísima de contacto ciudadano.",0.0,73,7,05,2020
RICARDO CORTES ALCALA,"De estas 81 mil, 23 mil 528 personas colgaron, esto es importante decirlo, porque esto también tiene un costo, un costo también monetario, cada llamada que las personas hacen, pero que no se cuelga o que no presionan una de las opciones válidas son estas 20 mil, tienen un costo, es un costo que se pagan con los impuestos de todos nosotros.",0.0,62,7,05,2020
RICARDO CORTES ALCALA,"Los invitamos a seguir haciendo este número de llamadas, pero a utilizar la información. Si necesitan información marquen 1, si van a reportarse como un caso sospechoso de COVID, marquen dos, si quieren reportar alguna otra enfermedad marquen 3, si requieren de apoyo emocional marquen 4.",0.0,46,7,05,2020
RICARDO CORTES ALCALA,"De todas estas 81 mil llamadas se van derivando de acuerdo a estas opciones y lo más importante que queremos comentar ahorita es que seis mil 228 personas solicitaron información básica sobre coronavirus que pudieron también haber encontrado en coronavirus.gob.mx, pero que probablemente no tienen o un acceso a internet o acceso a un dispositivo móvil o a una computadora, o son personas que viven con alguna discapacidad que nos les permite utilizar otros recursos y el teléfono 800 0044 800, también puede ser otra opción.",0.0,86,7,05,2020
RICARDO CORTES ALCALA,"Treinta y seis mil 929 se reportaron como sospechosas de COVID, dijeron: ‘Creo yo tener infección por SARS-CoV-2’, cuatro mil 983 personas reportaron tener síntomas graves y se derivaron a 911 para atención de urgencia y seis mil 619 reportaron tener algún malestar emocional y buscar ayuda. Estas llamadas se derivaron a la Línea de la Vida que también atiende la estrategia de Juntos por la Paz, en donde se les brinda atención sicológica 24 horas, siete días a la semana.",0.0,81,7,05,2020
RICARDO CORTES ALCALA,"Por favor, llamen, sabemos que la Jornada Nacional de Sana Distancia puede ser, puede tener y ha tenido un impacto en la salud mental de todas las familias mexicanas y yo creo que, sin el menor temor a equivocarme, de todo el mundo, y nosotros tenemos esta herramienta que es la línea de la vida, que se puede acceder a través del 800 0044 800 y la opción que corresponda o directamente a la línea de la vida.",0.0,78,7,05,2020
RICARDO CORTES ALCALA,Muchísimas gracias.,0.0,2,7,05,2020
