Participante,Texto,Sentimiento,Palabras,Dia,Mes,Anio
PREGUNTA," Doctor Cortés. Héctor García, de Diario Basta y Grupo Cantón.",0.0,10,26,02,2021
PREGUNTA,"Dos preguntas. Una, el segundo municipio más poblado del Estado de México, Nezahualcóyotl, sus adultos mayores están alzando la voz y la mano para preguntar cuándo les tocaría a ellos tomando en cuenta que ya está siendo Ecatepec.",0.0,38,26,02,2021
PREGUNTA,"Y la segunda, tomando en cuenta que la población mexicana está recibiendo dosis de diferentes farmacéuticas con diferente porcentaje de inmunidad, ¿las autoridades de salud están llevando a cabo algún análisis, algún estudio, alguna información que recaben que en los próximos meses determinen qué vacuna se inclinaría la autoridad mexicana, el gobierno mexicano para aplicarla en una segunda vuelta en el transcurso de los próximos años?",0.0,66,26,02,2021
PREGUNTA," Gracias, doctor. Soy Jaime Arizmendi, de la Agencia Informativa Argón México y de la Conferencia Nacional de Empresarios de Medios.",0.0,20,26,02,2021
PREGUNTA,"La pregunta es: estamos a punto de cumplir un año de que se registrara el primer caso de contagio en México y quisiera saber, más allá de las cifras que de repente se dan y que por otro lado algunos medios publican también de manera insistente, más allá de eso, si existe alguna visión, algún repaso general de parte de la Secretaría de Salud, de parte del gobierno de la República.",0.0,71,26,02,2021
PREGUNTA,"Y por otro lado también preguntarle, de una vez, para no quedarme con el micrófono, preguntarle también si existe alguna campaña preplaneada, pensada para dar a conocer los buenos efectos de esas vacunas, porque todavía hay mucha gente que le tiene temor, que le tiene pánico, le tiene desconfianza y eso es importante que la gente conozca bien a bien cuáles son los efectos positivos de esta vacuna.",0.0,68,26,02,2021
PREGUNTA,Gracias.,0.0,1,26,02,2021
PREGUNTA, Jaime.,0.0,1,26,02,2021
PREGUNTA," Hola a todas y a todos. Soy Nury Fernández, de La Caracola.",0.0,12,26,02,2021
PREGUNTA,"Yo sé que aquí se está haciendo un esfuerzo que abarca también a las personas que están en condiciones más vulnerables; por ejemplo, en el caso de los adultos mayores llegar a las zonas más alejadas, a las comunidades indígenas, a la gente que no tiene siempre un acceso a los servicios de salud y ustedes están haciendo una estrategia que va dirigida primero a ellos y luego a los centros urbanos.",0.0,72,26,02,2021
PREGUNTA,"Pero en el mundo está sucediendo una cosa muy diferente. Como han insistido en las conferencias de la mañana, 70 países están recibiendo el 20 por ciento de las vacunas y solo 10 países concentran la mayor parte de las vacunas y 120 países no han recibido ninguna dosis.",0.0,49,26,02,2021
PREGUNTA,"Entonces, la pregunta es la siguiente es un poco… Se han hecho dos propuestas para resolver esta situación de manera digamos más a largo plazo. La primera apareció en la revista Science de este mes en que se plantea que haya una vacuna universal, es decir, algo así me imagino, como que colaboraran todo los que están ya con una propuesta de vacuna para poder saber cuál es la mejor y que se adopte esta universalmente. Esa una propuesta.",0.0,79,26,02,2021
PREGUNTA,"Y la otra propuesta lo hicieron India y Sudáfrica en la Organización Mundial de Comercio y el presidente Alberto Fernández, de Argentina, la hizo aquí en la mañanera para llevarla al G-20, que es que se abra la propiedad intelectual de las vacunas y que entonces países que tienen capacidad farmacéutica pueda producir vacunas y esto haga que haya muchísimas más dosis en el mundo.",0.0,65,26,02,2021
PREGUNTA,"La pregunta es ¿perdería seguridad, eficacia una vacuna en estas condiciones?",0.0,11,26,02,2021
PREGUNTA, ¿Y aquí existe esa capacidad farmacéutica si se liberara la propiedad intelectual?,0.0,12,26,02,2021
PREGUNTA, Muy bien. Gracias.,0.0,3,26,02,2021
PREGUNTA," Gracias. Buenas noches. Liliana Noble, de Pulso Saludable.",0.0,8,26,02,2021
PREGUNTA,"Doctor Cortés, me gustaría saber si están ya en pláticas o se ha pensado envasar la vacuna de Sputnik V en el país y si esta negociación va a llevar algún tiempo o ya sería un hecho. Esta sería una primera pregunta.",0.0,42,26,02,2021
PREGUNTA, Gracias.,0.0,1,26,02,2021
PREGUNTA,"Y también me gustaría saber, hoy decía la jefa de Gobierno en su conferencia de prensa que, aunque cuando estamos en semáforo naranja con esta advertencia, ya se piensan abrir, reanudar algunos giros como los cines, los teatros, algunos gimnasios.",0.0,40,26,02,2021
PREGUNTA,"Adicional a las medidas que usted nos ha hecho favor de explicarnos y que ya entendería que tienen en consideración estos lugares ¿cuál sería su recomendación para para no estigmatizar a estos lugares, que finalmente son lugares que ofertan un beneficio social y también para los empleadores y los dueños?",0.0,50,26,02,2021
PREGUNTA,"Y para los que ahora estén autorizados en asistir ¿cuál sería o qué tendrán que tener en cuenta para saber que están sanos y salvos, adicional a las medidas sanitarias que deberíamos de tener todos?",0.0,35,26,02,2021
PREGUNTA, Y la salud del doctor Gatell.,0.0,6,26,02,2021
PREGUNTA," Gracias. Buenas noches. Arturo Contreras, de Pie de Página.",0.0,9,26,02,2021
PREGUNTA,"Con la aprobación de la FDA de la vacuna de Johnson & Johnson, pues saber qué pasó con la oferta que había hecho esta farmacéutica al gobierno mexicano de surtir de vacunas.",0.0,32,26,02,2021
PREGUNTA,"Y saber si se tiene como una prospectiva de qué otras vacunas se podrían empezar a contratarse o si las que se tienen ya son las que se van a estar contratando, comprando. Nada más.",0.0,35,26,02,2021
PREGUNTA," Buenas noches, doctor, José Luna, CX Agencia de Información, integrante de Coneme.",0.0,12,26,02,2021
PREGUNTA,Aquí en México hubo un gran laboratorio dependiente de la Secretaría de Salud. Sería muy importante que ante esta situación de crisis se planeara restituirlo.,0.0,25,26,02,2021
PREGUNTA," Restituirlo, o sea nuevamente, que…",0.0,5,26,02,2021
PREGUNTA," Laboratorio farmacéutico, hubo un laboratorio farmacéutico dependiente de la Secretaría de Salud.",0.0,12,26,02,2021
PREGUNTA, No recuerdo exactamente el nombre.,0.0,5,26,02,2021
PREGUNTA, Muchas gracias.,0.0,2,26,02,2021
PREGUNTA," Gracias. Buenas noches, buenas noches, doctor Ricardo Cortés. Le mandamos un saludo al presidente López Obrador y celebramos que el doctor Hugo López-Gatell también se encuentre mejorando.",0.0,27,26,02,2021
PREGUNTA,"Quisiera preguntarle, doctor, las vacunas que se tiene contemplado que lleguen el día de mañana y el próximo martes, ¿ya tienen algún lugar designado para que se apliquen?, ¿ya van a ser dirigidas hacia algún municipio diferente?",0.0,37,26,02,2021
PREGUNTA,"Y una segunda pregunta, el día de ayer, bueno, la noche de ayer que se explicó acerca de la forma molecular que tenía este coronavirus y las diferentes mutaciones, me hizo preguntarme en qué constante, por ejemplo, se tendría que contemplar qué característica necesita tener el virus para que una vacuna no surta efecto en él, porque sale la malinformación de que luego una vacuna ya no es eficaz contra la variable y la mutación, y que volvía a mutar. Quisiera saber si ya se sabe que la vacuna sí es eficaz contra este virus y las mutaciones, y las variables que han salido, ¿qué necesita tener el virus para que la vacuna no surta efecto?",0.0,116,26,02,2021
PREGUNTA," La primera, si ya tienen destinados los puntos de las vacunas que van a llegar.",0.0,15,26,02,2021
PREGUNTA," Gracias, doctor.",0.0,2,26,02,2021
PREGUNTA,"Y una última pregunta ¿cómo va la vacunación en Ecatepec? Quisiera saber si pudieran dar algún tipo de informe o relación ya a los adultos mayores que se vacunaron y los que faltan por vacunarse, qué tipo de desarrollo ha dado la vacuna ahí en ese municipio.",0.0,47,26,02,2021
PREGUNTA, Buenas noches. Rogelio Martínez.,0.0,4,26,02,2021
PREGUNTA,"Mi pregunta es la siguiente, ¿los que ya tuvimos la enfermedad al momento de vacunarnos tenemos los mismos beneficios, tenemos alguna contradicción o no hay ninguna contradicción al momento de vacunarnos?",0.0,31,26,02,2021
PREGUNTA," Entonces, ¿casi no hay contradicciones?",0.0,5,26,02,2021
PREGUNTA, Muchas gracias.,0.0,2,26,02,2021
PREGUNTA, (Inaudible),0.0,1,26,02,2021
PREGUNTA," Doctor, pregunta constantemente la gente qué toman en consideración para decidir qué vacuna va a qué municipio o a qué alcaldía; por ejemplo, me dice Ricardo Flores que le llama la atención que Sinovac se aplicó en Ecatepec y él piensa que tiene que ver con un asunto político.",0.0,49,26,02,2021
PREGUNTA,"Pero no es la primera pregunta que tengo al respecto, hay quienes me han preguntado por qué Sputnik V en Xochimilco, por ejemplo, qué características o por qué deciden cuál en un lugar. Ya nos habían explicado un poquito por el tema de la red de frío, no sé si sea ese el único elemento a considerar para decidir cuál vacuna va a cuál localidad.",0.0,65,26,02,2021
